"","id","dateDream","dream","nightmare","mood","content","datetime","dayCounter","n_epi","n_eve","n_sit","dreamSocSit","dreamSocInt","multi","realMulti","inter","nAva2sin","nAva3sin","nAva4sin","nAva5sin","nAva2gro","nAva3gro","nAva4gro","nAva5gro","nAvaUns","famAva","unfAva","unsAva","wordcount","wordPerSit","sitPerEve","evePerEpi","n_socEve","dateEMA","rses_1","rses_2","rses_3","rses_4","propEMAsocSit","propEMAsocInt","excl","rses_totalMean","rses_1sd","rses_2sd","rses_3sd","rses_4sd","socSitSd","socIntSd","exclSd","rses_totalSd","compliance","propDreamSocSit","propDreamSocIntOld","propDreamSocIntOld2","propDreamMulti","propDreamTypeV","propDreamSocIntOld3","propDreamSocInt","propDreamSocEvent"
"1","SB12HL","2023-11-02",1,2,4,"Ich war in meinem Traum in einer Interviewsituation. An die einzelnen Fragen kann ich mich nicht erinnern, nur dass die Frage: „Wie geht es Ihnen?“ immer wieder aufkam, was uch nach einiger Zeit komisch fand. Zu Beginn habe ich versucht darauf witzig zu reagieren, später war ich von der immer selben Frage genervt.  Wer mich interviewt hat weiß ich nicht. Es war aber eine Frau. Ansonsten kamen keine anderen Personen in meinem Traum vor. Ich habe alles konsequent außerhalb meines Körpers gesehen, konnte mich also die ganze Zeit beobachten.",1698910980,1,1,1,4,3,3,3,3,3,0,0,0,3,0,0,0,0,0,0,0,3,93,23.25,4,1,1,"2023-11-02",6.42857142857143,6.28571428571429,1.42857142857143,2.14285714285714,43,35.4285714285714,4.14285714285714,4.07142857142857,0.786795792469443,0.755928946018455,0.534522483824849,1.57359158493889,50.4612062215454,37.3267426155259,1.0690449676497,0.188982236504614,1,0.75,1,0.75,0.0846774193548388,0.75,1,0.75,1
"2","SB12HL","2023-11-03",1,2,3,"In meinem Traum musste ich meine Mensakarte aufwerten. Am Automaten gab es aber keine sinnvollen Beträge: entweder viel zu hoch oder viel zu niedrig. Ich konnte einen Dauerauftrag einrichten, aber ich hatte Sorge, dass ich ihn vergesse und für immer zahlen würde. Daher habe ich sie nicht aufgewertet.",1699006020,2,1,1,2,0,0,0,0,0,0,0,0,0,0,0,0,0,0,0,0,0,48,24,2,1,NA,"2023-11-03",5.5,6,1.66666666666667,1.83333333333333,58.6666666666667,50.8333333333333,4.66666666666667,3.75,1.97484176581315,1.26491106406735,1.211060141639,0.983192080250175,35.9481107523979,29.5121443928879,1.211060141639,0.316227766016838,0.857142857142857,0,NA,0,0,0,NA,0,NA
"3","SB12HL","2023-11-04",2,-77,-77,"-66",1699091460,3,NA,NA,NA,NA,NA,NA,NA,NA,NA,NA,NA,NA,NA,NA,NA,NA,NA,NA,NA,NA,NA,NA,NA,NA,NA,"2023-11-04",5.14285714285714,5.57142857142857,1.28571428571429,2.57142857142857,52.8571428571429,37.5714285714286,4.57142857142857,3.64285714285714,1.4638501094228,1.2724180205607,0.755928946018454,1.13389341902768,48.9299791246926,35.3782284409359,0.975900072948533,0.28347335475692,1,NA,NA,NA,NA,NA,NA,NA,NA
"4","SB12HL","2023-11-05",1,2,3,"Ich habe in meinem Traum einige Freunde zum Essen in meine neue Wohnung eingeladen. Kurz bevor sie gekommen sind ist mir ekngefallen, dass ich noch einkaufen muss. Ich habe daher einen der Freunde angerufen mir dabei zu helfen.   Die Umgebung und auch meine Wohnung waren allerdings entsprachen allerdings nicht wirklich meiner neuen Nachbarschaft und Wohnung. Im Traum wusste ich, dass ich in Berlin bin, wobei es dafür keine eindeutigen Indizien gab. Ich wusste es einfach und es kam mir nicht merkwürdig vor, nur dass ich mich in der Umgebung gar nicht zurechtgefunden habe, hat mich im Traum verwirrt. Mit dem Freund, den ich zuvor angerufen habe bin ich dann einkafen gegangen. Der Supermarkt war sehr verwinkelt und hatte ungewöhnliche Snacks. Bedonders ins Auge ist mir eine Süßigkeit gefallen, die aussah wie ein Eis, allerdings war die Eiskugel eigentlich ein Marshmallow und war blau.   Plötzlich war ich wieder zu Hause und meine Freunde waren da. Sie sahen aber nicht wirklich aus wie meine Freunde, waren also fremde rein fiktive Charaktere (Bis auf den Freund, der mit mir einkaufen gegangen ist, der sah wirklich aus wie einer meiner Freunde). Wir haben dann Brettspiele gespielt, es war allerdings eine mittelmäßige Stimmung.  Alle wirkten irgendwie müde und lustlos. Das hat mich enttäuscht. ",1699179900,4,1,3,8,3,3,2,0,1,3,0,0,0,1,0,0,0,0,4,0,0,208,26,2.66666666666667,3,3,"2023-11-05",5.85714285714286,6.71428571428571,1.28571428571429,1.57142857142857,0,0.571428571428571,3.85714285714286,3.85714285714286,1.4638501094228,0.487950036474267,0.487950036474267,0.786795792469443,0,1.51185789203691,0.377964473009227,0.196698948117361,1,0.375,1,0.375,3.5,0,0.333333333333333,0.125,1
"5","SB12HL","2023-11-06",1,2,2,"In meinem Traum habe ich zuerst mit meinen Eltern gesprochen. Im Gespräch hat sich herausgestellt, dass ich anscheinend vergessen hatte, dass ich mit einer Freundin zusammen nach Rom reisen wollte. Die Reise würde morgen beginnen und ich war dafür zuständig mich um alles zu künmern, hatte aber gar nichts vorbereitet. Also musste ich spontan Hotels, Zugverbindungen etc. Buchen, was mich sehr gestresst hat. Meine Eltern waren ein bisschen sauer und die Freundin, der ich meinen Fauxpas beichtete, auch, obwohl ich bis dahin schon alles in Ordnung gebracht hatte.   Mir war alles sehr unangenehm und der Traum hat sich insgesamt eher negativ angefühlt. Alle Charaktere im Traum waren die ebenfalls gestresst und negativ gestimmt.",1699265460,5,1,2,5,2,1,1,1,1,1,0,0,0,1,0,0,0,0,2,0,0,113,22.6,2.5,2,2,"2023-11-06",6.5,6.66666666666667,1,1.5,41.6666666666667,25.8333333333333,4.33333333333333,3.91666666666667,0.547722557505166,0.516397779494322,0,0.547722557505166,43.6928674575916,25.9724212707762,0.816496580927726,0.129099444873581,0.857142857142857,0.4,0.5,0.2,0.0387096774193549,0.2,0.5,0.2,1
"6","SB12HL","2023-11-07",2,-77,-77,"-66",1699350360,6,NA,NA,NA,NA,NA,NA,NA,NA,NA,NA,NA,NA,NA,NA,NA,NA,NA,NA,NA,NA,NA,NA,NA,NA,NA,"2023-11-07",6.14285714285714,6.57142857142857,1.14285714285714,1.71428571428571,43,28.8571428571429,5.42857142857143,3.89285714285714,0.377964473009227,0.534522483824849,0.377964473009227,0.755928946018455,46.543886100468,36.7714951714349,1.39727626201154,0.133630620956212,1,NA,NA,NA,NA,NA,NA,NA,NA
"7","SB12HL","2023-11-08",1,2,4,"Ich habe im Traum mit meinem besten Freund telefoniert, wir habe über alles mögliche gesprochen und uns beide dabei angenehm gefühlt.",1699449600,7,1,1,1,1,1,1,1,1,1,0,0,0,0,0,0,0,0,1,0,0,21,21,1,1,1,"2023-11-08",5.5,5.83333333333333,1.83333333333333,2.33333333333333,22.1666666666667,12.6666666666667,4.16666666666667,3.875,0.836660026534076,1.47196014438797,0.983192080250175,0.516397779494322,40.3505472907948,18.8325958557674,0.408248290463863,0.440170421541475,0.857142857142857,1,1,1,0.0789473684210524,1,1,1,1
"8","SB12HL","2023-11-09",1,2,4,"Ich war mit einigen Freunden in einer Art Club. Als wir dort ankamen war der Club noch relativ leer, weshalb wir uns erstmal ins Foyer vor dem Tanzraum gesetzt haben.   Dann betrat eine alte Schulfreundin von mir den Raum. Sie trug ein rotes sehr edles Kleid, das etwas zu edel für den Anlass erschien. Wir haben uns beide sehr gefreut winander wieder zu sehen. Sie ist dann relativ schnell in den Tanzraum mit ihrer Begleitung gegangen. Da habe ich bemerkt, dass ich den Jungen vom Hochschulsport kannte. Ich habe versucht ihn auf mich aufmerksam zu machen, aber reagierte nicht auf mich und ging ebenfalls in den Tanzraum.   Meine anderen Freunde und ich sind im Foyer geblieben.",1699531140,8,1,1,5,4,3,2,1,2,3,0,0,0,1,0,0,0,0,4,0,0,116,23.2,5,1,1,"2023-11-09",6.16666666666667,6.66666666666667,1.33333333333333,1.5,41,21.5,4.5,3.91666666666667,0.408248290463863,0.516397779494322,0.516397779494322,0.547722557505166,42.8905584015876,33.2550748006977,0.836660026534076,0.204124145231932,0.857142857142857,0.8,0.75,0.6,0.0930232558139535,0.2,0.5,0.4,1
"9","SB12HL","2023-11-10",2,-77,-77,"-66",1699603020,9,NA,NA,NA,NA,NA,NA,NA,NA,NA,NA,NA,NA,NA,NA,NA,NA,NA,NA,NA,NA,NA,NA,NA,NA,NA,"2023-11-10",5.16666666666667,5,3,3,86.8333333333333,58.6666666666667,3.16666666666667,4.04166666666667,1.60208197875972,2,2,2,21.2642109344943,23.8131616268539,0.983192080250175,0.332290033956281,0.857142857142857,NA,NA,NA,NA,NA,NA,NA,NA
"10","SB12HL","2023-11-11",2,-77,-77,"-66",1699687800,10,NA,NA,NA,NA,NA,NA,NA,NA,NA,NA,NA,NA,NA,NA,NA,NA,NA,NA,NA,NA,NA,NA,NA,NA,NA,"2023-11-11",5.14285714285714,5.57142857142857,1.85714285714286,2.57142857142857,74.7142857142857,51,3.71428571428571,3.78571428571429,1.4638501094228,1.81265393434993,1.4638501094228,1.13389341902768,35.4387466187048,43.3474336033865,1.25356634105602,0.487950036474267,1,NA,NA,NA,NA,NA,NA,NA,NA
"11","SB12HL","2023-11-12",1,1,1,"Traum 1:  Ich habe geträumt, dass einer meiner Li blingscomedians plötzlich aufhört und ich noch nie auf einer Show von ihm war, was much sehr gestresst hat.  Traum 2:   Ich war ein Kind und lebe vor etwa 100 Jahren. Im Traum hat mich mein Lehrer in der Schule stark misshandelt, was mir Angst gemacht hat. Er hat mich auch an meinem Penis berührt. Der Lehrer war rein fiktiv und hatte keine Ähnlichkeit mit einer mir bekannten Person. Mitschüler/inner sind im Traum nicht aufgetaucht.",1699778700,11,2,2,2,1,1,0,0,1,0,0,1,0,0,0,0,0,0,0,1,0,83,41.5,1,1,1,"2023-11-12",5.71428571428571,5.71428571428571,1.57142857142857,1.85714285714286,50,47.1428571428571,4.14285714285714,3.71428571428571,1.25356634105602,1.25356634105602,0.786795792469443,1.0690449676497,50,50.3005254161709,0.690065559342354,0.267261241912424,1,0.5,1,0.5,0,0,1,0.5,0.5
"12","SB12HL","2023-11-13",1,2,2,"ich bin im Traum in eine neue tennis mannschaft gekommen: wir waren insgesamt zu dritt, die anderen beiden jungen waren aber viel besser als ich. Wir musste eine art zirkeltraining machen und ich war sehr schlecht. Nach dem training hat uns der trainer ( ein vater einer der jungen) nach hause gefahren. Er hat mich gefragt ob ich mut auf die trainingsreise will, ich habe zugesagt aber habe gemerkt dass alle enttäuscht waren dass ich mitkomme. Das war mir dann peinlich und ich bin bevor wir bei mir zu Hause angekommen sind schon ausgestiegen",1699861980,12,1,2,5,5,3,2,1,2,0,1,4,0,0,0,4,0,0,0,9,0,96,19.2,2.5,2,2,"2023-11-13",5.71428571428571,6,2,2,24.8571428571429,19.8571428571429,5.28571428571429,3.92857142857143,1.70433620649269,1.82574185835055,1.4142135623731,1.4142135623731,40.5603606633725,34.3143729430714,1.11269728052837,0.237797432802835,1,1,0.6,0.6,0.100719424460431,0.2,0.4,0.4,1
"13","SB12HL","2023-11-14",2,-77,-77,"-66",1699950060,13,NA,NA,NA,NA,NA,NA,NA,NA,NA,NA,NA,NA,NA,NA,NA,NA,NA,NA,NA,NA,NA,NA,NA,NA,NA,"2023-11-14",6.14285714285714,6.42857142857143,2,1.71428571428571,26.8571428571429,15.5714285714286,5.14285714285714,4.07142857142857,0.377964473009227,0.534522483824849,1.82574185835055,0.487950036474267,38.455292533142,29.2338681603897,0.690065559342354,0.426084051623173,1,NA,NA,NA,NA,NA,NA,NA,NA
"14","SB12HL","2023-11-15",1,2,3,"Ich selbst bin im Traum nicht aufgetaucht. Ich habe von einer Familie im 20 Jahrhundert geträumt. Der Vater hat sich hochgearbeitet und war Richtwr, der Sohn wurde kriminell und der Vater musste ihn irgendwann vor Gericht verklagen, was ihn gebrochen hat. Die Geschichte hat mich im Traum traurig gemacht ",1700029320,14,1,2,4,2,1,0,0,1,0,0,2,0,0,0,0,0,0,0,2,0,51,12.75,2,2,2,"2023-11-15",6,6.4,1.4,1.8,50.6,27.2,4.6,3.9,0.707106781186548,0.547722557505166,0.547722557505166,0.447213595499958,50.0179967611659,25.371243564319,0.547722557505166,0.136930639376292,0.714285714285714,0.5,0.5,0.25,0,0,0.5,0.25,1
