"","id","dateDream","dream","nightmare","mood","content","datetime","dayCounter","n_epi","n_eve","n_sit","dreamSocSit","dreamSocInt","multi","realMulti","inter","nAva2sin","nAva3sin","nAva4sin","nAva5sin","nAva2gro","nAva3gro","nAva4gro","nAva5gro","nAvaUns","famAva","unfAva","unsAva","wordcount","wordPerSit","sitPerEve","evePerEpi","n_socEve","dateEMA","rses_1","rses_2","rses_3","rses_4","propEMAsocSit","propEMAsocInt","excl","rses_totalMean","rses_1sd","rses_2sd","rses_3sd","rses_4sd","socSitSd","socIntSd","exclSd","rses_totalSd","compliance","propDreamSocSit","propDreamSocIntOld","propDreamSocIntOld2","propDreamMulti","propDreamTypeV","propDreamSocIntOld3","propDreamSocInt","propDreamSocEvent"
"1","AJ04SE","2023-10-21",2,-77,-77,"-66",1697863620,1,NA,NA,NA,NA,NA,NA,NA,NA,NA,NA,NA,NA,NA,NA,NA,NA,NA,NA,NA,NA,NA,NA,NA,NA,NA,"2023-10-19",5.57142857142857,6.42857142857143,1,2.42857142857143,31.1428571428571,22.4285714285714,4.85714285714286,3.85714285714286,0.534522483824849,0.534522483824849,0,0.534522483824849,35.4703095157465,25.1121294919218,0.899735410842437,0.133630620956212,1,NA,NA,NA,NA,NA,NA,NA,NA
"2","AJ04SE","2023-10-22",1,2,2,"Ich kam zur Arbeit (dm) und alle waren da,  es gab aber nichts zu tun und dann haben sich die Schüler, die bei uns arbeiten  beschwert, dass alles doof ist und sie eigentlich nur eine Bescheinigung haben wollen (kriegt man wohl, wenn man als Minderjähriger eine bestimmte Zeit dort arbeitet( zumindest in meinem Traum)) und sogar schon länger dort angestellt sind,  als sie eigentlich müssten für diese Bescheinigung  und dm eigentlich nur einen großen Gefallen damit tun. Sie waren dementsprechend sehr sauer, dass es so unorganisiert war und es nichts zu tun gab.  Ich bin dann mit dem Aufzug runter zur Chefin gefahren und habe gefragt was zu tun ist (ich hatte aus irgendeinem Grund eine leere Weichspüler Flasche in der Hand). Sie hat mir gesagt ich soll nur vorziehen, also die Sachen von hinten nach vorne ins Regal schieben, aber wir waren plötzlich nicht mehr bei dm, sondern es waren plötzlich Klamotten und kein dm mehr.      Danach war ich noch bei meinem Vater und es war total komisch und sehr angespannt weil meine Stiefoma gestorben war. Ich war in meinem Zimmer und lag eine Zeit lang regungslos auf dem Boden oder schaute aus dem Fenster. Es strahlte die Sonne und zwei Kinder kamen von der Schule heim und gingen ins Haus neben uns. Mein Zimmer sah genauso aus wie es ist, unaufgeräumt und voller Geräte meiner Schwester und Stiefmutter und Vater, also komplett zugestellt und nicht so als wäre ich richtig erwünscht. Der Rest des Haus war jedoch viel größer als das Eigentliche und hatte auch viel höhere Decken, fast wie ein Schloss. Ich ging durch irgendeine Tür und kam direkt ins Wohnzimmer. Meine Schwester und Stiefmutter schienen nicht da zu sein, denn ich traf nur meinen Vater im Wohnzimmer an und wie bereits erwähnt  war die Stimmung „angespannt“, traurig o.ä.    Darauffolgend war ich in einem Auto auf der Autobahn. Das war irgendwie ein unangenehmer Teil des Traumes. Es war grau und nass auf der Autobahn und es ist zwar nichts passiert, aber mein Traumich fühlte sich stark überfordert an ein, zwei Stellen. Da waren viele Abfahrten mit sehr viele Spuren, die es vermutlich so in Realität gar nicht gibt, aber ich musste dann hin und her wechseln. Ich war zwar gefühlt allein auf der Autobahn, also war es nicht irgendwie bedrohlich, aber trotzdem war es grundlegend unangenehm. Vor Allem weil es entweder sehr steile Berge waren (die Abfahrten) oder Unterführungen/ Tunnel in denen ich die Spuren durchwechseln musste.    Ich ging dann auf eine Party mit sehr vielen Leuten (auch zwei Freundinnen aus der Uni von mir waren dabei, Marie und Sophia) und ich bin hingefahren und habe dann auf einem Baumarkt/Einkaufszentrum Parkplatz geparkt. Drumherum waren auf jeden Fall überall Läden. Bäcker, Baumarkt, Einkaufszentrum,… .  Von dem Parkplatz aus konnte man auch direkt in das Einkaufszentrum durch große Türen hineingehen, was aber von innen dann kein Zentrum, sondern die Wohnung war, die sehr sehr groß war und die Treppenhäuser alleine schon total breit.   Wir haben dann gefeiert, viel getrunken und auf einmal war ich unten im Keller bei einem Spiel, mit zwei anderen Mädels, die ich erstmal nicht kannte.   Wir haben gewonnen und wollten wieder hoch gehen,  als das blonde Mädchen schnippisch meinte „man sieht deinen Slip“. Ich habe ihr dann erklärt, dass es dicke Baumwolle ist, und man das natürlich sieht, es aber auch gesünder ist  und sie hat nur abfällig gelacht. Ich habe dann gesagt „meinem Freund gefällt es“, weil ich erkannt habe, dass es seine Exfreundin ist. Danach wollte ich hochgehen und habe  zwei mal die Tür nicht aufbekommen.  Mein fester Freund war dann plötzlich auch auf der Party aber wir haben kein Wort gewechselt,obwohl er auf der Couch neben ein paar Jungs saß und ich daneben stand. Stattdessen bin ich Sophia suchen gegangen, die plötzlich weg war und mit so einem Typen ein Spiel gespielt hat. Sie hat mir eine Dunkin Donuts Box in die Hand gedrückt, die ich mit Marie ins Auto bringen wollte, doch wir haben das Auto nicht gefunden. Oben trafen wir ein anderes Mädchen, die ich aus der Schule kannte und früher eine gute Freundin war(Alina). Wir setzten uns mit ihr in einem großen Raum auf ein graues Sofa. Niemand außer uns war da und man konnte direkt auf den Parkplatz schauen (es schien die Sonne obwohl es eigentlich Nacht war). Sie aß ein Eis, in dem sie herumrührte bis es eine matschige Masse wurde und wir unterhielten uns bis ich wieder runtergehen wollte. Alina hatte keine Lust, weil sie einfach nicht zur Party wollte und Marie blieb dann auch da. Also ging ich alleine. Ich hatte plötzlich einen Becher mit Schokopudding in der Hand und rutschte die Treppen (absichtlich) auf meinem Po hinunter. Im Party Raum nahm ich ein Löffel Schokopudding und stelle ihn irgendwo ab als Sophia  auf mich zu kam. Ich war sehr betrunken, zumindest kicherte ich viel und fühlte mich so, obwohl ich gar nicht so viel getrunken hatte und auch sie machte irgendwelche Geräusche und schaute mich erwartungsvoll an. Sie fragte, ob ich jemanden gut fände und deutet mit dem Kopf in eine bestimmte Richtung. Ich sagte ich fände Leute gut aussehend aber mehr nicht, da mein fester Freund hier sei. Ein Typ kam dann dazu und fragte ob wir nun mitkommen wollten (wohin weiß ich nicht) und Sophia sagte einfach zu ihm, anstatt zu antworten, ich fände seinen Freund hübsch, hätte aber selbst einen festen Freund, weshalb es leider nichts werden würde. Dann sagte der Junge wir könnten dann aus Respekt vor meinem festen  Freund nicht mit ihnen mitkommen. Als dann seine beiden Freunde neben ihm auftauchten sah ich Sophia misstrauisch an und fragte um welchen der beiden es geht. Es ging um einen etwas stabileren jungen mit blauen Pulli und dunklen Haaren. Ich schüttelte den Kopf und sagte darum müssten sie sich keine Sorgen machen, da ich ihn nicht hübsch fand.    Zwischendurch saß ich einmal auf einem Tisch vor dem Sofa auf dem mein fester Freund saß und es wurde immer ein Lied angemacht und drei Leute standen vorne und mussten performen. Das habe ich mir angesehen.      Danach, kurz bevor ich wach wurde, hörte ich die Stimme meiner Mutter, die darüber redete, dass mein Cousin wohl in einer schwierigen Phase wäre. Jemand fragte, ob er aggressive Schübe hätte oder wie das gemeint ist und sie sagte aggressiv wäre er noch nicht, aber da würden wir bestimmt auch noch hinkommen.",1697953620,2,5,12,35,22,16,11,6,11,12,1,6,0,2,1,4,0,0,14,12,0,1083,30.9428571428571,2.91666666666667,2.4,11,"2023-10-20",4.28571428571429,4.42857142857143,3,4,78.1428571428571,56.8571428571429,4.85714285714286,3.92857142857143,1.38013111868471,2.37045304088641,2.51661147842358,1.63299316185545,30.0911314256575,28.3691650178415,1.0690449676497,0.278174320132093,1,0.628571428571429,0.727272727272727,0.457142857142857,0.193467336683417,0.171428571428571,0.5,0.314285714285714,0.916666666666667
"3","AJ04SE","2023-10-23",1,2,3,"Auf meinen Uhren standen verschiedene Zeiten. Auf meinem Handy die richtige Zeit, die ich vermutete. 9 Uhr irgendwas und auf meinem Backofen 11 Uhr irgendwas, obwohl meine Vorlesung schon um 10 began. Dies verwirrte mich enorm und letzendlich kam ich tatsächlich zu spät zur Uni, jedoch nicht um ganze Stunden, sondern es war eher sehr knapp, deshalb fuhr mich meine Mutter hin und parkt das Auto auf dem Seitenstreifen bei Subway. Sie ließ mir den Schlüssel dort, damit ich auch nach Hause fahren konnte und dann ging ich los. Wie sie nach Hause gekommen ist, weiß ich nicht. Vor dem Vorlesungssaal standen noch alle Kommilitonen und tatsächlich traf ich dort meine Nachbarn an, die auch ihr Kind im Kinderwagen dabei hatten und ebenfalls zur Vorlesung wollten. Wir unterhielten uns kurz bis mein Nachbar dann meinte, er fände meine Aussage mit dem „kein BH anhaben“ sehr gut und mutig. Erst jetzt bemerkte ich, dass ich unter meinem weißen Shirt noch keinen BH trug, musste ich vergessen haben in der Eile. Ich rannte zu meinen Freunden und sagte es ihnen , während alle anderen in den Raum gingen. Ich öffnete meinen Rucksack und fand zufällig einen BH darin, den ich schnell versuchte unauffällig unter das Shirt zu ziehen. Alle anderen waren immerhin schon fast drin und nur noch wir standen eigentlich vor der Tür, also dachte ich es wäre unauffällig, als plötzlich ein Singen ertönte. Ich schaute hoch und dort standen vier junge Männer auf einer Art Empore (sah etwas aus wie der Limbecker Platz, wenn man einfach von unten in höhere Etage schaut), die gleich angezogen waren und sangen. Ich stockte mitten beim Anziehen und merkte, dass sie mich beobachteten, während sie sangen. Und bis ich den BH dann letzendlich anhatte und wir eintraten in den Raum, sangen sie weiter und ließen mich, aber auch meine Freunde, nicht aus den Augen, während wir uns darüber amüsierten und die Aufmerksamkeit irgendwie in dem Falle gar nicht so schlimm fanden. Ich hatte dann meine erste Vorlesung des Tages, in einem sehr sehr kleinen Raum und ich bekam  keine Sekunde von der Vorlesung mit. Wir saßen zu viert in einer 6er Reihe, neben mir auf der linken Seite zwei Fremde. Da wir eigentlich zu sechst waren suchte ich die anderen beiden. Sie saßen hinter uns und ich wollte Marie (die mir am nähsten  stehende der Freundinnen, die auch neben mir saß) fragen, warum sie nicht bei uns saßen, tat es glaube ich auch, aber erinnere mich nicht mehr genau an den Hergang. Der Raum war  klein, heruntergekommen und gelb angestrichen. Die Tische dafür recht neu. Wir saßen genau schräg zur Tafel, wir konnten also nicht viel sehen und auch eher wenig hören, da die Dozentin von der Tafel weg, also den anderen gegenüberstehend, sprach. Es war auch sehr komisch weil es eher eine interaktive Übung als eine Vorlesung war. Danach habe ich eine weitere Vorlesung gehabt, die ich eigentlich nie aufeinanderfolgend hätte. Ich wollte vorher noch kurz Nachhause. Ich hatte zwar nur 30 Minuten und eigentlich ein geparktes Auto, aber ich entschied mich zu laufen. Eigentlich wohne ich mit dem Auto schon 15 Minuten entfernt, dementsprechend müsste es zu Fuß doch sehr lange dauern, doch ich schaltete meine Navigation an und diese sagte mir, ich würde durch einen querfeldein Weg nur zwei Minuten brauchen. Tatsächlich funktionierte das auch und ich kam zuhause an. Dort machte ich einige Sachen bis ich sah, dass es schon nach zwölf war und die Vorlesung um 12:15 begann. Ich nahm meine Sachen und wollte los, doch ich hatte mir nicht überlegt wie ich zurückkommen wollte. Ich wollte erst mit dem Auto fahren, doch dann würde ich keinen Parkplatz finden und wenn ich weiter weg parken würde, dann würde ich es nicht pünktlich schaffen. Außerdem stand das Auto meiner Mutter dann dort umsonst. Ich entschied mich also dafür, wieder zu laufen und es wurden wieder zwei Minuten Fußweg angezeigt, doch entweder lief ich in die falsche Richtung oder nach zwei Minuten stand ich noch immer fast an meiner eigenen Wohnungstür. Ich drehte mich öfter im Kreis um die richtige Richtung herauszufinden, doch ich schaffte es nicht und mein Verstand sagte mir bereits, dass es niemals zwei Minuten bis zur Uni sein könnten (auf dem Weg nach Hause hatte sich mein Verstand aber nicht gemeldet und es einfach für plausibel gehalten). Ich ging also aus dem Haus. Es regnete stark und ich überlegte erst loszulaufen und in Kauf zu nehmen zu spät zu kommen, denn es war bereits 12:11, als ich die Stimme meines Stiefvaters hörte. Ich könnte ihn nicht lokalisieren, darum rief ich ihn an. Es klingelte einige Mal, bis ich ihn entdeckte, obwohl sein Ton gar nicht angeschaltet war. Er stand direkt gegenüber bei unseren ehemaligen Nachbarn (wohnen nicht mehr dort) und unterhielt sich mit ihnen, war aber nun auf dem  Rückweg zu unserem Haus, weshalb ich ihn jetzt sah. Er wünschte mir einen guten Morgen und ich erklärte ihm die Situation. Ich war schon völlig gestresst, denn ich hasse es zu spät zu kommen. Ich fragte ihn, ob er mich fahren könne, damit ich zumindest nicht alles verpasse und er sagte „ja klar, wann denn?“ Ich sagte, dass ich eigentlich in drei Minuten da sein müsste. Er nickte, aber wir gingen trotzdem erst noch einmal rein und er zog sich noch entspannt um. Ich schrieb meinen Freunden, dass ich zu spät kommen würde. ",1698033120,3,1,7,28,15,8,4,3,7,13,0,1,0,4,0,1,0,0,17,2,0,915,32.6785714285714,4,7,5,"2023-10-21",5.85714285714286,7,1.14285714285714,2.14285714285714,55.8571428571429,43,5.42857142857143,4.03571428571429,0.377964473009227,0,0.377964473009227,0.690065559342354,46.0450090361904,36.5832384205299,1.39727626201154,0.172516389835589,1,0.535714285714286,0.533333333333333,0.285714285714286,0.0930232558139535,0.107142857142857,0.466666666666667,0.25,0.714285714285714
"4","AJ04SE","2023-10-24",1,2,3,"Ich war bei meinen Eltern im Garten, dann wollten sie, dass ich bei ihnen übernachte. Als ich dann auf der Schlafcouch lag war es komplett hell und meine Mutter kam noch einmal herein, weil sie dachte es ging mir nicht gut und als sie reinkam fühlte ich mich wie in Trance und dachte ich wäre noch im Garten, sah den Sonnenschirm und eine Spinne unter dem Schirm und wollte, dass meine Mutter die Spinne entfernt.",1698148680,4,1,1,4,2,2,0,0,2,2,0,0,0,1,0,0,0,0,3,0,0,79,19.75,4,1,1,"2023-10-22",5.42857142857143,5.57142857142857,1.28571428571429,2.71428571428571,31.2857142857143,19.1428571428571,4.57142857142857,3.75,0.534522483824849,0.534522483824849,0.487950036474267,0.487950036474267,39.262850489635,21.7288485001589,0.975900072948533,0.144337567297406,1,0.5,1,0.5,0,0,1,0.5,1
"5","AJ04SE","2023-10-25",1,2,4,"Ich war mit meinem Papa in Frankfurt, dort sah es aus wie in New York, nicht nur ein paar Hochhäuser, sondern NUR Hochhäuser. Wir wollten uns dann etwas zu essen holen und der Essenssaal sah aus wie die Kantine bei Ikea. Ich wollte auch, dass er ein paar Fotos von mir macht, aber stattdessen war ich so geflasht von der Aussicht, dass ich selbst total viele Fotos machte, während er sich etwas zu essen kaufte. Plötzlich wurde es draußen laut, ein Flugzeug kam angeflogen und hinten heraus kam eine Schrift. Es entstand eine Art Lichtershow, wo Schriftzüge und Bilder aus dem Flugzeug kamen wie Feuerwerk. Es ging mehr oder weniger darum, dass man sich selbst lieben sollte und um Planeten(hatte keinen Zusammenhang zueinander so richtig). Ich versuchte es mit dem Handy aufzunehmen und lehnte mich sehr weit gegen das Glas des towers. Es war aber sehr hoch und ich hatte Angst rauszufallen obwohl dort Glas zur Absicherung war. Die Show war dann zu Ende und ich stellte mich zu meinem Vater, der sagte, „du machst ja die ganze Zeit selbst Fotos ich dachte ich soll welche von dir machen.“ Kurz darauf merkte ich, dass ich von der Show nichts aufgenommen hatte, weil ich nicht auf aufnehmen geklickt hatte und war sehr enttäuscht. Mein Vater kaufte sich essen und auf dem Weg zu einem Tisch sah er dann aber noch etwas Leckeres und nahm einfach das ganze Tablette in der Gebäckauslage mit. Er sagte er würde nur das eine essen und den Rest zurückstellen. Wir gingen zu einem Tisch und er meinte, „setz dich hier auf die Bank. Ich mache Fotos von dir.“ Auf der Bank saßen aber zwei ältere Damen, also setzte ich mich woanders auf die Lehne eines Tisches, er machte ein Foto von mir, als plötzlich wieder die Show losging und ich schnell ein richtiges Video machen wollte. Das tat ich auch und mein Papa begann zu essen. Ich sah wie eine der Kellnerinnen des Restaurants zu einer anderen sagte „guck mal wie gierig die Leute sind, es hat jemand die ganze Gebäckschublade genommen. Sie legte neue Sachen hinein und ich sagte es meinem Vater, sodass er die Alten zurückbringen konnte, aber er aß entspannt einfach weiter.     Ich stand mit meinem festen Freund in einer anderen Sequenz in einer Schlange, vor uns zwei „Reality Stars“, die oft im deutschen Fernsehen zu sehen sind. Ich konnte sie nicht leiden, wusste aber, dass meine Cousine den Mann kannte. Also zog ich meinen Freund eins Stück weg und  erzählte ihm aufgeregt, dass der Typ vor uns ein Reality Star sei und aufs Leibniz Gymnasium gegangen war und er sich früher auch mal mit meiner Cousine und ihren Freunden getroffen hat. Jetzt sei er  ein Reality Star (zwar mit schlechten Ruf, aber er war einer). Mein Freund schaute mich nur irritiert an.     In einer anderen Traumsequenz ging es darum, dass auf meiner Arbeit etwas gestohlen wurde, von einem der Mitarbeiter und wir alle dort bleiben mussten bis es rausgefunden wird.",1698229140,5,3,6,20,13,7,3,2,6,10,1,1,0,0,0,1,0,0,10,3,0,508,25.4,3.33333333333333,2,4,"2023-10-23",5.85714285714286,6.14285714285714,1.28571428571429,2.28571428571429,43.5714285714286,26.7142857142857,5,3.89285714285714,0.377964473009227,0.899735410842437,0.487950036474267,0.487950036474267,34.6836039210515,19.9308327783386,1,0.133630620956212,1,0.65,0.538461538461538,0.35,0.112299465240642,0.1,0.461538461538462,0.3,0.666666666666667
"6","AJ04SE","2023-10-26",1,2,3,"Ich war mit einem großen Team an Menschen im Urlaub in England. Vermutlich Tanzteam, da es viel ums Tanzen ging.  Dort war ich ein bisschen sowas wie die rechte Hand der Trainerin, was mich gefreut hat. Ich durfte ihr immer beim aufbauen helfen, teilweise auch beim entscheiden.   An einem Tag kam Taylor Swift uns dann besuchen und hat sich dann für mich entschieden ihre Tänzer zu koordinieren und Tänze für die auszudenken, weil ich das so gut machen würde. Ich sollte das machen ohne ihren Tanz oder die restliche Bühnenkonstellation zu kennen. Ich suchte mir fünf Leute aus oder bekam sie gestellt, (das weis ich nicht mehr) die alle älter als ich waren. Zum Großteil nur Frauen, aber in den verschiedensten bodytypes und so weiter. Ich freute mich darauf, dass Konzert von hinter der Bühne „mitzuplanen“ und zu erleben, weil kurz davor eine Mitkoordinatorin eines anderen Konzertes auf Instagram gepostet hatte, dass es nicht cooleres gab, als ein Konzert Backstage mitzuerleben und dort Verantwortung zu tragen.    Wir waren jedenfalls sehr viele im Team, die dort waren und somit war es auch irgendwie schwer alle auf ein Foto vor einem Feuer zu bekommen. (Das wollte die Trainerin nämlich unbedingt machen).    Danach hatte ich ungefähr wieder denselben Traum. Nur, dass ich dieses Mal mit einer etwas kleineren Gruppe in ein Ferienhaus in England gefahren bin. Dieses Mal kann ich nicht genau sagen warum. Wir sind aber dort angekommen, haben in großes Feuer angezündet und für zwei Leute wurde der Grill angezündet, weil nicht alle ums Feuer gepasst haben. Ich habe wieder der Trainerin/ Vorgesetzten, was auch immer, geholfen, denn wir sind zusammen in die Garage gegangen, um Sachen zu holen. Ich sollte ihr Papier, einen Stift, eine Vorlage von etwas (ich weiß nicht mehr was), einen Radiergummi und Schere holen. Überraschenderweise stand direkt vor meiner Nase eine Box mit entsprechenden Dingen drin, nur das keiner der Stifte funktionierte, was merkwürdig war. (Es waren die Stifte, die ich ihm wahren Leben immer damals bei meinen Uropa und Uropa zum malen bekommen hatte). Die Chefin kam dann wieder und ich dachte mir, dass ich zu langsam sei, weshalb ich sagte „keiner der Stifte funktioniert/ „schwierig einen zu finden, wenn keiner der Stifte funktioniert“).  Danach schaute ich kurz von der Suche hoch und in der Garage umher, die sehr aufgeräumt schien. Ich sagte: „nicht, dass es so endet wie letztes mal und alles vollgestellt wird.Hier sind ja viele Parkplätze drin, die werden sonst verschenkt.“ Ich schaue weiter auf den Boden wo  Parklinien eingezeichnet waren, die auf mindestens acht Parkplätze schließen ließen (sehr groß also). Ich sagte dies zu ihr, obwohl ich gar nicht wusste ob es dieselbe Vorgesetzte war wie die, als ich das letzte Mal dort war, aber scheinbar war es so, denn sie sagte sie habe extra Möbel bestellt, damit es organisierter und aufgeräumter sein konnte dieses Mal. Auf einmal hörte ich eine fremde Stimme. Ein fremder Mann sprach in gebrochenem, unfreundlichen Deutsch, „wem denn hier das Haus gehören würde.“ Plötzlich hörte ich meine Mutter, meine Tante und meine Oma. Es war also auf einmal meine Familie die dort draußen am Feuer war und keine Tanzgruppe mehr. Sie versuchten ihm zu erklären, dass es irgendwo vorne am Haus stand, wem es tatsächlich gehörte und sie nur im Urlaub waren, doch der Mann verstand es nicht. Er behaarte darauf, dass das entweder ihr Haus sein musste oder eben nicht und sie dann fälschlich hier waren. Er war wahrscheinlich so etwas wie ein englischer Beamter, hörte sich zumindest so fest und steif an und beharrte darauf, dass er wissen wolle, wer hier „wirklich“ wohne. Er lies nicht locker und wollte den sehen, der hier die Verantwortung hat.  Es kam zu keiner Klärung, denn mein Wecker klingelte. Einige Sekunden dachte ich tatsächlich es wäre in meinem Traum die Türklingel des Hauses, aber dann merkte ich, dass es mein Wecker war.    Außerdem spielte eine frühere Freundin aus der Schule, die ich letztens auf dem Uni Campus wieder traf eine Rolle und bevor ich den Traum mit dem Ferienhaus hatte, spielte sich mein Traum in einem sehr neuen Parkhaus ab und ich weiß, dass der Parkhausteil, der einzige Teil des Traumes war, der mir unangenehm vorgekommen ist. Das Parkhaus war zwar sehr lichtdurchflutet und hell an einigen Stellen, an anderen aber auch komplett vermauert wie eben eine Tiefgarage und dort fühlte ich mich unwohl. Obwohl alle Plätze frei waren, dort war wirklich kein anderes Auto zu sehen, hatte ich sogar aus dem Auto heraus ein schlechtes gefühl, während ich die steilen Abfahrten hinunter fuhr. (was genau aber passierte sowohl im Parkhaus als auch mit der Freundin, weiß ich nicht mehr)",1698302580,6,4,7,20,16,12,5,0,7,1,8,2,5,0,1,1,5,0,1,12,10,780,39,2.85714285714286,1.75,6,"2023-10-24",5.85714285714286,6.28571428571429,1.28571428571429,2.28571428571429,68,48,5.71428571428571,3.92857142857143,0.377964473009227,0.755928946018455,0.487950036474267,0.487950036474267,30.0832179129826,20.2977831301844,0.951189731211342,0.121987509118567,1,0.8,0.75,0.6,0.104166666666667,0,0.4375,0.35,0.857142857142857
