"","id","dateDream","dream","nightmare","mood","content","datetime","dayCounter","n_epi","n_eve","n_sit","dreamSocSit","dreamSocInt","multi","realMulti","inter","nAva2sin","nAva3sin","nAva4sin","nAva5sin","nAva2gro","nAva3gro","nAva4gro","nAva5gro","nAvaUns","famAva","unfAva","unsAva","wordcount","wordPerSit","sitPerEve","evePerEpi","n_socEve","dateEMA","rses_1","rses_2","rses_3","rses_4","propEMAsocSit","propEMAsocInt","excl","rses_totalMean","rses_1sd","rses_2sd","rses_3sd","rses_4sd","socSitSd","socIntSd","exclSd","rses_totalSd","compliance","propDreamSocSit","propDreamSocIntOld","propDreamSocIntOld2","propDreamMulti","propDreamTypeV","propDreamSocIntOld3","propDreamSocInt","propDreamSocEvent"
"7","AJ04SE","2023-10-27",1,2,2,"Wir fuhren in den Urlaub. Auf dem Wege hielten wir, mein fester Freund und ich und Teile meiner Familie, beim Bäcker und auch bevor sich folgende Szenerie ergab waren wir schon länger unterwegs, ich glaube am Meer. Irgendwann kamen wir  jedoch an einem der vermeintlichen Ziele an. Ich war also mit meinem Freund und Teilen meiner Familie (meine Halbschwester, Papa und Stiefmutter waren auf jeden Fall auch da) und  möglicherweise noch Anderen im Urlaub. Wir wohnten in einer Ansammlung von Ferienwohnungen. Diese waren sehr sehr groß. Das Schlafzimmer war riesig, alles offene Räume. Zumindest der Flur, das Bad, das Schlafzimmer, also die die in meinem Traum vorkam. Das Bad etwas altbacken, aber auch noch ok. Das Schlafzimmer jedoch hell mit riesigem Bett und grüner Bettwäsche. Daneben lagen auf beiden Seiten unsere geöffneten Koffer, vollkommen durchwühlt und offen. Eines Abends sind wir runtergegangen, etwas nach draußen und in eine Art Keller um irgendwo etwas zu spielen. Der Raum war klein und die Luft stickig und nur ein paar einzelne lange und runde Tische standen darum. Wir entscheiden uns für einen weit vorne rechts. Schon beim reinkommen erkannte ich sie sofort. Es war die exfreundin meines Freundes. Sie saß mit Freundinnen an einem Tisch links in der Ecke.  Als ich es bemerkte, küsste ich ihn, damit sie wusste, er würde nicht mehr an ihr hängen und hätte jetzt jemand neuen und sie könnte ihn in Ruhe lassen. Bei jedem Schritt und allem hatte ich jedoch das Gefühl sie und ihre Freundinnen kommentierten was ich tat und meinen Körper, sodass mein eigener Bauch mir irgendwann zu schwabblig vor kam. Sie konnten ihn sehen, da ich nur ein Bikinioberteil trug. Erst ignorierte er sie gekonnt, aber irgendwann machte sie so Handzeichen, ob die beiden mal sprechen könnten und er sagte erst nein, doch sie lies nicht locker bis er einwilligte. Ich konnte sehen wie sie immer wieder fragte und er nein sagte und auf mich oder etwas anderes, weshalb er nicht mit ihr reden wollte, deutete, als er kurz alleine war machte sie jedoch eine Daumen hoch Geste und er willigte gezwungenermaßen ein. „Kurz“, sagte er zu ihr während sie rausgingen.  Vorher, während dieses Kommunikationsversuches, hatte ich sogar mein Shirt ausgezogen (es war ein Bikinioberteil darunter), angeblich weil mir heiß war, aber vor allem weil ich Angst hatte seine Aufmerksamkeit würde zu ihr gehen und er würde mich vergessen. Deshalb schätzte ich, wenn ich im bikini Oberteil da stand, das ich nur trug, weil um mich herum plötzlich kurz kein Raum, sondern Wasser war, würde es etwas nutzen. Doch ich zog meinen Pulli später wieder an. Der Raum wurde wieder zu einem Raum und sie gingen kurz raus. Ohne, dass er mich gefragt hatte, ob das für mich okay sei oder nicht. Durch die Tür konnte man sie erst noch hören. Mein Freund sagte ihr ganz klar, dass sie ihn in Ruhe lassen sollte und wir konnten alles hören. Er sagte, dass sie nicht versuchen solle irgendetwas zu machen und aufhören sollte mit ihren Blicken usw., dann entfernten sie sich immer weiter. Meine Schwester drückte auf ein paar Knöpfen an einer Wand herum, sodass wir sie hören konnten, durch einen anderen Lautsprecher. Meine Stiefmutter lachte wie immer wenn ihre Tochter etwas Schlaues tat. Aber so richtig verstehen konnte man nichts. Es war sehr am Rauschen.  Die Zeit, bestimmt 10 Minuten, vergingen und irgendwann ging ich. Gerade als die beiden wieder reinkamen. Sie schaute mich angriffslustig und überheblich an und warf ihr blond gewelltes Haar zurück. Auf ihn achtete ich gar nicht so genau. Ich ging trotzdem zurück, hoch zur Ferienwohnung, schloss mich ins Bad ein und weinte. Die Front des Bades war aus Glas, weshalb ich mich mit dem Rücken dorthin stellen musste damit es niemand sah.   Doch es kam sowieso niemand.   Es schien außerdem Halloween zu sein, denn als Nächstes träumte ich von einer Sequenz, wo meine Freund seine exfreundin und einige ihrer Freunde verkleidet waren. Sie sagte „wo ist denn deine Freundin? Aber Halloween ist ja auch nicht für jeden was“. Sie schien sehr glücklich, während mein Freund eher unangenehm berührt und nicht als würde er dort sein wollen wirkte, doch er war trotzdem dort. Er hatte nicht gesehen, das ich i’ Bad weinte, er wusste also gar nicht wo ich war und er war trotzdem dort. Etwas im meinem Kopf entschied sich dazu auch hinunter zu gehen, auch verkleidet. Während alle dort draußen jedoch herbtsgerecht verkleidet waren, zog ich einen schwarzen Mini Rock ein kurzes Top und Teufelshörner an.    Irgendwer redete in diesem Traum auch noch über das Halloween Festival im Movie Park. Ich weiß nicht mehr wann, wo und warum, aber irgendwer redete darüber und meinte, es wäre gar nicht  so schlimm gewesen und mega wenig erschreckend, doch ich und andere hielten dagegen (ich war noch nie dort) und fragten immer ungläubig, ob sie/er das ernst meinte bis sie/er leicht zurückruderte und meinte es war zumindest nicht so schlimm wie sie es sich vorgestellt hat.    Späterer Traum:  Lara, eine Freundin, hat mich von zuhause abgeholt und wir sind den erstaunlichsten Weg zur Uni gefahren.  Es war sehr weit, wir sind sogar nachts gefahren und am Meer vorbeigekommen und an Häfen mit Riesenschiffen. Eines davon hat die ganze Zeit sein Horn geblasen, als wir über die Brücke fuhren. Einmal mussten wir einen so hohen Abhang runter dass ich dachte es klappt nicht, doch Lara hat ihr Auto sich selbst auseinandernehmen lassen und Schritt für Schritt runter gehen lassen. Wir sind irgendwann angekommen und saßen dann als erstes in der Mensa an einem Tisch voller älterer Leute (die Mensa war sehr klein, nur drei lange Tische). Die Leute an unserem Tisch waren alle Professoren und haben ihre Vorlesungen vorbereitet und viel in Fachjargon geredet und vor allem einer darüber, dass er fast seinen Terminkalender vergessen hätte und wie schlimm das gewesen wäre. Sie haben auch zum Teil mit uns geredet (also ein paar nette). Ich habe z.b. gesagt, dass ich Zug fahren hasse und dann wurde darüber kurz geredet. ",1698408300,7,2,8,35,27,19,13,3,9,16,0,1,1,1,0,2,0,0,17,3,1,1017,29.0571428571429,4.375,4,6,"2023-10-25",6,6.14285714285714,1.42857142857143,2.42857142857143,48,30.1428571428571,5,4,0,0.690065559342354,0.534522483824849,0.534522483824849,39.89987468652,22.1466970556828,1.63299316185545,0.204124145231932,1,0.771428571428571,0.703703703703704,0.542857142857143,0.431279620853081,0.0857142857142857,0.333333333333333,0.257142857142857,0.75
"8","AJ04SE","2023-10-28",1,2,3,"Erinnere mich noch daran, dass im Keller über einer Öffnung über mir eine handgroße, fellige Spinne saß,vor der ich total Angst hatte.     Und, dass ich in den frühen Morgen Stunden träumte, dass es von meinem Wecker ausgehend etwas heller wurde. Ich lag also in meinem Traum in meinem Bett und schlief, merkte aber im Halbschlaf irgendwie, dass der Wecker leuchtet. Also bereitete ich mich darauf vor, dass mein Wecker klingeln würde, doch war gleichzeitig noch irgendwie am schlafen und es passierte auch nichts. Dann hörte ich die Stimme meines festen Freundes aus dem Telefon. „ dein Wecker klingelt. Es ist 4:30.“ Ich reagierte nicht, weil mein Wecker klingelte ja nicht, er sagte weiter „hallo? Wieso klingelt dein Wecker nicht, meiner klingelt. Es ist 4:30.“ Ich reagierte immer noch nicht, hörte aber ein leichtes Summen. „hier, hör, dass ist mein Wecker“, hörte ich meinen Freund sagen. Das Summen wurde lauter. „Dein Wecker hat bestimmt eine leere Batterie, wach bitte auf du musst aufstehen“, sagte er nun. Ich war nun physisch wach, aber psychisch noch lange nicht und hörte das leise Summen meines eigenen Weckers nun auch, nur viel zu leise, als ob er langsam den Geist aufgeben würde. Erst nach einigen weiteren Minuten und Sorgen meines Freundes rappelte ich mich etwas hoch und nahm meinen Wecker in die Hand. Tatsächlich stand er auf halb eins und nicht auf halb fünf und summte leicht. „Mein Wecker ist fast leer glaube ich“, sagte ich zu meinem Freund, als sich die Uhrzeit plötzlich von einem Schlag auf den anderen in die jetzige änderte. „Oder auch nicht“, sagte ich und dann musste ich aufstehen.     Und auch die Kinder von der besten Freundin meiner Mutter kamen in meinem Traum vor. Im realen Leben besteht von meiner Seite aus kein Kontakt zu ihnen, da sie sehr früh in ein anders Bundesland gezogen waren, doch in meinem Traum war das eine Kind noch genauso ein kleiner, dünner Junge wie vor ein paar Jahren. Er sah maximal aus wie acht. Ich war alleine dort, meine Mutter und ihre beste Freundin waren nirgends zu sehen. Es waren nur das kleinere Kind und ich und was passiert ist weiß ich nicht mehr. Auf jeden Fall hat er viel geredet, was früher sonst eher selten vorgekommen ist und ich musste die ganze Zeit zu ihm runter schauen, weil er so klein war.",1698474960,8,4,4,8,5,4,0,0,4,5,0,0,0,0,0,0,0,0,5,0,0,394,49.25,2,1,3,"2023-10-26",5.42857142857143,6,1.28571428571429,2.71428571428571,46,33.8571428571429,4.71428571428571,3.85714285714286,1.51185789203691,0.816496580927726,0.487950036474267,0.487950036474267,30.8112533554436,26.4160845662169,1.25356634105602,0.28347335475692,1,0.625,0.8,0.5,0,0,0.8,0.5,0.75
"9","AJ04SE","2023-10-29",1,1,1,"Ich lebte in einer Kleinstadt. Ich war mit meiner Mutter und Stiefvater im Auto unterwegs, als jemand in einem minikleinen Auto und anhupte und etwas von uns wollte. Wir fuhren dann einfach weiter, aber er fuhr uns die ganze Zeit hinterher. Wir kamen dann bei einem Bäcker an und sprinteten rein, obwohl es aussah, als würde er gleich schließen. Trotzdem kauften wir Laugenbrezel und gingen zum Sitzbereich. Dort sah es eher weniger aus, als würde es schließen. Jemand feierte dort an drei Tischen seinen  Geburtstag und meine Eltern schienen ihn zu kennen, denn sie setzten sich dazu. Ich sagte aber, dass ich einen Tisch zum Essen brauche und setzte mich alleine an einen anderen Tisch. Ich begann zu essen, als der verfolgende Mann in die Bäckerei kam. Er setzte sich an den Tisch neben mich, doch ich ignorierte ihn vollkommen. Bevor er und seine Begleitung, in Form einer älteren Frau, gehen wollten, stand sie auf, nahm ihre Serviette und warf sie in meinen Kaffee und etwas schäumte in mir über. Ich nahm die Serviette heraus und warf sie der Frau auf die Brust, danach auch dem Mann gegen die Kleidung. Sie beschwerten sich natürlich, aber ich versuchte mich neutral zu rechtfertigen, dass sie angefangen haben mich zu provozieren. Sie wurden dann rausgeworfen und ich wollte eigentlich weiter essen, aber neben mir saßen plötzlich meine Oma und Opa und meinten wie respektlos mein Verhalten gewesen wäre. Ich war sehr verletzt davon, stand auf stellte mein Gebäck vorne auf die Theke und ging. Meine Eltern und Großeltern blieben. Ich ging raus, mit der Angst, den Mann anzutreffen, doch sie waren scheinbar schon weg. Ich wechselte die Straßenseite und setzte mich auf eine Mauer, auf der ich meine Tränen nicht zurückhalten konnte. Ich weinte sehr lange, sehr stark, bis ich meinen festen Freund anrief und ihn schluchzend fragte ob er mich abholen könne. Er war komplett durcheinander und aufgeregt und fragte wieso und ich erzählte es ihm. Er sagte er komme sofort.   Doch dazu kam es nie. Das nächste, das ich weiß ist, dass ich mit ca vier anderen Mädchen in einem Haus eingesperrt war. Ich wurde gekidnappt, genauso wie die anderen. Ich weiß nicht mehr, ob ich zuerst alleine dort war oder ob wir schon von Beginn an zu viert waren, aber am Ende waren wir vier. Es war eine ganz normale Wohnung, mit vielen Räumen, doch hauptsächlich durften wir uns nur in einem Raum aufhalten, wo wir auch auf Matratzen schliefen. Raus aus dem Raum ging es sehr selten. Es war alles sehr spärlich eingerichtet. Ich weiß auch, dass es um Vergewaltigung ging. Ich erinnere mich aber nicht an viele Details und würde diese an die ich mich erinnere auch gerne aus der Erzählung weglassen. Jedenfalls ging das sehr lange so und ich konnte nicht sagen wer genau der Kidnapper war. Ich habe ihn nie richtig gesehen. Doch es vergingen Jahre in denen ich nur dieselben vier Gesichter sah. Meins, das von Nina (Darstellerin im Reality tv im echten Leben), Lara (Freundin) und ein anderes Mädchen, das ich nicht kannte. Eines Tages, ich weiß nicht wie, gelang es und aus dem Raum heraus zu kommen in einen anderen Raum und Nina meinte, dass es hier ein Fenster gebe und sie schon einmal herausklettern wollte. Ich dachte gar nicht darüber nach, was sie mir da gerade sagte, nämlich dass sie uns nichts davon erzählt hatte, sondern öffnete das Fenster. Ich kam aber nicht hoch und hörte auch schon Schritte hinter uns und eine definitiv weibliche Stimme, trotzdem hatte ich Angst. Nina half mir und ich sprang aus dem Fenster. Ich wusste nicht wie die anderen es aus dem Haus geschafft hatten, aber als nächstes erinnere ich mich daran, dass wir in einer Reihe eine Treppe hinunterliefen und alle Leute, die wir vorher durch die Schule oder Ähnliches gekannt hatten, standen am Fuß der Treppe verteilt und machten irgendetwas. Es sah aus wie eine backstage Halle in der etwas vorbereitet wurde und als wir die Treppe herunterkamen, spielte gerade eine Musik, die besonders gut passte (ich glaube aber die Musik kam von Laras Handy, keine Ahnung wo sie schon eins herhatte, nachdem wir gerade erst entflohen waren) und jegliche Aufmerksamkeit wurde auf uns gelenkt. Wir liefen einfach vorbei bis Lara und ich (die anderen beiden waren dann irgendwie weg)  unsere drei   Besten Freundinnen von früher antrafen. „Na ganz schön alt geworden oder?“ sprach ich sie an und der Schock in ihren Gesichtern war nicht zu übersehen. „Wir sollten eigentlich tot sein oder nicht?“, sagte ich schnippisch. Ich weiß nicht, warum ich so mit ihnen redete, aber ich denke, dass ich dachte, dass sie etwas mit unserem verschwinden und versuchten Mord zu tun hatten, denn sie waren sowieso immer schlechte Freundinnen gewesen. Sie sagten nicht viel, starrten uns nur an bis sie ein paar Sätze herausbrachten. Es brachte uns nicht weiter. „Eine letzte Frage habe ich noch an euch. Wisst ihr wer uns töten wollte?“, fragte ich ernst und zu ihnen gebeugt. Die Stille danach verriet sie. „Ihr wisst wer uns töten wollte und wollt es uns nicht sagen.“, stellte ich nüchtern und enttäuscht fest und wir drehten uns um um gingen.   Kurz darauf liefen wir an einer Toilette vorbei, deren Tür halb offen war. Wir waren schon fast daran vorbei als ich Lara zurückzerrte und einem Telefongespräch lauschte. Ich hörte nur einige Sekunden und wusste, DAS ist der Täter. Ohne nachzudenken stürmte ich in das Klo und vor uns stand ein Mann, der früher einer unserer Freunde gewesen war. „TJ“, sagte ich, „schön dich zu sehen“ und alles fiel ihm aus seinem Gesicht. „Hast du uns vermisst?“, fragte ich, meine Stimme so verzogen, dass er wusste ich kannte die Antwort.  Doch bevor er antworten konnte, rief ich Lara zu, sie sollte losrennen. Und wir rannten los, TJ hinterher. Das Haus in dem wir uns nun befanden besaß ungewöhnlich viele Türen und Verwinkelungen und vor allem lange Treppen. Nirrgends war eine Menschenseele zu sehen was sehr blöd für mich und Lara war. TJ war uns dicht auf den Fersen, als ich eine Treppe begann runterzurennen. Lara hinter her, aber sie stöhnte auf. Ich erinnerte mich, dass sie einen verletzten Fuß hatte und sah schon vom Ende der Treppe dass sie noch oben rumhumpelte, TJ hatte sie fast. Also rief ich „TJ wenn du sie so kriegst, ist das nicht fair. Du willst uns doch fair zurückkriegen also lass sie erst die Treppe herunterkommen.“ Ich dachte nicht, dass es wirkte und auch Lara sah mich verwirrt an, doch es klappte, vielleicht auch weil genau in dem Moment ein Junge reinkam und das ganze komisch betrachtet. Als er uns jedoch erkannte suchte er flüchtend das Weite. Die Verfolgung ging also weiter, immer auf der Suche nach Menschen. Wir gingen TJ ein Stück ab, doch fanden keinen einzigen Menschen. Am Ende war dort nur noch eine Treppe vor uns und   TJ hinter uns. „Spring“, rief ich und sprang in die Mitte der Treppe. Ich fiel auf einen harten Boden und dort waren Menschen. Meine früheren besten Freunde, alle viel zu alt geworden, starrten mich an. „Lara spring hier sind Leute“, rief ich hoch, doch sie kam nicht. Ich hörte ehrlich gesagt gar nichts mehr von ihr. Keinen Ton. Ich beschloss, sie gleich zu suchen und erst meine ehemaligen Freunde aufzuklären. Ich setzte mich zu ihnen und erklärte ihnen alles. Sie hörten gespannt zu. Aber sie schauten auch irgendwie komisch, als hätten sie längst damit abgeschlossen. Sie hatten in ihrem Kartenspiel inne gehalten und ich saß neben ihnen auf der Couch der kleinen Zimmers, das aussah als wäre es einer Königspalastserie entsprungen. Am Ende erwähnte ich meinen damaligen festen Freund und die  Situation wurde noch angespannter. „Wo ist er eigentlich?“, fragte ich und die drei Männer schauten sich kurz an. „Er ist jetzt bei Tiffany.“ „Ach okay“  Ich überspielte meine Überraschung und Enttäuschung gekonnt und klang wirklich interessiert. „Wann ist das denn passiert?“ „Irgendwann kurz nachdem du weg warst. Seitdem sind wir nicht mehr befreundet. Wir sehen ihn nur manchmal mit ihr deshalb wissen wir, dass er genau dieselben Sachen mit ihr macht wie mit dir, nur das es einfach anders ist zwischen den beiden, egal was er versucht.“  Das war fast das Ende des Traumes.  Ich weiß nur noch, dass ich mich dann irgendwann auf den Weg zu meinen Eltern gemacht habe um ihnen zu sagen, dass ich lebe, als ich plötzlich sah wie der alte Mann, der uns am Anfang verfolgt hatte, in die Bäckerei eintrat, in der er eigentlich wegen mir Hausverbot hatte. Mein Herz setzte einen Schlag aus, als er sich ganz normal hinsetzte und einen Kaffee trank. Doch ich schluckte es herunter und lief zu meinen Eltern.",1698569700,9,2,19,55,44,35,9,3,29,21,0,14,2,6,0,2,1,2,27,16,3,1470,26.7272727272727,2.89473684210526,9.5,18,"2023-10-27",5.33333333333333,5,1.83333333333333,2.66666666666667,45.1666666666667,34.8333333333333,4.16666666666667,3.70833333333333,1.211060141639,1.09544511501033,0.752772652709081,1.211060141639,39.7311800311376,30.733803322509,0.408248290463863,0.102062072615966,0.857142857142857,0.8,0.795454545454545,0.636363636363636,0.258373205741627,0.0545454545454545,0.659090909090909,0.527272727272727,0.947368421052632
"10","AJ04SE","2023-10-30",1,2,2,"Ich war auf einer Ferienfreizeit die fünf Tage ging und in einem ganzen Dorf stattfand, das eigens dafür existierte. Ich war zwei mal hintereinander dort, erst ganz alleine mit Fremden und dann mit Freunden beziehungsweise es waren fast nur Leute da, die ich kannten aus der Uni, Schule usw.   Es gab einen richtigen  Stundenplan, was wann passierte und in der ersten Woche war alles sehr sehr negativ behaftet und mit Angst, was aber extra von den Veranstalteten so bestimmt war, wieso auch immer. zum Beispiel gab es Mittwoch ein Spiele das hieß „Entkomme den Flammen“.   Es fand aber den ganzen Tag über nicht statt, was uns verwunderte und abends als wir alle schon in den Betten lagen, roch es auf einmal nach Feuer. Wir waren in einem großen Glashaus untergebracht, weshalb wir den Rauch schnell sehen konnten, der von davor aufstieg und alle fingen an zu schreien und Panik zu bekommen. Die Fenster wurden zerschlagen und alle rannten um ihr Leben. Als wir dann weit genug weg waren, erlosch plötzlich der Dampf. Es war extra initiiert worden. Als wird uns jedoch weiter umsahen, sahen wir an einer anderen Stelle weiter hinten wirklich eine kleine dunkle Rauchwolke/. Unser Rauch war weiß gewesen. So lief das in der ersten Woche ab und ich fühlte mich auch generell sehr alleine, weil ich abends alleine durch die Stadt lief usw.  In der zweiten Woche war das anders; da lief alles normal und etwas angenehmer. Die Veranstalter hatten wohl gemerkt, dass die erste Woche nicht so gut angekommen war. Am letzten Tag bzw. frühen Abend der zweiten Woche, gab es nochmal ein Zusammenkommen mit Allen, wie eine Party. Es wurde Musik gespielt, doch diese fiel immer wieder aus, weshalb die Stimmung etwas unangenehm war, weil niemand so richtig tanzte oder wirklich Spaß hatte. Die Veranstaltung wurde dann nach draußen verlegt, was etwas blöd für mich war, weil ich ausversehen alle meine Schuhe schon in den Koffer gesteckt hatte. Ich musste schnell welche suchen und ohne Socken anziehen, weil diese auch schon eingepackt waren. Draußen war die Stimmung besser. Die männlichen Teilnehmer machten ein Wettrennen im Sandkasten, zumindest einige von ihnen, weil sie dadurch irgendetwas gewinnen konnten. Ich wusste nicht was, aber ich wollte auch gerne mitmachen, konnte aber nicht, weil ich ohne Socken in den Schuhen war, was definitiv zu Blasen führen würde.   Ich setzte mich also zu meiner Mädelsgruppe bzw. zu allen Mädels, die zusammen am Rand des Sandkastens saßen und wir schauten uns das Ganze an und quatschten. Die Stimmung war angenehmer. ",1698642300,10,1,4,18,11,10,10,1,1,2,0,6,0,1,0,6,0,0,3,12,0,425,23.6111111111111,4.5,4,3,"2023-10-28",6,6.57142857142857,1.28571428571429,2.71428571428571,77.2857142857143,57.8571428571429,5.28571428571429,4.14285714285714,0,0.534522483824849,0.755928946018455,0.755928946018455,40.5574254841794,33.0828685345783,1.60356745147455,0.318104505140176,1,0.611111111111111,0.909090909090909,0.555555555555556,0.172839506172839,0.0555555555555556,0.0909090909090909,0.0555555555555556,0.75
"11","AJ04SE","2023-10-31",2,-77,-77,"-66",1698723540,11,NA,NA,NA,NA,NA,NA,NA,NA,NA,NA,NA,NA,NA,NA,NA,NA,NA,NA,NA,NA,NA,NA,NA,NA,NA,"2023-10-29",6.14285714285714,7,1,1.85714285714286,67.7142857142857,50.8571428571429,5.71428571428571,4,0.377964473009227,0,0,0.690065559342354,47.2218674122992,36.8620336363788,1.60356745147455,0.144337567297406,1,NA,NA,NA,NA,NA,NA,NA,NA
