"","id","dateDream","dream","nightmare","mood","content","datetime","dayCounter","n_epi","n_eve","n_sit","dreamSocSit","dreamSocInt","multi","realMulti","inter","nAva2sin","nAva3sin","nAva4sin","nAva5sin","nAva2gro","nAva3gro","nAva4gro","nAva5gro","nAvaUns","famAva","unfAva","unsAva","wordcount","wordPerSit","sitPerEve","evePerEpi","n_socEve","dateEMA","rses_1","rses_2","rses_3","rses_4","propEMAsocSit","propEMAsocInt","excl","rses_totalMean","rses_1sd","rses_2sd","rses_3sd","rses_4sd","socSitSd","socIntSd","exclSd","rses_totalSd","compliance","propDreamSocSit","propDreamSocIntOld","propDreamSocIntOld2","propDreamMulti","propDreamTypeV","propDreamSocIntOld3","propDreamSocInt","propDreamSocEvent"
"1","HL04MR","2023-10-18",1,2,4,"heute Nacht habe ich geträumt, dass ich mit meiner besten Freundin, die zeitgleich meine Mitbewohnerin ist, in einem großen, offenen Einfamilienhaus lebe. Als ich von einem Ausflug zurück komme und sie zuhause vermute, stelle ich fest, dass sie nicht in der Wohnung ist. Ich sehe allerdings an unserer neu aufgefüllten Küche inkl. Kühlschrank, dass sie einkaufen war. Als ich nach oben gehe sehe ich, dass sie noch mehr Dinge eingekauft hat, die nicht in der Küche sind. Es handelt sich um etwa 4 große Papptüten, die jeweils nur 2 oder 3 große Tomaten an einem Strauch enthalten. Ich sehe auf der App  Wo ist  nach und sehe, dass sie in Spanien ist. Ich rufe sie an und meine Vermutung, dass sie ihren spanischen Partner besucht, bestätigt sind. Da mein Partner auch in Spanien lebt, rufe ich auch ihn an, um ihm davon zu berichten. Er erzählt, dass mir seine Familie für meinen nächsten Besuch in seinem Heimatdorf das Zugticket bezahlen möchte. Darüber freue ich mich sehr und räume die Tomaten aus den Tüten in den Kühlschrank. In meiner nächsten Traumsequenz scanne ich einen QR-Code, den ein Kommilitone (in meinem Traum) auf seinem Unterarm tätowiert hat. Er hat noch viele weitere bunte Tattoos am Arm. Danach war der Traum vorbei.",1697603520,1,2,3,9,3,2,2,2,2,3,0,0,0,0,0,0,0,0,3,0,0,209,23.2222222222222,3,1.5,3,"2023-10-17",5.42857142857143,6,2.14285714285714,2.71428571428571,36.2857142857143,16.2857142857143,4.71428571428571,4.07142857142857,0.534522483824849,0,0.377964473009227,0.487950036474267,42.8746789520119,20.5484329144121,1.38013111868471,0.121987509118567,1,0.333333333333333,0.666666666666667,0.222222222222222,0.12280701754386,0.222222222222222,0.666666666666667,0.222222222222222,1
"2","HL04MR","2023-10-19",1,2,5,"Ich war an meinem alten Gymnasium. Es war Sommer und der Schulhof sah sehr hügelig und spektakulär aus. Es war Tag der offenen Tür und unter anderem did kleinen Mädchen, mit denen ich im Rahmen meiner Ehrenamtlichen Arbeit bei der Caritas zu tun habe, sahen sich die Schule an. Es gab außerdem einen Wettkampf im Teller Einsammeln. Die Teller waren in einem Hochseilparcours verstreut, der von sämtlichen Schülern sehr schnell durchlaufen wurde. Meine beste Freundin aus dem Kindergarten gewann ihn. Zuletzt war ich mit einem männlichen Freund von mir bei real in meiner Heimatstadt. (Den Laden gibt es nicht mehr). Dort wollte ich mir die Nägel machen lassen und er war irgendwie mit dabei. Die Damen aus dem Nagelstudio innerhalb des reals fragten mich, ob ich schonmal einen Vertrag abgeschlossen hatte und ich sagte: Ja, einen Mietvertrag tatsächlich . Als eine Frau begann, meine Nagelhaut zurückzuschieben, bluteten meine Finger. Sid sagte mir, ich solle mehr trinken, damit das nicht passiert. Außerdem hatte mir eine andere Mitarbeiterin eröffnet, dass man dort nir mit Bargeld zahlen durfte. Ich hatte lediglich Karten dabei. Ich schickte meinen Kumpel los, der mit meiner Karte 40€ abholen sollte und mir auch etwas Wasser zu trinken mitbringen. Plötzlich saß ich mit meinem Kumpel in einem Restaurant. Der Kellner, der gleichzeitig ein Schulfreund von mir war, kam von hinten an uns heran, schlug meinem Kumpel auf den Rücken und sagte  hey *Name meines Exfreundes* . Plötzlich saß tatsächlich mein Exfreund, mit welchem ich häusliche Gewalt erlebt habe, neben mir. Ich schämte mich, mit ihm unterwegs zu sein. Er sagte mir bloß, dass er noch ein Bettlaken von mir hatte, was er mir gerne zurück geben würde. ",1697692860,2,3,4,12,11,7,2,1,6,5,3,0,1,1,3,0,1,0,6,6,2,278,23.1666666666667,3,1.33333333333333,4,"2023-10-18",6.33333333333333,6.5,1.66666666666667,1.66666666666667,69.8333333333333,45.3333333333333,6.16666666666667,4.04166666666667,0.816496580927726,0.547722557505166,0.516397779494322,0.816496580927726,36.826168232205,39.8781477336481,1.16904519445001,0.102062072615966,0.857142857142857,0.916666666666667,0.636363636363636,0.583333333333333,0.0441176470588236,0.0833333333333333,0.545454545454545,0.5,1
"3","HL04MR","2023-10-20",1,2,3,"Ich befand mich auf einer Bildungsreise und nahm an einer Diskussion über Themen, die Frauen betreffen, teil. Ich saß mit drei weiteren Frauen und einer Art Moderatorin auf dem Dachboden eines alten Hauses. Mir gegenüber saß eine völlig schwarz gekleidete Frau mit dunklem Makeup. Links von mir befand sich eine Frau, die eine beige Jogginghose und einen ausgeblichenen blauen Pullover trug. Wir machten eine Vorstellungsrunde und die Frau links neben mir erzählte davon, dass sie wöchentlich ei e Art Horoskop las. Die schwarz gekleidete Frau und ich warfen uns spöttische Blicke zu. Die Frau rechts neben mir war die einzige Frau, die ich bereits kannte. Sie war mit mir auf dem Gymnasium gewesen. Sie lag auf einem gefälschten Fell-Teppich und sagte  Das fühlt sich an, als würde man auf einem Bären liegen.  Skeptische Stille erfüllte den Raum. Erst jetzt bemerkte ich, dass hinter mir ein Publikum an Männern saß. Sie erzählte weiter  Ja, als ob man beim Angeln auf Bärenfell liegt. Kennt ihr das nicht?  Ich dachte bloß, was sie für ein 'Pick-me-girl' war. In einer anderen Traumsequenz war ich mit zwei meiner Freundinnen, die beide Raucherinnen sind in einem Kinderzimmer. Wir waren alle wieder 14-15 Jahre alt. Sie rauchten heimlich im Zimmer. Ich hatte Angst, dass die Eltern der einen Freundin hineinkommen würden, obwohl ich garnicht selbst rauchte. In einem anderen Traum nahm ich an einer Studie teil, in der 6 junge Erwachsene untereinander das Menschenduo finden sollten, was am besten harmoniert. Wir befanden uns zusammen in einem Schwimmbad. Ein Mädchen, was Pfadfinder-Kleidung trug, wurde von den anderen direkt eliminiert. Dann merkte ich, wie die restlichen fünf eine Gruppe bildeten. Nach und nach wurden wieder zwei von ihnen eliminiert, bis die Übrigen nur noch zwei waren. Ich fragte mich, ob sie vergessen hatte, das ich existierte und entschloss mich einfach, das Experiment selbst zu beenden. Am Ende dieses Traums war ich auf einem open-air konzert für Grundschulkinder. Ich selbst war allerdings 19. Einer der Jungen, der bei der Studie teilgenommen hatte und vor mir eliminiert wurde, stand gemeinsam mit 4 Grubdschulkindern auf der Bühne. Er hatte eine kleine Trompete dabei, die er spielte. Ich war ziemlich beeindruckt von seinem musischen Talent. ",1697779260,3,3,4,14,12,2,2,1,1,3,0,8,1,1,0,4,0,1,4,12,1,364,26,3.5,1.33333333333333,4,"2023-10-19",7,7,1,1,91.25,100,7,4,0,0,0,0,11.4127122105133,0,0,0,0.571428571428571,0.857142857142857,0.166666666666667,0.142857142857143,0.02,0.0714285714285714,0.0833333333333333,0.0714285714285714,1
"4","HL04MR","2023-10-21",1,2,3,"Ich r mit meinen Eltern bei ikea und suchte ein schönes Regal. Mein Vater fand eins aus Holz und baute dieses sofort im Laden auf. Als er ihn fertig aufgebaut hatte, sah er, dass es im Laden noch viel schönere Regale gab, als baute er stattdessen ein anderes zusammen. Zuhause bei meinen Eltern angekommen befand ich mich im alten Kinderzimmer meiner Cousine. Sie hatte viele rosane Gegenstände. (Meine Cousine ist älter als ich und dementsprechend auch schon länger ausgezogen) Das Zimmer sah ziemlich schmuddelig aus. Besonders ihre alte Matratze wirkte verschimmelt. Ich wollte dort nicht schlafen und gab meinen Eltern bescheid. Später betrat ich das Zimmer erneut, meine Mutter hatte das Zimmer komplett aufgeräumt - es war bis auf die schimmelige Matratze ordentlich.",1697863440,4,1,2,7,5,2,1,0,1,5,0,0,0,2,0,0,0,0,7,0,0,125,17.8571428571429,3.5,2,2,"2023-10-20",7,6.8,1.2,1,86,81,6.2,4,0,0.447213595499958,0.447213595499958,0,22.8144690930997,20.1246117974981,0.836660026534076,0,0.714285714285714,0.714285714285714,0.4,0.285714285714286,0.0123456790123457,0,0.2,0.142857142857143,1
"5","HL04MR","2023-10-22",2,-77,-77,"-66",1697957580,5,NA,NA,NA,NA,NA,NA,NA,NA,NA,NA,NA,NA,NA,NA,NA,NA,NA,NA,NA,NA,NA,NA,NA,NA,NA,"2023-10-21",7,7,1,1,79.4,96.2,6.4,4,0,0,0,0,30.5253992602881,5.21536192416212,0.894427190999916,0,0.714285714285714,NA,NA,NA,NA,NA,NA,NA,NA
"6","HL04MR","2023-10-23",1,2,4,"Ich befand mich mit einem Freund (mit dem ich in einem vorherigen Traum in Valencia/Ostdeutschland war) in Norwegen. Alles war verschneit und sah traumhaft schön aus. Wir waren auf einem weißen Hügel mit Blick auf einen türkisfarbenen See. Um us rum standen intensiv grüne Tannen. Ich war damit beschäftigt, Bilder von ihm zu ihm und der Umgebung zu machen. Er machte auch Bilder von mir. Danach waren wir wieder in einer Stadt in Norwegen. Es waren noch einige andere Freunde dabei. Ich wollte den gesamten restlichen Traum über, dass dieser Freund mir die Naturbilder und die Bilder, die er von mir gemacht hatte, schickt, aber er war damit beschäftigt, mit seiner neuen  Talking-Stage  zu schreiben.",1698035040,6,1,2,5,4,3,3,0,0,4,0,0,0,1,0,0,0,0,5,0,0,115,23,2.5,2,2,"2023-10-22",7,7,1,1,54.1666666666667,36.6666666666667,6,4,0,0,0,0,46.374202598715,49.6655480858378,1.54919333848297,0,0.857142857142857,0.8,0.75,0.6,0.0818181818181817,0,0,0,1
"7","HL04MR","2023-10-24",1,2,2,"Diese Nacht wurde ich in einem Tunnel von der Polizei angehalten, weil ich sehr offensichtlich beim Fahren mein Handy benutzt hatte. Die Frau, die mich anhielt, gab mir dann eine Adresse, bei der ich mich melden sollte. Dabei handelte es sich um eine Bibliothek. Ein korpulenter großer Mann und ein kleiner schmaler klärten mich über meine Strafe auf. Ich musste nicht ins Gefängnis oder Geld bezahlen. Stattdessen hatte jeder Mensch scheinbar einen Mikrochip und sie entfernten einen Teil davon, den ich erst zum Antritt des nächsten Jahres wiederbekommen sollte. Den Rest des Traumes versuchte ich, vor meinen Eltern geheim zu halten, dass ich mit Handy am Steuer gefahren war. ",1698127440,7,1,3,4,3,3,0,0,3,0,2,1,0,0,0,1,0,0,0,4,0,109,27.25,1.33333333333333,3,2,"2023-10-23",6.33333333333333,6.66666666666667,1.33333333333333,2.66666666666667,86.6666666666667,43,5.66666666666667,4.25,0.577350269189626,0.577350269189626,0.577350269189626,0.577350269189626,11.5470053837925,49.6689037527506,0.577350269189626,0.25,0.428571428571429,0.75,1,0.75,0,0,1,0.75,0.666666666666667
"8","HL04MR","2023-10-25",2,-77,-77,"-66",1698208260,8,NA,NA,NA,NA,NA,NA,NA,NA,NA,NA,NA,NA,NA,NA,NA,NA,NA,NA,NA,NA,NA,NA,NA,NA,NA,"2023-10-24",4.16666666666667,5.5,2.66666666666667,4.33333333333333,71.8333333333333,54.8333333333333,6,4.16666666666667,1.83484785926972,1.04880884817015,1.03279555898864,1.96638416050035,37.1505944322115,39.851808825531,1.26491106406735,0.437797517885457,0.857142857142857,NA,NA,NA,NA,NA,NA,NA,NA
"9","HL04MR","2023-10-26",1,2,5,"Ich befand mich im Haus meiner besten Freundin und draußen war wunderschönes Wetter. Wir saßen am Küchentisch und sie erzählte mir, wie wichtig ich ihr bin und zeigte mir ein Buch, dass sie für mich gemacht hatte. Wir gingen durch die ihr riesiges Haus, was zum Beispiel einen großen Wintergarten umfasste. Außerdem trafen wir ihre Mutter. Sie war früher Modedesignerin gewesen und zeigte mir in ihrem Atelier einige ihrer Kollektionen. Sie hatte einst eine seht bunte Kollektion mit quietschenden Farben entworfen. Besonders ein Teil fiel mir dabei sehr ins Auge; es war ein gelber Body mit einem schwarzen Gürtel und Trägern und einer roten Schnalle. Den gleichen Body gab es auch im grün und rot und ich fragte sie, ob ich einem davon mitnehmen könnte. Sie gab mir den grünen und ich war sehr glücklich. Im Keller des riesigen Hauses befand sich außerdem ein Einkaufszentrum. Ich fühlte mich wie im Schlaraffenland, da alles voller Kosmetik und Kleidung war. Es gab einem Ausgang aus diesem Einkaufszentrum und plötzlich befand man sich im sonnigen Barcelona Zunächst erkundigte ich mit meiner besten Freundin die Stadt und war begeistert. Ich machte viele Panoramabilder und bestaunte die Architektur. Allerdings hatte ich rund um die Uhr Angst, dass man mir etwas klauen würde. Irgendwann war meine beste Freundin nicht mehr dort und stattdessen mein Vater, darüber war ich weder glücklich noch traurig, ich nahm es einfach hin.",1698298200,9,1,5,12,7,7,4,1,4,7,0,0,0,0,0,0,0,0,7,0,0,233,19.4166666666667,2.4,5,4,"2023-10-25",4.33333333333333,5.16666666666667,3,4.16666666666667,78.5,44.8333333333333,6.33333333333333,4.16666666666667,0.816496580927726,0.752772652709081,0.894427190999916,0.752772652709081,34.5470693402494,38.9893147755467,0.816496580927726,0.204124145231932,0.857142857142857,0.583333333333333,1,0.583333333333333,0.0892193308550187,0.0833333333333333,0.571428571428571,0.333333333333333,0.8
"10","HL04MR","2023-10-27",1,2,3,"Ich erinnere mich heute nacht leider nicht an viel. Ich weiß nur, dass ich vom heutigen Tag geträumt habe und meine Tage bekommen habe, als ich auf dem Klo saß und mit dem Auto irgendwo hingefahren bin.",1698384660,10,1,1,2,0,0,0,0,0,0,0,0,0,0,0,0,0,0,0,0,0,39,19.5,2,1,NA,"2023-10-26",4.4,4.6,3,4.2,72.2,37.8,5.6,4.05,0.547722557505166,0.547722557505166,0.707106781186548,0.447213595499958,41.5234873294621,36.1828688746484,1.14017542509914,0.325960120260132,0.714285714285714,0,NA,0,0,0,NA,0,NA
"11","HL04MR","2023-10-28",1,2,5,"In meinem Traum befand ich mich mit meinem Partner in einem Einkaufszentrum und wir probierten unterschiedliche Düfte aus. Dann befand ich mich mit meinem Partner und meinen Eltern auf einer Art Mittelaltermarkt. Ich fühlte mich sehr entspannt.",1698473820,11,1,2,2,2,2,2,0,0,1,0,0,0,0,0,0,0,0,1,0,0,37,18.5,1,2,2,"2023-10-27",4.33333333333333,5,3,4,39.6666666666667,16.6666666666667,6.66666666666667,4.08333333333333,1.15470053837925,1,1,1,35.6417358350198,20.8166599946613,0.577350269189626,0.144337567297406,0.428571428571429,1,1,1,0.12,0,0,0,1
"12","HL04MR","2023-10-29",1,2,4,"In meinem Traum war ich nachts in einer Stadt spazieren. Dort war ein Ladenlokal, was geöffnet war und ansprechend aussah, also ging ich hinein. Es war dunkel dort und ich hatte meine Unisachen dabei. In dem Laden wollte ich nun lernen. Ich setzte mich gerade auf einen dunklen Polstersessel an einem runden Holztisch, von dem aus man auf die Straße blicken konnte - vor dem Schaufenster war eine Küchenzeile aufgebaut -, als plötzlich Licht anging und eine ältere Frau fragte : Was machen Sie hier?  Ich entgegnete  Entschuldigung, ist das Ihr Arbeitszimmer?  Ich warf einen Blick hinter mich und erkannte, dass sich hinter dem kleinen Laden noch ein riesiger Raum mit Büchern und Schreibtischen erstreckte. Die Frau erklärte mir, dass sie diesen Ort absichtlich für Studierende eingerichtet hatte, da die Uniblibliothek um 22 Uhr schließt.",1698565020,12,1,1,6,2,2,1,1,2,0,0,2,0,0,0,0,0,0,0,2,0,139,23.1666666666667,6,1,1,"2023-10-28",7,7,1,1,100,100,7,4,0,0,0,0,0,0,0,0,0.285714285714286,0.333333333333333,1,0.333333333333333,0.01,0.166666666666667,1,0.333333333333333,1
"13","HL04MR","2023-10-30",2,-77,-77,"-66",1698651600,13,NA,NA,NA,NA,NA,NA,NA,NA,NA,NA,NA,NA,NA,NA,NA,NA,NA,NA,NA,NA,NA,NA,NA,NA,NA,"2023-10-29",7,6.5,1,1,100,100,7,3.875,0,1,0,0,0,0,0,0.25,0.571428571428571,NA,NA,NA,NA,NA,NA,NA,NA
"14","HL04MR","2023-10-31",1,2,3,"Ich befand mich mit meinen Eltern in einer Jugendherberge, die ich aus meinem freiwilligen sozialen Jahr kannte. Allerdings lag diese Jugendherberge auf einem Hügel, von dem aus man einen schönen Blick in die Landschaft hatte. Meine Mutter und ich waren beide schwanger, was ich, während ich träumte, überhaupt nicht hinterfragte. Da meine Mutter Schmerzen im Bauch hatte, fuhr mein Vater sie ins Krankenhaus. Ich dachte nur daran, dass sie in den letzten Wochen Alkohil getrunken hatte. Sie kamen glücklicherweise schnell wieder aus dem Krankenhaus zurück und meine Mutter hatte nur etwas Harmloses, was nichts mit der Schwangerschaft zutun hatte.",1698737460,14,1,1,3,2,1,0,0,1,2,0,0,0,1,0,0,0,0,3,0,0,99,33,3,1,1,"2023-10-30",6.6,6.6,1.8,1.6,100,100,6.4,4.15,0.894427190999916,0.894427190999916,1.09544511501033,0.894427190999916,0,0,0.894427190999916,0.335410196624968,0.714285714285714,0.666666666666667,0.5,0.333333333333333,0,0,0.5,0.333333333333333,1
