"id","rater","date","episode","event","situation","content","social","init-char","init-no","init-gender","reci-char","reci-no","reci-gender","type","quality","init_char_1","init_no_1","init_gender_1","reci_char_1","reci_no_1","reci_gender_1","init_char_2","init_no_2","init_gender_2","reci_char_2","reci_no_2","reci_gender_2","init_char_3","init_no_3","init_gender_3","reci_char_3","reci_no_3","reci_gender_3","quality_2","wordcount"
"DN12TO","IN",2023-07-15 07:34:00,1,1,0,"Ich war in Spanien am Meer an einer Strandpromenade. Aus dem echten Leben ist mir der Ort nicht bekannt, jedoch im Traum war er mir bekannt.",NA,NA,NA,NA,NA,NA,NA,NA,NA,NA,NA,NA,NA,NA,NA,NA,NA,NA,NA,NA,NA,NA,NA,NA,NA,NA,NA,NA,26
"DN12TO","IN",2023-07-15 07:34:00,1,1,1,"Ich habe das Meeresrauschen gehört und andere Leute spazieren und Fahrrad fahren sehen.",1,"4","2","4","1",1,NA,1,NA,4,2,4,1,1,2,NA,NA,NA,NA,NA,NA,NA,NA,NA,NA,NA,NA,NA,13
"DN12TO","IN",2023-07-15 07:34:00,1,2,1,"Ich war mit Freunden verabredet zum Joggen, da wir für einen Laufwettkampf trainiert haben.",0,NA,NA,NA,NA,NA,NA,NA,NA,NA,NA,NA,NA,NA,NA,NA,NA,NA,NA,NA,NA,NA,NA,NA,NA,NA,NA,NA,14
"DN12TO","IN",2023-07-16 08:06:00,1,1,1,"Meine ganze Familie war da bei meinen Eltern zuhause, wie immer an Heiligabend, jedoch waren im Traum noch viel mehr als sonst auch Bekannte. Wir saßen im Wohnzimmer am Holztisch. Es gab keinen Weihnachtsbaum.",1,"21, 232","2","4","1",1,NA,1,NA,NA,2,4,1,1,2,NA,NA,NA,NA,NA,NA,NA,NA,NA,NA,NA,NA,NA,34
"DN12TO","IN",2023-07-16 08:06:00,1,1,2,"Das Essen hat sehr lange gedauert, weil jeder in die Küche wollte",1,"21, 232","2","4","1",1,NA,1,NA,NA,2,4,1,1,2,NA,NA,NA,NA,NA,NA,NA,NA,NA,NA,NA,NA,NA,12
"DN12TO","IN",2023-07-16 08:06:00,1,1,3,"und manche haben ohne Topf gekocht.",1,"21, 232","2","4","1",1,NA,1,NA,NA,2,4,1,1,2,NA,NA,NA,NA,NA,NA,NA,NA,NA,NA,NA,NA,NA,6
"DN12TO","IN",2023-07-16 08:06:00,1,1,4,"Wir haben alle entspannt geredet und auf das Essen gewartet.",1,"21, 232","2","4","1",1,NA,5,31,NA,2,4,1,1,2,NA,NA,NA,NA,NA,NA,NA,NA,NA,NA,NA,NA,NA,10
"DN12TO","IN",2023-07-16 08:06:00,1,1,5,"Komisch war jedoch, dass Weihnachten irgendwie „zu früh“ war, niemand hatte etwas vorbereitet oder sich schöne Kleidung mitgenommen.",0,NA,NA,NA,NA,NA,NA,NA,NA,NA,NA,NA,NA,NA,NA,NA,NA,NA,NA,NA,NA,NA,NA,NA,NA,NA,NA,NA,18
"DN12TO","IN",2023-07-16 08:06:00,1,1,6,"Auf einmal war Weihnachten da und alle waren etwas überrascht.",1,"21, 232","2","4","1",1,NA,1,NA,NA,2,4,1,1,2,NA,NA,NA,NA,NA,NA,NA,NA,NA,NA,NA,NA,NA,10
"DN12TO","IN",2023-07-18 06:54:00,1,1,1,"Zuerst war ich auf einem Sportfest und sollte ein paar organisatorische Dinge erledigen.",0,NA,NA,NA,NA,NA,NA,NA,NA,NA,NA,NA,NA,NA,NA,NA,NA,NA,NA,NA,NA,NA,NA,NA,NA,NA,NA,NA,13
"DN12TO","IN",2023-07-18 06:54:00,1,1,2,"Ein Bekannter von mir hat mir aber extra falsche Anweisungen gegeben, damit ich kleine Fehler mache und er sich über mich aufregen kann.",1,"232","1","1","1",1,NA,3,32,232,1,1,1,1,2,NA,NA,NA,NA,NA,NA,NA,NA,NA,NA,NA,NA,NA,23
"DN12TO","IN",2023-07-18 06:54:00,1,1,3,"Ich hab ihm dann meine Meinung gesagt",1,"1","1",NA,"232",1,"1",3,32,1,1,2,232,1,1,NA,NA,NA,NA,NA,NA,NA,NA,NA,NA,NA,NA,NA,7
"DN12TO","IN",2023-07-18 06:54:00,1,1,4,"und bin gegangen.",0,NA,NA,NA,NA,NA,NA,NA,NA,NA,NA,NA,NA,NA,NA,NA,NA,NA,NA,NA,NA,NA,NA,NA,NA,NA,NA,NA,3
"DN12TO","IN",2023-07-18 06:54:00,1,2,1,"Auf dem Weg mit dem Zug nach Hause, habe ich meinen Onkel und Nachbarin getroffen und irgendwie über Nudelgerichte gesprochen.",1,"214, 232","1","1, 2","1",1,NA,5,4,NA,1,NA,1,1,2,NA,NA,NA,NA,NA,NA,NA,NA,NA,NA,NA,NA,NA,20
"DN12TO","IN",2023-07-18 06:54:00,1,3,1,"Zuhause angekommen hatte meine Familie Besuch.",1,"5","2","4","1",1,NA,1,NA,5,2,4,1,1,2,NA,NA,NA,NA,NA,NA,NA,NA,NA,NA,NA,NA,NA,6
"DN12TO","IN",2023-07-18 06:54:00,1,3,2,"Auch ich habe noch Freunde erwartet zum Essen im Garten.",0,NA,NA,NA,NA,NA,NA,NA,NA,NA,NA,NA,NA,NA,NA,NA,NA,NA,NA,NA,NA,NA,NA,NA,NA,NA,NA,NA,10
"DN12TO","IN",2023-07-18 06:54:00,1,3,3,"Da dann in der Küche so viel los war, habe ich meine (ehemalige) beste Freundin angerufen, ob sie nicht auf den Weg Pizza abholen möchte.",1,"1","1",NA,"231",1,"2",3,16,1,1,2,231,1,2,NA,NA,NA,NA,NA,NA,NA,NA,NA,NA,NA,NA,NA,25
"DN12TO","IN",2023-07-21 07:07:00,1,1,1,"Ich bin zu meiner Tante umgezogen, da ich zurück in der Schule war und die Schule wechseln musste.",0,NA,NA,NA,NA,NA,NA,NA,NA,NA,NA,NA,NA,NA,NA,NA,NA,NA,NA,NA,NA,NA,NA,NA,NA,NA,NA,NA,18
"DN12TO","IN",2023-07-21 07:07:00,1,1,2,"Ich habe relativ in der Nähe von der Schule gewohnt und konnte dorthin laufen.",0,NA,NA,NA,NA,NA,NA,NA,NA,NA,NA,NA,NA,NA,NA,NA,NA,NA,NA,NA,NA,NA,NA,NA,NA,NA,NA,NA,14
"DN12TO","IN",2023-07-21 07:07:00,1,1,3,"Einige der neuen SchülerInnen kannte ich (aus dem echten Leben) im Traum kannte ich die nicht.",1,"4","1","2","1",1,NA,1,NA,4,1,2,1,1,2,NA,NA,NA,NA,NA,NA,NA,NA,NA,NA,NA,NA,NA,16
"DN12TO","IN",2023-07-21 07:07:00,1,1,4,"Ich bin zuerst in den Sportunterricht gegangen",0,NA,NA,NA,NA,NA,NA,NA,NA,NA,NA,NA,NA,NA,NA,NA,NA,NA,NA,NA,NA,NA,NA,NA,NA,NA,NA,NA,7
"DN12TO","IN",2023-07-21 07:07:00,1,1,5,"und alle waren etwas skeptisch, warum jemand neues dabei ist.",1,"4","1","2","1",1,NA,2,32,4,1,2,1,1,2,NA,NA,NA,NA,NA,NA,NA,NA,NA,NA,NA,NA,NA,10
"DN12TO","IN",2023-07-21 07:07:00,1,2,1,"Am Ende war ich wieder zuhause",0,NA,NA,NA,NA,NA,NA,NA,NA,NA,NA,NA,NA,NA,NA,NA,NA,NA,NA,NA,NA,NA,NA,NA,NA,NA,NA,NA,6
"DN12TO","IN",2023-07-21 07:07:00,1,2,2,"und dann hat mein Freund einen Anruf erhalten, dass sein Hund ein gesundheitliches Problem hat, das hat mir Sorgen bereitet.",1,"22","1","1","1",1,NA,2,32,22,1,1,1,1,2,NA,NA,NA,NA,NA,NA,NA,NA,NA,NA,NA,NA,NA,20
"DN12TO","IN",2023-07-22 07:31:00,1,1,1,"Mein Bruder hatte seinen Abschluss und wir haben gemeinsam mit der Familie überlegt was wir ihm schenken können. Dabei waren wir in meinem Wohnzimmer zuhause und übers Telefon.",1,"1","1",NA,"21",2,"4",5,4,1,1,2,21,2,4,NA,NA,NA,NA,NA,NA,NA,NA,NA,NA,NA,NA,NA,28
"DN12TO","IN",2023-07-22 07:31:00,1,1,2,"Leider waren einige krank, weshalb es nichts besonderes werden konnte, da wir eigentlich eine gemeinsame Aktivität geplant hatten.",0,NA,NA,NA,NA,NA,NA,NA,NA,NA,NA,NA,NA,NA,NA,NA,NA,NA,NA,NA,NA,NA,NA,NA,NA,NA,NA,NA,18
"DN12TO","IN",2023-07-22 07:31:00,2,1,1,"Meine Eltern und ich haben meinen Opa im Heim besucht.",1,"1, 211","1, 2","3","214",1,"1",5,4,NA,NA,3,214,1,1,NA,NA,NA,NA,NA,NA,NA,NA,NA,NA,NA,NA,NA,10
"DN12TO","IN",2023-07-22 07:31:00,2,1,2,"Er hat ein neues großes, helles Zimmer mit einem riesigen Fenster bekommen und lag im Bett.",0,NA,NA,NA,NA,NA,NA,NA,NA,NA,NA,NA,NA,NA,NA,NA,NA,NA,NA,NA,NA,NA,NA,NA,NA,NA,NA,NA,16
"DN12TO","IN",2023-07-22 07:31:00,2,1,3,"Er war jedoch viel fitter als sonst und konnte aus dem Bett „springen“.",1,"214","1","1","1",1,NA,1,NA,214,1,1,1,1,2,NA,NA,NA,NA,NA,NA,NA,NA,NA,NA,NA,NA,NA,13
"DN12TO","IN",2023-07-22 07:31:00,2,1,4,"Jedoch hatte er vorher Eis gegessen und ist mit seinem Arm in seinen Eisteller gerollt.",1,"214","1","1","1",1,NA,1,NA,214,1,1,1,1,2,NA,NA,NA,NA,NA,NA,NA,NA,NA,NA,NA,NA,NA,15
"DN12TO","IN",2023-07-22 07:31:00,2,1,5,"Er hat eine neue Tiefgarage dazu bekommen und einen besseren Ausblick. Wir waren etwas verwundert, über die Tiefgarage, da er kein Auto fährt,  jedoch hätte er so lieb gefragt und daraufhin den Stellplatz bekommen.",1,"1, 211","1, 2","3","214",1,"1",5,4,NA,NA,3,214,1,1,NA,NA,NA,NA,NA,NA,NA,NA,NA,NA,NA,NA,NA,34
"DN12TO","IN",2023-07-24 06:36:00,1,1,1,"Der Traum spielte in meiner alten Schulaula. 6 oder 7 Personen, die mir mehr oder weniger bekannt waren, haben ihr Abizeugnis bekommen und sollten sich den Gästen kurz vorstellen.",1,"4","2","4","1",1,NA,1,NA,4,2,4,1,1,2,NA,NA,NA,NA,NA,NA,NA,NA,NA,NA,NA,NA,NA,29
"DN12TO","IN",2023-07-24 06:36:00,1,1,2,"Ein Junge, den ich kenne, war richtig genervt und wusste gar nicht, was er jetzt da machen sollte. Ich fand die Situation eher unangenehm.",1,"232","1","1","1",1,NA,2,32,232,1,1,1,1,2,NA,NA,NA,NA,NA,NA,NA,NA,NA,NA,NA,NA,NA,24
"DN12TO","IN",2023-07-24 06:36:00,1,1,999,"Der Traum ging noch länger, aber ich erinnere mich nicht mehr.",NA,NA,NA,NA,NA,NA,NA,NA,NA,NA,NA,NA,NA,NA,NA,NA,NA,NA,NA,NA,NA,NA,NA,NA,NA,NA,NA,NA,11
"DN12TO","IN",2023-07-25 07:55:00,1,1,0,"Eine Freundin von mir hat aus dem Tierheim in Thüringen einen seltenen kleinen Zwergpudel zur Probe mitgenommen.  Sie alleine durfte ihn jedoch nicht adoptieren und deshalb wollten wir versuchen, ihn zusammen zu adoptieren.  Ich war sehr glücklich weil ich mir schon immer einen eigenen Hund gewünscht habe und immer auf die richtige Situation gewartet habe.",NA,NA,NA,NA,NA,NA,NA,NA,NA,NA,NA,NA,NA,NA,NA,NA,NA,NA,NA,NA,NA,NA,NA,NA,NA,NA,NA,NA,55
"DN12TO","IN",2023-07-25 07:55:00,1,1,1,"Wir waren bei uns zuhause und haben die ganze Zeit mit dem Hund gespielt.",1,"1","1",NA,"231",1,"2",5,4,1,1,2,231,1,2,NA,NA,NA,NA,NA,NA,NA,NA,NA,NA,NA,NA,NA,14
"DN12TO","IN",2023-07-27 06:48:00,1,1,0,"Mein Bruder, eine Freundin und ich haben ein Meet&Greet mit einem Sänger gewonnen",NA,NA,NA,NA,NA,NA,NA,NA,NA,NA,NA,NA,NA,NA,NA,NA,NA,NA,NA,NA,NA,NA,NA,NA,NA,NA,NA,NA,13
"DN12TO","IN",2023-07-27 06:48:00,1,1,1,"und dann haben wir dort zusammen Karten gespielt",1,"1, 212, 231","1","1, 1, 2","3",1,"1",4,4,NA,1,NA,3,1,1,NA,NA,NA,NA,NA,NA,NA,NA,NA,NA,NA,NA,NA,8
"DN12TO","IN",2023-07-27 06:48:00,1,1,2,"Nach 2 Stunden jedoch, hatte der Musiker Rückenschmerzen, sodass wir uns nur noch unterhalten haben.",1,"1, 212, 231","1","1, 1, 2","3",1,"1",5,4,NA,1,NA,3,1,1,NA,NA,NA,NA,NA,NA,NA,NA,NA,NA,NA,NA,NA,15
"DN12TO","IN",2023-07-27 06:48:00,1,2,1,"Nach dem Meet&Greet war noch (unabhängig davon) eine Wanderung an der wir drei teilgenommen haben.",1,"1","1",NA,"212, 231",1,"1, 2",4,4,1,1,2,NA,1,NA,NA,NA,NA,NA,NA,NA,NA,NA,NA,NA,NA,NA,NA,15
"DN12TO","IN",2023-07-27 06:48:00,1,2,2,"Dann war meine Freundin etwas neidisch und hat alles schlecht geredet, was wir machen durften, weil sie beim M&G kein Bild gemacht hatte und nicht so viel mit ihm reden konnte.",1,"22","1","2","1",1,NA,5,32,22,1,2,1,1,2,NA,NA,NA,NA,NA,NA,NA,NA,NA,NA,NA,NA,NA,31
"DN12TO","IN",2023-07-29 07:51:00,1,1,1,"Ich war eine Freundin in Hamburg besuchen. Hamburg war aber nicht wie in „echt“, sondern die uni, an der meine Freundin aktuell war, ist auf einer Insel gewesen und Man musste mit einer Fähre hinfahren.",0,NA,NA,NA,NA,NA,NA,NA,NA,NA,NA,NA,NA,NA,NA,NA,NA,NA,NA,NA,NA,NA,NA,NA,NA,NA,NA,NA,35
"DN12TO","IN",2023-07-29 07:51:00,1,1,2,"Die ersten Tage war ich alleine dort,",0,NA,NA,NA,NA,NA,NA,NA,NA,NA,NA,NA,NA,NA,NA,NA,NA,NA,NA,NA,NA,NA,NA,NA,NA,NA,NA,NA,7
"DN12TO","IN",2023-07-29 07:51:00,1,1,3,"bis wir uns verabredet haben.",0,NA,NA,NA,NA,NA,NA,NA,NA,NA,NA,NA,NA,NA,NA,NA,NA,NA,NA,NA,NA,NA,NA,NA,NA,NA,NA,NA,5
"DN12TO","IN",2023-07-29 07:51:00,1,2,1,"Ich habe meine Freundin 2 mal zufällig getroffen.",1,"231","1","2","1",1,NA,3,4,231,1,2,1,1,2,NA,NA,NA,NA,NA,NA,NA,NA,NA,NA,NA,NA,NA,8
"DN12TO","IN",2023-07-29 07:51:00,1,3,1,"Auf der Fähre saß ich hinter einem Mann der durchgehend geraucht hat, was super eklig gestunken hat,",1,"4","1","1","1",1,NA,2,32,4,1,1,1,1,2,NA,NA,NA,NA,NA,NA,NA,NA,NA,NA,NA,NA,NA,17
"DN12TO","IN",2023-07-29 07:51:00,1,3,2,"aber niemand wollte etwas sagen. Die Stimmung war ziemlich gedrückt und ebenso das Wetter. Ich war im Traum sehr still und für mich.",0,NA,NA,NA,NA,NA,NA,NA,NA,NA,NA,NA,NA,NA,NA,NA,NA,NA,NA,NA,NA,NA,NA,NA,NA,NA,NA,NA,23
