"id","rater","date","episode","event","situation","content","social","init-char","init-no","init-gender","reci-char","reci-no","reci-gender","type","quality","init_char_1","init_no_1","init_gender_1","reci_char_1","reci_no_1","reci_gender_1","init_char_2","init_no_2","init_gender_2","reci_char_2","reci_no_2","reci_gender_2","init_char_3","init_no_3","init_gender_3","reci_char_3","reci_no_3","reci_gender_3","quality_2","wordcount"
"KR01WR","LN","2023-10-24 09:01:52",1,1,0,"Ich habe in meinem Traum auch in meinem Bett gelegen und geschlafen, genauso wie ich es auch im realen Lebne getan habe.",NA,NA,NA,NA,NA,NA,NA,NA,NA,NA,NA,NA,NA,NA,NA,NA,NA,NA,NA,NA,NA,NA,NA,NA,NA,NA,NA,NA,22
"KR01WR","LN","2023-10-24 09:01:52",1,1,1,"Plötzlich packen Hände von hinten um mein Gesicht und halten mir Mund und Nase zu. Ich bekomme keine Luft mehr …",0,NA,NA,NA,NA,NA,NA,NA,NA,NA,NA,NA,NA,NA,NA,NA,NA,NA,NA,NA,NA,NA,NA,NA,NA,NA,NA,NA,21
"KR01WR","LN","2023-10-24 09:01:52",1,1,999,"… und wache im realen Leben auf.",NA,NA,NA,NA,NA,NA,NA,NA,NA,NA,NA,NA,NA,NA,NA,NA,NA,NA,NA,NA,NA,NA,NA,NA,NA,NA,NA,NA,7
"KR01WR","LN","2023-10-25 08:28:19",1,1,0,"Es war abends in irgendeinem großen Raum mit vielen Menschen, die ich nicht kannte. Vorne war eine Leinwand an der Wand und ein Mann, der moderierte, denn es fand eine Art Quiznight statt. Im hinteren Raum waren ganz viele Stühle aufgebaut und vorne 3 Stühle für die Kandidaten, die gerade dran waren.",NA,NA,NA,NA,NA,NA,NA,NA,NA,NA,NA,NA,NA,NA,NA,NA,NA,NA,NA,NA,NA,NA,NA,NA,NA,NA,NA,NA,52
"KR01WR","LN","2023-10-25 08:28:19",1,1,1,"Der Moderator erklärte wie das Spiel funktionierte. Man sah immer den Anfang  einer Liedstelle an die Leinwand gebeamt und sollte daran erraten um  welches Lied es sich handelt indem man sagt wie der Text an der Stelle weiter geht.",1,3,1,1,1,1,NA,1,NA,3,1,1,1,1,2,NA,NA,NA,NA,NA,NA,NA,NA,NA,NA,NA,NA,NA,39
"KR01WR","LN","2023-10-25 08:28:19",1,1,2,"Das Spiel hat angefangen, obwohl noch alle durcheinander geredet haben, sodass ich gar nicht mitbekommen habe, dass schon etwas auf der Leinwand angezeigt wurde.",1,5,3,4,1,1,NA,1,NA,5,3,4,1,1,2,NA,NA,NA,NA,NA,NA,NA,NA,NA,NA,NA,NA,NA,24
"KR01WR","LN","2023-10-25 08:28:19",1,1,3,"Ein Mann mit schwarzen Haaren hat den Text richtig ergänzt und damit die Runde gewonnen.",1,4,1,1,1,1,NA,1,NA,4,1,1,1,1,2,NA,NA,NA,NA,NA,NA,NA,NA,NA,NA,NA,NA,NA,15
"KR01WR","LN","2023-10-25 08:28:19",1,1,4,"Die Person auf dem dritten Stuhl und ich mussten unsere Plätze an andere Leute abgeben und uns ganz hinten wieder anstellen.",1,5,3,4,1,1,NA,3,4,5,3,4,1,1,2,NA,NA,NA,NA,NA,NA,NA,NA,NA,NA,NA,NA,NA,21
"KR01WR","LN","2023-10-31 16:08:17",1,1,1,"Ich weiß nicht mehr viel, nur dass ich einen dritten Nippel hatte und deswegen die ganze Zeit geweint habe.",0,NA,NA,NA,NA,NA,NA,NA,NA,NA,NA,NA,NA,NA,NA,NA,NA,NA,NA,NA,NA,NA,NA,NA,NA,NA,NA,NA,19
