"id","rater","date","episode","event","situation","content","social","init-char","init-no","init-gender","reci-char","reci-no","reci-gender","type","quality","init_char_1","init_no_1","init_gender_1","reci_char_1","reci_no_1","reci_gender_1","init_char_2","init_no_2","init_gender_2","reci_char_2","reci_no_2","reci_gender_2","init_char_3","init_no_3","init_gender_3","reci_char_3","reci_no_3","reci_gender_3","quality_2","wordcount"
"EK06BR","LN","2023-10-22 06:32:46",1,1,1,"Mein Traum handelte von einem Tagestrip nach Amsterdam mit meiner besten Freundin, meiner Schwester meiner Nichte und einer mir unbekannten Person. Die Stimmung war insgesamt etwas gereizt weil die Interessen bei dem Ausflug stark auseinander gingen und man sich nicht einig werden konnte, was man dort unternehmen sollte.",1,1,1,NA,"212, 214, 231, 4",1,"2, 2, 2, 4",5,31,1,1,2,NA,1,NA,NA,NA,NA,NA,NA,NA,NA,NA,NA,NA,NA,NA,NA,48
"EK06BR","LN","2023-10-22 06:32:46",1,2,1,"Geschlafen haben wir dort in einem eher rustikalen Hotel.",1,1,1,NA,"212, 214, 231, 4",1,"2, 2, 2, 4",4,4,1,1,2,NA,1,NA,NA,NA,NA,NA,NA,NA,NA,NA,NA,NA,NA,NA,NA,9
"EK06BR","LN","2023-10-25 07:08:24",1,1,1,"Ich habe davon geträumt, dass ich wieder in meiner ersten eigenen Wohnung lebe. In der Wohnung wurde eine Party geschmissen …",1,5,2,4,"1",1,NA,1,NA,5,2,4,1,1,2,NA,NA,NA,NA,NA,NA,NA,NA,NA,NA,NA,NA,NA,21
"EK06BR","LN","2023-10-25 07:08:24",1,1,2,"… und in meiner Dusche stand Bill Kaulitz und ich habe mich mit ihm angefreundet.",1,1,1,NA,"3",1,"1",5,15,1,1,2,3,1,1,NA,NA,NA,NA,NA,NA,NA,NA,NA,NA,NA,NA,NA,15
"EK06BR","LN","2023-10-25 07:08:24",1,1,999,"An mehr kann ich mich leider nicht erinnern.",NA,NA,NA,NA,NA,NA,NA,NA,NA,NA,NA,NA,NA,NA,NA,NA,NA,NA,NA,NA,NA,NA,NA,NA,NA,NA,NA,NA,8
