"id","rater","date","episode","event","situation","content","social","init-char","init-no","init-gender","reci-char","reci-no","reci-gender","type","quality","init_char_1","init_no_1","init_gender_1","reci_char_1","reci_no_1","reci_gender_1","init_char_2","init_no_2","init_gender_2","reci_char_2","reci_no_2","reci_gender_2","init_char_3","init_no_3","init_gender_3","reci_char_3","reci_no_3","reci_gender_3","quality_2","wordcount"
"RO12MA","LN","2023-10-17 07:10:58",1,1,0,"- Heute Nacht -  Setting: Ein Haus und ein Nebenort, dass verwahrlost, kalt und einsam ist.  Timmy (zwischen 7 und 9 Jahre) = Ein Kind, dass ich nicht kenne.  Vater von Timmy = Ein Mann den ich nicht kenne.   Ein (obdachloser?) Mann = Ein Mann, den ich nicht kenne, aber einen einsamen und traurigen Eindruck gemacht hat, da er alleine in diesem Nebenort lebt. Beim aufschreiben, ist mir aufgefallen, dass er sich wie eine wilde Katze verhält.",NA,NA,NA,NA,NA,NA,NA,NA,NA,NA,NA,NA,NA,NA,NA,NA,NA,NA,NA,NA,NA,NA,NA,NA,NA,NA,NA,NA,77
"RO12MA","LN","2023-10-17 07:10:58",1,1,1,"Es beginnt wahrscheinlich damit, dass Timmy den Mann X findet, und versucht mit ihm zu interagieren. Der Mann ist sehr abweisend, …",1,"4",1,"1","4",1,"1",5,32,4,1,1,4,1,1,NA,NA,NA,NA,NA,NA,NA,NA,NA,NA,NA,NA,NA,22
"RO12MA","LN","2023-10-17 07:10:58",1,1,2,"… Timmy geht nachhause.",0,NA,NA,NA,NA,NA,NA,NA,NA,NA,NA,NA,NA,NA,NA,NA,NA,NA,NA,NA,NA,NA,NA,NA,NA,NA,NA,NA,4
"RO12MA","LN","2023-10-17 07:10:58",1,2,1,"Er kommt dann wieder, und gibt ihm eine warme fertig Suppendose. Der Mann ist immernoch abweisend und wimmelt ihn ab.",1,"4",1,"1","4",1,"1",5,14,4,1,1,4,1,1,NA,NA,NA,NA,NA,NA,NA,NA,NA,NA,NA,NA,NA,20
"RO12MA","LN","2023-10-17 07:10:58",1,3,1,"Timmy ist hartnäckig und Besucht ihn jeden Tag mit der Suppe, …",1,"4",1,"1","4",1,"1",3,14,4,1,1,4,1,1,NA,NA,NA,NA,NA,NA,NA,NA,NA,NA,NA,NA,NA,12
"RO12MA","LN","2023-10-17 07:10:58",1,4,1,"… bis eine Freundschaft und ein vertrauen entsteht.",1,"4",1,"1","4",1,"1",5,31,4,1,1,4,1,1,NA,NA,NA,NA,NA,NA,NA,NA,NA,NA,NA,NA,NA,8
"RO12MA","LN","2023-10-17 07:10:58",1,5,1,"Timmy bemerkt, dass der Mann krank ist und erzählt seinem Vater alles.   In dem Moment wird klar, dass die Hintertür des Hauses mit den Nebenort verbunden ist, und deshalb Timmy dahin gehen konnte.",1,"4",1,"1","4",1,"1",3,16,4,1,1,4,1,1,NA,NA,NA,NA,NA,NA,NA,NA,NA,NA,NA,NA,NA,33
"RO12MA","LN","2023-10-17 07:10:58",1,5,2,"Der Vater geht ohne Timmy zum Mann, und der Mann ist sehr abweisend und böse. Der Vater möchte ihn nur zum Arzt fahren.",1,"4",1,"1","4",1,"1",5,14,4,1,1,4,1,1,NA,NA,NA,NA,NA,NA,NA,NA,NA,NA,NA,NA,NA,23
"RO12MA","LN","2023-10-17 07:10:58",1,6,1,"Später kommt Timmy dazu und der Mann wird wieder abwesend, aber sein Gesicht beruhigt (aber ein Blick von: Warum hast du mich verraten?) sich.",1,"4",2,"1","4",1,"1",5,31,4,2,1,4,1,1,NA,NA,NA,NA,NA,NA,NA,NA,NA,NA,NA,NA,NA,24
"RO12MA","LN","2023-10-17 07:10:58",1,7,1,"Der Vater und Timmy besuchen den Mann jeden Tag mit Suppe (anscheinend hat Timmy die Harthäckigkeit von seinem Vater) …",1,"4",2,"1","4",1,"1",3,14,4,2,1,4,1,1,NA,NA,NA,NA,NA,NA,NA,NA,NA,NA,NA,NA,NA,20
"RO12MA","LN","2023-10-17 07:10:58",1,7,2,"… und der Mann öffnet sich immer mehr.",1,"4",2,"1","4",1,"1",5,14,4,2,1,4,1,1,NA,NA,NA,NA,NA,NA,NA,NA,NA,NA,NA,NA,NA,8
"RO12MA","LN","2023-10-17 07:10:58",1,8,1,"Am Ende akzeptiert er das Angebot zum Arzt zu gehen, …",1,"4",2,"1","4",1,"1",5,4,4,2,1,4,1,1,NA,NA,NA,NA,NA,NA,NA,NA,NA,NA,NA,NA,NA,11
"RO12MA","LN","2023-10-17 07:10:58",1,9,1,"… und kurz bevor ich aufgewacht bin, gab es ein kleines Bild, wo der Mann gesund aussah.",1,"4",1,"1","1",1,NA,1,NA,4,1,1,1,1,2,NA,NA,NA,NA,NA,NA,NA,NA,NA,NA,NA,NA,NA,17
"RO12MA","LN","2023-10-17 07:10:58",1,9,999,"- Es war wie ein kleiner Kurzfilm, ich war eher nur eine Beobachterin -",NA,NA,NA,NA,NA,NA,NA,NA,NA,NA,NA,NA,NA,NA,NA,NA,NA,NA,NA,NA,NA,NA,NA,NA,NA,NA,NA,NA,14
"RO12MA","LN","2023-10-19 06:48:06",1,1,0,"1. Traum - Nachts bis ich kurz nachts aufgewacht bin  Ich war mit meiner Familie: Vater, Stiefmutter und Schwester (Jüngere)  - Setting war in Essen in der Innenstadt -",NA,NA,NA,NA,NA,NA,NA,NA,NA,NA,NA,NA,NA,NA,NA,NA,NA,NA,NA,NA,NA,NA,NA,NA,NA,NA,NA,NA,29
"RO12MA","LN","2023-10-19 06:48:06",1,1,1,"Ich brauchte einpaar Sachen, die ich auf einer größeren Shopping-Tour besorgen musste. Meine Familie hat mich begleitet.",1,"1",1,NA,"211, 212, 214",1,"1, 2, 2",4,4,1,1,2,NA,1,NA,NA,NA,NA,NA,NA,NA,NA,NA,NA,NA,NA,NA,NA,17
"RO12MA","LN","2023-10-19 06:48:06",1,1,2,"Wir waren in vielen Läden und es hat sich mehr wie in London angefühlt, da es große Markenläden waren, die komplett überteuert waren, unter anderem MickyMouse.",1,"1",1,NA,"211, 212, 214",1,"1, 2, 2",4,4,1,1,2,NA,1,NA,NA,NA,NA,NA,NA,NA,NA,NA,NA,NA,NA,NA,NA,26
"RO12MA","LN","2023-10-19 06:48:06",1,1,3,"Wir waren weitere auf die Suche und irgendwann war die Stimmung langsam immer angespannter, meine Familie wollte nicht mehr laufen und meine Schwester war mich die ganze Zeit am nerven. (Wie weiß ich nicht mehr)",1,"212",1,"2","1",1,NA,3,32,212,1,2,1,1,2,NA,NA,NA,NA,NA,NA,NA,NA,NA,NA,NA,NA,NA,35
"RO12MA","LN","2023-10-19 06:48:06",1,2,1,"Irgendwann sind wir raus gegeangen von diesem Einkaufszentrum und es war eine Art Kirmes draußen.",1,"1",1,NA,"211, 212, 214",1,"1, 2, 2",4,4,1,1,2,NA,1,NA,NA,NA,NA,NA,NA,NA,NA,NA,NA,NA,NA,NA,NA,15
"RO12MA","LN","2023-10-19 06:48:06",1,2,2,"Wir haben Crepes gekauft. Meine Stiefmutter mit Nutella und ich mit einer Art Erdbeersoße. Der Verkaufer hat gesagt, dass die Soße wegen den Erdbeeren teuerer sei.",1,"1, 214",1,"1, 2","3",1,"1",5,4,NA,1,NA,3,1,1,NA,NA,NA,NA,NA,NA,NA,NA,NA,NA,NA,NA,NA,26
"RO12MA","LN","2023-10-19 06:48:06",1,2,3,"Man sieht im hintergrud wie meine Schwester ihren Schokocrepe mit Smarites ertränkt.",1,"212",1,"2","1",1,NA,1,NA,212,1,2,1,1,2,NA,NA,NA,NA,NA,NA,NA,NA,NA,NA,NA,NA,NA,12
"RO12MA","LN","2023-10-19 06:48:06",1,2,999,"Dann war ich wach.  -> ein eher stressiger Traum",NA,NA,NA,NA,NA,NA,NA,NA,NA,NA,NA,NA,NA,NA,NA,NA,NA,NA,NA,NA,NA,NA,NA,NA,NA,NA,NA,NA,9
"RO12MA","LN","2023-10-19 06:48:06",2,1,0,"2. Traum - Nachdem ich meinen vorherigen in Stichpunken aufgeschrieben habe und wieder schlafen gegangen bin  L.- Meine langjärige Online-Freundin, M. - ein guter Online-Freund (beide habe ich zuvor persönlich kennengelernt), wir spielen öfters Games zusammen, oder reden stundenlang über die Welt und unser Leben  - Setting erstmal Zuhause dann irgendwo in Österreich -",NA,NA,NA,NA,NA,NA,NA,NA,NA,NA,NA,NA,NA,NA,NA,NA,NA,NA,NA,NA,NA,NA,NA,NA,NA,NA,NA,NA,54
"RO12MA","LN","2023-10-19 06:48:06",2,1,1,"Ich und M, die eine längere Anreise, aus zwei verschiedenen Punkten Deutschlands, zu L. in Österreich haben, haben und spontan entschieden dahin zu fahren, mit dem Zug. Schnell den Zug gebucht, …",1,"1",1,NA,"231",1,"2",5,4,1,1,2,231,1,2,NA,NA,NA,NA,NA,NA,NA,NA,NA,NA,NA,NA,NA,32
"RO12MA","LN","2023-10-19 06:48:06",2,1,2,"… Sachen gepackt …",1,"1",1,NA,"231",1,"2",4,4,1,1,2,231,1,2,NA,NA,NA,NA,NA,NA,NA,NA,NA,NA,NA,NA,NA,4
"RO12MA","LN","2023-10-19 06:48:06",2,1,3,"… und dahin gefahren.",1,"1",1,NA,"231",1,"2",4,4,1,1,2,231,1,2,NA,NA,NA,NA,NA,NA,NA,NA,NA,NA,NA,NA,NA,4
"RO12MA","LN","2023-10-19 06:48:06",2,2,1,"Bei M. angekommen sind wir in ein Auto (hellblau) eingestiegen …",1,"1",1,NA,"231",1,"2",4,4,1,1,2,231,1,2,NA,NA,NA,NA,NA,NA,NA,NA,NA,NA,NA,NA,NA,11
"RO12MA","LN","2023-10-19 06:48:06",2,2,2,"… und L. ist gefahren (mir ist nicht bekannt, dass er fahren kann). Wir sind einfach durch die schöne Landschaft von Österreich gefahren und ich hab einen Aufhang wieder erinnert  Ich  Ach fahren wir wieder diesen weg?  (der Weg kommt mir bekannt vor, ich verbinde den mit M aber ich weiß nicht ob das wegen einem anderen Traum, oder unserem Treffen vor 1,5 Wochen war.)  M. :  Ja, letzens wollte ich den eigentlich nicht fahren, doch ist der eigentich angenehm  (Obwohl der Weg sehr steil nachoben fährt, mit einer blöden kante.)  L. :  Schaut mal, da ist ein kleines Haus, dass sieht irgendwie verlassen aus",1,"1",1,NA,"231",2,"3",5,4,1,1,2,231,2,3,NA,NA,NA,NA,NA,NA,NA,NA,NA,NA,NA,NA,NA,105
"RO12MA","LN","2023-10-19 06:48:06",2,3,1,"Wir gehen rein, die Tür war offen. Das Haus vom inneren sieht lebendig aus, ist aber unordentlich, als wäre es erst vor wenigen Wochen erst verlassen worden.",1,"1",1,NA,"231",2,"3",4,4,1,1,2,231,2,3,NA,NA,NA,NA,NA,NA,NA,NA,NA,NA,NA,NA,NA,27
"RO12MA","LN","2023-10-19 06:48:06",2,3,2,"Wir zählen anhand der Kinderschuhe neben den Betten, dass zwischen 5 - 10 Kinder hier gelebt haben.",1,"1",1,NA,"231",2,"3",5,4,1,1,2,231,2,3,NA,NA,NA,NA,NA,NA,NA,NA,NA,NA,NA,NA,NA,17
"RO12MA","LN","2023-10-19 06:48:06",2,3,3,"Wir vermuten die Familie ist im Urlaub und hat vergessen die Tür zu schließen und gehen friedlich raus.",1,"1",1,NA,"231",2,"3",5,4,1,1,2,231,2,3,NA,NA,NA,NA,NA,NA,NA,NA,NA,NA,NA,NA,NA,18
"RO12MA","LN","2023-10-19 06:48:06",2,4,1,"Dann kommt eine Szene, wo wir enfach mit den Auto schnell fahren.",1,"1",1,NA,"231",2,"3",4,4,1,1,2,231,2,3,NA,NA,NA,NA,NA,NA,NA,NA,NA,NA,NA,NA,NA,12
"RO12MA","LN","2023-10-19 06:48:06",2,5,1,"Wir stoppen gelegentlich bei Wasserfällen, …",1,"1",1,NA,"231",2,"3",4,4,1,1,2,231,2,3,NA,NA,NA,NA,NA,NA,NA,NA,NA,NA,NA,NA,NA,6
"RO12MA","LN","2023-10-19 06:48:06",2,5,2,"… gehen in diese halb rein (ohne nass zu werden?) …",1,"1",1,NA,"231",2,"3",4,4,1,1,2,231,2,3,NA,NA,NA,NA,NA,NA,NA,NA,NA,NA,NA,NA,NA,11
"RO12MA","LN","2023-10-19 06:48:06",2,5,3,"… und machen Fotos von uns gegenseitig.",1,"1",1,NA,"231",2,"3",4,4,1,1,2,231,2,3,NA,NA,NA,NA,NA,NA,NA,NA,NA,NA,NA,NA,NA,7
"RO12MA","LN","2023-10-19 06:48:06",2,5,4,"Wir klettern sehr hoch zum Anfang dieser kleineren Wasserfälle …",1,"1",1,NA,"231",2,"3",4,4,1,1,2,231,2,3,NA,NA,NA,NA,NA,NA,NA,NA,NA,NA,NA,NA,NA,10
"RO12MA","LN","2023-10-19 06:48:06",2,5,5,"… und machen da Fotos …",1,"1",1,NA,"231",2,"3",4,4,1,1,2,231,2,3,NA,NA,NA,NA,NA,NA,NA,NA,NA,NA,NA,NA,NA,6
"RO12MA","LN","2023-10-19 06:48:06",2,5,999,"… und fahren dann weiter.",NA,NA,NA,NA,NA,NA,NA,NA,NA,NA,NA,NA,NA,NA,NA,NA,NA,NA,NA,NA,NA,NA,NA,NA,NA,NA,NA,NA,5
"RO12MA","LN","2023-10-19 06:48:06",2,5,6,"Ich stehe bei den Fotos oft neben L. und wir machen lustige Posen.",1,"1",1,NA,"231",1,"2",5,31,1,1,2,231,1,2,NA,NA,NA,NA,NA,NA,NA,NA,NA,NA,NA,NA,NA,13
"RO12MA","LN","2023-10-19 06:48:06",2,6,1,"Dann fahren wir weiter und M. fängt an zu fahren, wie als wären wir in einem Subway-Surfer spiel. Es kommen viele Autos und er dodged sie sehr knapp. Ich wundere mich, weil ich die erwartet hätte, dass er so unsicher fährt, genieße aber das Adrenalin.",1,"1",1,NA,"231",2,"3",4,4,1,1,2,231,2,3,NA,NA,NA,NA,NA,NA,NA,NA,NA,NA,NA,NA,NA,45
"RO12MA","LN","2023-10-19 06:48:06",2,6,999,"Hier irgendwann war ich wach.    -> ein sehr schöner Traum, auch noch gut bildlich in meinen Gedanken sichtbar",NA,NA,NA,NA,NA,NA,NA,NA,NA,NA,NA,NA,NA,NA,NA,NA,NA,NA,NA,NA,NA,NA,NA,NA,NA,NA,NA,NA,18
"RO12MA","LN","2023-10-20 07:31:13",1,1,0,"Ich kann mich an kleine Ausschnitte aus dem Traum erinnern.  - Setting ist in der Uni -  Ich hatte irgendwelche Vorlesungen und bin später zu einer Art Sportplatz in der (oder in der Nähe) der Uni.",NA,NA,NA,NA,NA,NA,NA,NA,NA,NA,NA,NA,NA,NA,NA,NA,NA,NA,NA,NA,NA,NA,NA,NA,NA,NA,NA,NA,36
"RO12MA","LN","2023-10-20 07:31:13",1,1,1,"In der Vorlesung sehe ich eine Dozentin, die immer das selbe Oberteil trägt.",1,"3",1,"2","1",1,NA,1,NA,3,1,2,1,1,2,NA,NA,NA,NA,NA,NA,NA,NA,NA,NA,NA,NA,NA,13
"RO12MA","LN","2023-10-20 07:31:13",1,2,1,"Eine Freundin von mir hat Mädchen geleitet, wie sie ihre sportlichen Leistungen demonstiert haben. Als ich da war, war ich überrascht, dass ausgerechnet diese Freundin irgendwas sportliches macht, da sie für einen 10 min. Laufweg, den Bus bevorzugt.",1,"231",1,"2","4",2,"2",3,4,231,1,2,4,2,2,NA,NA,NA,NA,NA,NA,NA,NA,NA,NA,NA,NA,NA,38
"RO12MA","LN","2023-10-20 07:31:13",1,2,2,"Auf einmal kommt der Coach und es ist mein alter Sport/Mathematik Lehrer (7.-9. Klasse) und wir tauschen uns aus, was wir so im Leben erreicht haben.  - Ende? -",1,"1",1,NA,"232",1,"1",5,4,1,1,2,232,1,1,NA,NA,NA,NA,NA,NA,NA,NA,NA,NA,NA,NA,NA,29
"RO12MA","LN","2023-10-22 07:42:50",1,1,0,"Vorgeschichte: Für mein Stipendium muss ich mehrtätige Seminare ablegen und in diesem Traum war ich grad dabei eins abzulegen.  - Setting: Irgendwo an einer Küste -",NA,NA,NA,NA,NA,NA,NA,NA,NA,NA,NA,NA,NA,NA,NA,NA,NA,NA,NA,NA,NA,NA,NA,NA,NA,NA,NA,NA,26
"RO12MA","LN","2023-10-22 07:42:50",1,1,1,"Wir waren grad auf dem Weg zum Ort, wo wir das Wochenende zusammen verbringen wollten.",1,"1",1,NA,"5",3,"4",4,4,1,1,2,5,3,4,NA,NA,NA,NA,NA,NA,NA,NA,NA,NA,NA,NA,NA,15
"RO12MA","LN","2023-10-22 07:42:50",1,1,2,"Es gab Probleme bei dem kaufen derTickets für die Fähre und ich habe finanziell kurz ausgeholfen, da die Karte des Stipendiumskonto nicht funktioniert hat. Ich habe zweimal 189,99 Euro bezahlt und auch zurück gekriegt. Es war wie auf einer Klassenfahrt, die Orga gestresst, die Teilnehmer ungeduldig.",1,"1",1,NA,"5",3,"4",5,14,1,1,2,5,3,4,NA,NA,NA,NA,NA,NA,NA,NA,NA,NA,NA,NA,NA,46
"RO12MA","LN","2023-10-22 07:42:50",1,2,1,"Irgendwann haben wir es geschafft bei unserem Aufenhaltsort und gleichzeitig Hotel anzukommen.  Der Ort war schön und wir hatten einen schönen Ausblick aufs Wasser.",1,"1",1,NA,"5",3,"4",4,4,1,1,2,5,3,4,NA,NA,NA,NA,NA,NA,NA,NA,NA,NA,NA,NA,NA,24
"RO12MA","LN","2023-10-22 07:42:50",1,3,1,"Nach einpaar Veranstaltungen, hatten wir endlich Ruhe …",1,"1",1,NA,"5",3,"4",4,4,1,1,2,5,3,4,NA,NA,NA,NA,NA,NA,NA,NA,NA,NA,NA,NA,NA,8
"RO12MA","LN","2023-10-22 07:42:50",1,4,1,"… und sind Abendessen gegangen. Es entstand Small-talk wo man sich nochmal kennengelernt hat.",1,"1",1,NA,"5",3,"4",5,4,1,1,2,5,3,4,NA,NA,NA,NA,NA,NA,NA,NA,NA,NA,NA,NA,NA,14
"RO12MA","LN","2023-10-22 07:42:50",1,4,2,"Ich war nach einer Zeit so fertig, dass ich dachte, eine Person wieder erkannt zu haben. Ich dachte es wäre eine bekannte mit Kopftuch, als sie sich umdrehte, hatte sie 1. keins an, 2. sie war es nicht und wir haben beide drüber gelacht.",1,"1",1,NA,"4",1,"2",5,4,1,1,2,4,1,2,NA,NA,NA,NA,NA,NA,NA,NA,NA,NA,NA,NA,NA,44
"RO12MA","LN","2023-10-22 07:42:50",1,4,3,"Das war mein Moment, wo ich mir dachte, nimm dir nen Saft mit, geh in dein Zimmer genieß die Aussicht in Ruhe und geh dann schlafen.",0,NA,NA,NA,NA,NA,NA,NA,NA,NA,NA,NA,NA,NA,NA,NA,NA,NA,NA,NA,NA,NA,NA,NA,NA,NA,NA,NA,26
"RO12MA","LN","2023-10-22 07:42:50",1,4,4,"Dies habe ich getan.",0,NA,NA,NA,NA,NA,NA,NA,NA,NA,NA,NA,NA,NA,NA,NA,NA,NA,NA,NA,NA,NA,NA,NA,NA,NA,NA,NA,4
"RO12MA","LN","2023-10-22 07:42:50",1,5,1,"Am nächsten Tag war ich verwundert M. wieder zu sehen. Er hat nämlich das Stipendium nicht, und dieser Ort war aussschließlich dafür gemietet. Ich habe mich aber einfach gefreut ihn wieder zu sehen …",1,"231",1,"1","1",1,NA,2,31,231,1,1,1,1,2,NA,NA,NA,NA,NA,NA,NA,NA,NA,NA,NA,NA,NA,34
"RO12MA","LN","2023-10-22 07:42:50",1,5,2,"… und wir haben die Zeit miteinander verbracht und gemeinsam kleinere Kontakte gemacht.",1,"1, 231",1,"1","5",2,"4",5,4,NA,1,1,5,2,4,NA,NA,NA,NA,NA,NA,NA,NA,NA,NA,NA,NA,NA,13
"RO12MA","LN","2023-10-22 07:42:50",1,5,3,"Wir haben gemeinsam Mittag- …",1,"1",1,NA,"231",1,"1",5,4,1,1,2,231,1,1,NA,NA,NA,NA,NA,NA,NA,NA,NA,NA,NA,NA,NA,5
"RO12MA","LN","2023-10-22 07:42:50",1,5,4,"… und Abend gegessen und es war wirklich angenehm.",1,"1",1,NA,"231",1,"1",5,4,1,1,2,231,1,1,NA,NA,NA,NA,NA,NA,NA,NA,NA,NA,NA,NA,NA,9
"RO12MA","LN","2023-10-22 07:42:50",1,6,1,"Nach weiteren Veranstaltungen waren wir beide fix und fertig und unten war eine laute Party mit Alkohol und deswegen haben wir uns entschieden mit einem Kakao in mein Zimmer zu gehen und da die Aussicht zu genießen und bisschen zu Quatschen.",1,"1",1,NA,"231",1,"1",5,4,1,1,2,231,1,1,NA,NA,NA,NA,NA,NA,NA,NA,NA,NA,NA,NA,NA,41
"RO12MA","LN","2023-10-22 07:42:50",1,6,2,"Als wir reingegangen sind, sah es aber plötzlich aus wie mein Schlafzimmer, mit allem drinnen was mir gehört, und es war einbisschen unaufgeräumt, da ich bevor die Abreise eine Intensive Lernphase hatte und es nicht geschafft habe es aufzuräumen.",1,"1",1,NA,"231",1,"1",4,4,1,1,2,231,1,1,NA,NA,NA,NA,NA,NA,NA,NA,NA,NA,NA,NA,NA,39
"RO12MA","LN","2023-10-22 07:42:50",1,6,3,"Ich habe es bisschen aufgeräumt …",0,NA,NA,NA,NA,NA,NA,NA,NA,NA,NA,NA,NA,NA,NA,NA,NA,NA,NA,NA,NA,NA,NA,NA,NA,NA,NA,NA,6
"RO12MA","LN","2023-10-22 07:42:50",1,6,4,"… und dann ist er nach einer Zeit gegangen, es war sehr spät.",0,NA,NA,NA,NA,NA,NA,NA,NA,NA,NA,NA,NA,NA,NA,NA,NA,NA,NA,NA,NA,NA,NA,NA,NA,NA,NA,NA,13
"RO12MA","LN","2023-10-22 07:42:50",1,7,1,"Am nächsten Tag hat er mich geweckt, weil ich wohl am verschlafen war …",1,"231",1,"1","1",1,NA,3,4,231,1,1,1,1,2,NA,NA,NA,NA,NA,NA,NA,NA,NA,NA,NA,NA,NA,14
"RO12MA","LN","2023-10-22 07:42:50",1,7,2,"… und ich habe mich an meinem Kleinerschrank bedient.",0,NA,NA,NA,NA,NA,NA,NA,NA,NA,NA,NA,NA,NA,NA,NA,NA,NA,NA,NA,NA,NA,NA,NA,NA,NA,NA,NA,9
"RO12MA","LN","2023-10-22 07:42:50",1,7,999,"- Irgendwann da war ich wach, der Traum war angenehm, da die Umgebung wirklich beruhigend war -",NA,NA,NA,NA,NA,NA,NA,NA,NA,NA,NA,NA,NA,NA,NA,NA,NA,NA,NA,NA,NA,NA,NA,NA,NA,NA,NA,NA,17
"RO12MA","LN","2023-10-23 10:05:08",1,1,0,"Ich habe in der Nacht geträumt  Kontext: Mein Stipendium ist parteinah  - Setting irgendwo in einem politischem Seminarraum -",NA,NA,NA,NA,NA,NA,NA,NA,NA,NA,NA,NA,NA,NA,NA,NA,NA,NA,NA,NA,NA,NA,NA,NA,NA,NA,NA,NA,19
"RO12MA","LN","2023-10-23 10:05:08",1,1,1,"Ich war ein einem Raum, wo es jeweils 2-3 junge Vertreter für alle Parteien in Deutschland (AFD, Linke, Grüne, FDP, SPD...) da waren und wir haben über etwas diskutiert.",1,"1",1,NA,"4",2,"4",5,4,1,1,2,4,2,4,NA,NA,NA,NA,NA,NA,NA,NA,NA,NA,NA,NA,NA,29
"RO12MA","LN","2023-10-23 10:05:08",1,1,2,"Ich habe mich gewundert, dass die AFD junge Vertreter hat und hab mir gedacht, dass ich nichts mit denen zu tun aben möchte. Ich war nicht freiwillig da und wurde von meinem Stiftung gedrängt, obwohl ich mich nicht wirklich mit der Partei X identifiziere, geschwiege sie wähle, ich finde lediglich die Werte der Stiftung gut.",1,"4",2,"4","1",1,NA,2,32,4,2,4,1,1,2,NA,NA,NA,NA,NA,NA,NA,NA,NA,NA,NA,NA,NA,55
"RO12MA","LN","2023-10-23 10:05:08",1,1,3,"Ich habe mich mit den Vertretern die neben mir saßen unterhalten und es war sehr nett.",1,"1",1,NA,"4",2,"4",5,31,1,1,2,4,2,4,NA,NA,NA,NA,NA,NA,NA,NA,NA,NA,NA,NA,NA,16
"RO12MA","LN","2023-10-23 10:05:08",1,1,4,"Auf einmal kommt eine Vertreterin der AFD zu uns und ich denke mir schon:  Oh man, warum kommt ausgerechnet sie zu mir. Es ist offensichtlich, dass sie gegen uns (Menschen mit Migrationshintergrund) sind, warum kommt sie?   Sie hatte kurze blonde Haare, schulterlang, blaue Augen und sehr schick gekleidet. Ich habe versucht freundlich zu bleiben.  Ich weiß nicht mehr genau worüber wir gesprochen haben, sie war aber verwundert, warum ich bei der Partei X bin, dass ich da nicht passe.",1,"4",1,"2","1",1,NA,3,15,4,1,2,1,1,2,NA,NA,NA,NA,NA,NA,NA,NA,NA,NA,NA,NA,NA,79
"RO12MA","LN","2023-10-23 10:05:08",1,2,1,"Ich hatte keine Lust mehr und gesagt, dass ich auf Toilette muss.",1,"1",1,NA,"4",1,"2",3,25,1,1,2,4,1,2,NA,NA,NA,NA,NA,NA,NA,NA,NA,NA,NA,NA,NA,12
"RO12MA","LN","2023-10-23 10:05:08",1,2,2,"Ich bin auf die Suche nach der Toilette gegangen und war dann plötzlich in einem riesen Einkaufszentrum, wahrscheinlich ist das damit gekoppelt.",0,NA,NA,NA,NA,NA,NA,NA,NA,NA,NA,NA,NA,NA,NA,NA,NA,NA,NA,NA,NA,NA,NA,NA,NA,NA,NA,NA,22
"RO12MA","LN","2023-10-23 10:05:08",1,2,3,"Ich hab die Toilette dann gefunden …",0,NA,NA,NA,NA,NA,NA,NA,NA,NA,NA,NA,NA,NA,NA,NA,NA,NA,NA,NA,NA,NA,NA,NA,NA,NA,NA,NA,7
"RO12MA","LN","2023-10-23 10:05:08",1,2,4,"… und bin kurz bevor das Programm gestartet ist zurück gegangen, um ein Gespräch zu meiden.",0,NA,NA,NA,NA,NA,NA,NA,NA,NA,NA,NA,NA,NA,NA,NA,NA,NA,NA,NA,NA,NA,NA,NA,NA,NA,NA,NA,16
"RO12MA","LN","2023-10-23 10:05:08",1,3,1,"Als das Programm angefangen hat, sind mehrere Politisch-relevanten Leute mit ihren Bodyguards gekommen, die alle Fenster und Türen überwacht haben. Es war langweilig.",1,"3, 4",2,"4","1",1,NA,1,NA,NA,2,4,1,1,2,NA,NA,NA,NA,NA,NA,NA,NA,NA,NA,NA,NA,NA,23
"RO12MA","LN","2023-10-23 10:05:08",1,3,999,"- irgendwann da hat mein Wecker geklingelt -",NA,NA,NA,NA,NA,NA,NA,NA,NA,NA,NA,NA,NA,NA,NA,NA,NA,NA,NA,NA,NA,NA,NA,NA,NA,NA,NA,NA,8
"RO12MA","LN","2023-10-25 08:51:44",1,1,0,"1. Traum   Kontext: Ich arbeite einmal die Woche und muss von meiner Stadt A zur Stadt B dafür, dafür muss ich erstmals zum A HBF und dann zum B HBF. Ich brauche dafür ca. 45-60 Minuten. Die Arbeit ist 10 Minuten zu Fuß vom HBF B enfernt. Ich arbeite mit Jugendlichen und jungen Erwachsenen, und unterrichte sie, indem ich ihnen Basics beirbringe, quasi ein Kurs. Dieser Kurs ist kostenlos und freiwillig für die Teilnehmenden, deswegen ist die Atmosphäre sehr angenehm. Da es mein erster Kurs ist, werde ich von einer Teamleitung BW.  beobachtet  die mir anschließend Feedback und Anregungen gibt.  -Setting ??? -",NA,NA,NA,NA,NA,NA,NA,NA,NA,NA,NA,NA,NA,NA,NA,NA,NA,NA,NA,NA,NA,NA,NA,NA,NA,NA,NA,NA,103
"RO12MA","LN","2023-10-25 08:51:44",1,1,1,"Ich hab mich fertig gemacht, um zur Stadt B zu kommen.",0,NA,NA,NA,NA,NA,NA,NA,NA,NA,NA,NA,NA,NA,NA,NA,NA,NA,NA,NA,NA,NA,NA,NA,NA,NA,NA,NA,11
"RO12MA","LN","2023-10-25 08:51:44",1,2,1,"Ich bin am HBF A angekommen, und mir ist aufgefallen, dass ich vergessen habe meine Brille anzuziehen und mein Regenschirm mit zu nehmen. Ich dachte mir kein Problem, weil ich ohne Brille noch genug sehen kann und meine Jacke eine Kaputze hat.",0,NA,NA,NA,NA,NA,NA,NA,NA,NA,NA,NA,NA,NA,NA,NA,NA,NA,NA,NA,NA,NA,NA,NA,NA,NA,NA,NA,42
"RO12MA","LN","2023-10-25 08:51:44",1,2,2,"Ich laufe Richtung Gleis, um den Zug zur Stadt B zu nehmen (30 Minuten fahrt) …",0,NA,NA,NA,NA,NA,NA,NA,NA,NA,NA,NA,NA,NA,NA,NA,NA,NA,NA,NA,NA,NA,NA,NA,NA,NA,NA,NA,16
"RO12MA","LN","2023-10-25 08:51:44",1,3,1,"… und bin auf einmal in einem Gang auf dem öfters HBF steht. Ich wundere mich, da ich als ich am Ende des Ganges die Tür vom Unterrichtsraum gesehen habe.",0,NA,NA,NA,NA,NA,NA,NA,NA,NA,NA,NA,NA,NA,NA,NA,NA,NA,NA,NA,NA,NA,NA,NA,NA,NA,NA,NA,30
"RO12MA","LN","2023-10-25 08:51:44",1,3,2,"Ich habe mich umgedreht und war in dem Gebäude in dem ich unterrichte und meine Kurs-Teilnehmer stehen da und warten (um die 8-10). Ich bin sehr verwirrt und denke mir, ich war noch in meinen Tagträumen im Zug und bin unbewusst schon weiter gewesen als gedacht.",1,"232",2,"4","1",1,NA,1,NA,232,2,4,1,1,2,NA,NA,NA,NA,NA,NA,NA,NA,NA,NA,NA,NA,NA,46
"RO12MA","LN","2023-10-25 08:51:44",1,3,3,"Ich mach eine kleine Ansprache nachdem wir rein gegangen sind:  Hallo, schön das ihr heute erscheinen seid. Wir ihr bemerkt habt, bin ich heute ohne Brille unterwegs und sehe ein bisschen eingeschränkt aber-   Die Teilnehmenden fangen an zu lachen und ich bemerke, dass ich sie klar sehen kann und erkenne den Umriss meiner Brille.",1,"1",1,NA,"232",2,"4",5,4,1,1,2,232,2,4,NA,NA,NA,NA,NA,NA,NA,NA,NA,NA,NA,NA,NA,54
"RO12MA","LN","2023-10-25 08:51:44",1,3,4,"Ich sehe auf meinem Handgelenk meinen Regenschirm. In dem Moment war ich sehr verwirrt und habe überlegt, ob ich mir das alles einbilde, weil eigentlich bin ich im A HBF ohne Brille und Regenschirm?",0,NA,NA,NA,NA,NA,NA,NA,NA,NA,NA,NA,NA,NA,NA,NA,NA,NA,NA,NA,NA,NA,NA,NA,NA,NA,NA,NA,34
"RO12MA","LN","2023-10-25 08:51:44",1,3,5,"BW. fragt ob es mir gut geht und ich schaue BW. perplex an.  Bin ich wirklich hier? Ich war doch grad in meiner Stadt, bilde ich mir euch ein? Es passiert nie, dass alle auf einmal da sind. Ich hab eigentlich meine Brille und meinen Regenschirm vergessen? Jetzt ist mein Regenschirm hier und meine Brille auch.",1,"232",1,"1","1",1,NA,5,4,232,1,1,1,1,2,NA,NA,NA,NA,NA,NA,NA,NA,NA,NA,NA,NA,NA,56
"RO12MA","LN","2023-10-25 08:51:44",1,3,6,"BW. hat versucht mich zu beruhigen, …",1,"232",1,"1","1",1,NA,3,17,232,1,1,1,1,2,NA,NA,NA,NA,NA,NA,NA,NA,NA,NA,NA,NA,NA,7
"RO12MA","LN","2023-10-25 08:51:44",1,3,999,"… dann ging der Wecker meiner Schwester an.  - Der Traum war nicht wirklich unangenehm, ich habs manchmal, dass ich so vertieft in meinen Gedanken bin, dass ich weiter gelaufen bin als gedacht, aber nie so extrem. -",NA,NA,NA,NA,NA,NA,NA,NA,NA,NA,NA,NA,NA,NA,NA,NA,NA,NA,NA,NA,NA,NA,NA,NA,NA,NA,NA,NA,38
"RO12MA","LN","2023-10-25 08:51:44",2,1,0,"2. Traum  Kontext: Diese Nacht war nicht so gut, weil es mir nicht gut geht. Ich gehe heute nicht zur Vorlesung deswegen.  - Zeit der Tag nachdem ich nicht zur Vorlesung gegangen bin. -",NA,NA,NA,NA,NA,NA,NA,NA,NA,NA,NA,NA,NA,NA,NA,NA,NA,NA,NA,NA,NA,NA,NA,NA,NA,NA,NA,NA,34
"RO12MA","LN","2023-10-25 08:51:44",2,1,1,"Ich bin in der Uni (UDE) angekommen und auf einmal steht der Dozent vor mir, bei dem ich eigentlich im Tag davor nicht erschienen bin. Ich war verwundert, dass er das gemerkt hat, weil wir mehr ca. 110-120 Leute in dieser Vorlesung sind.",1,"232",1,"1","1",1,NA,3,4,232,1,1,1,1,2,NA,NA,NA,NA,NA,NA,NA,NA,NA,NA,NA,NA,NA,43
"RO12MA","LN","2023-10-25 08:51:44",2,1,2,"Er hat mir ein Blatt zum ankreuzen gegeben …",1,"232",1,"1","1",1,NA,3,4,232,1,1,1,1,2,NA,NA,NA,NA,NA,NA,NA,NA,NA,NA,NA,NA,NA,9
"RO12MA","LN","2023-10-25 08:51:44",2,1,3,"… und ich solle die Gründe ankreuzen weshalb ich gefehlt habe. Ich wollte das nicht machen, weil es meine Sache ist, aber ich habe es gemacht um Konflikte zu vermeiden.  Auf dem Blatt standen Sachen wie Übelkeit, Kopfschmerzen, Fieber, Erbrechen, Migräne, Mentale Gesundheit usw. ...",1,"232",1,"1","1",1,NA,3,4,232,1,1,1,1,2,NA,NA,NA,NA,NA,NA,NA,NA,NA,NA,NA,NA,NA,45
"RO12MA","LN","2023-10-25 08:51:44",2,1,4,"… und ich habe die angekreuzt die passen und es ihm gegeben.",1,"1",1,NA,"232",1,"1",3,4,1,1,2,232,1,1,NA,NA,NA,NA,NA,NA,NA,NA,NA,NA,NA,NA,NA,12
"RO12MA","LN","2023-10-25 08:51:44",2,1,5,"Ich wollte eigentlich zu meinem Seminar gehen, doch wollte er mit mir in seinem Büro mit mir sprechen.",1,"232",1,"1","1",1,NA,3,23,232,1,1,1,1,2,NA,NA,NA,NA,NA,NA,NA,NA,NA,NA,NA,NA,NA,18
