"id","rater","date","episode","event","situation","content","social","init-char","init-no","init-gender","reci-char","reci-no","reci-gender","type","quality","init_char_1","init_no_1","init_gender_1","reci_char_1","reci_no_1","reci_gender_1","init_char_2","init_no_2","init_gender_2","reci_char_2","reci_no_2","reci_gender_2","init_char_3","init_no_3","init_gender_3","reci_char_3","reci_no_3","reci_gender_3","quality_2","wordcount"
"KT07HN","LN","2023-10-31 23:59:59",1,1,0,"Ich habe mich im Laufe des Tages noch an den Traum von gestern Nacht erinnern können. Zumindest an grobe Teile und das Ende.     Ich war im Haus meiner Großeltern Mütterlicherseits (M) (in einem vergangenen Traum waren es die Väterlicherseits(V)). Tatsächlich habe ich schon öfter in verschiedenen Versionen Träume in dem Haus gehabt, in denen ich jenes Haus im Traumverlauf verlassen habe.   Diesmal war ich da mit meinem Cousin V und meinem Cousin M, meiner Schwester und meiner Oma. Es waren auch ein paar andere Personen dabei, allerdings kann ich diese nicht mehr genau zuordnen.",NA,NA,NA,NA,NA,NA,NA,NA,NA,NA,NA,NA,NA,NA,NA,NA,NA,NA,NA,NA,NA,NA,NA,NA,NA,NA,NA,NA,94
"KT07HN","LN","2023-10-31 23:59:59",1,1,1,"Ich war im Traumverlauf dann dabei meine Tasche zu Packen und ich hab meine Schwester gebeten, mir aus der oberen Etage (ich glaube) meine Kamera im Rucksack mitzubringen.",1,"1",1,NA,"212","1","2",3,16,1,1,2,212,1,2,NA,NA,NA,NA,NA,NA,NA,NA,NA,NA,NA,NA,NA,28
"KT07HN","LN","2023-10-31 23:59:59",1,1,2,"Sie hatte diesen aber nicht gefunden und ich hatte es dann erneut beschrieben, obwohl sie genau wusste wonach sie schauen sollte.",1,"1",1,NA,"212","1","2",5,4,1,1,2,212,1,2,NA,NA,NA,NA,NA,NA,NA,NA,NA,NA,NA,NA,NA,21
"KT07HN","LN","2023-10-31 23:59:59",1,1,3,"Die Kamera war aber wohl nicht in dem Rucksack, sie hatte sie nun aber gefunden und mit runter gebracht.",1,"212",1,2,"1","1",NA,3,14,212,1,2,1,1,2,NA,NA,NA,NA,NA,NA,NA,NA,NA,NA,NA,NA,NA,19
"KT07HN","LN","2023-10-31 23:59:59",1,1,4,"Sie ging vor nach draußen.",1,"212",1,2,"1","1",NA,1,NA,212,1,2,1,1,2,NA,NA,NA,NA,NA,NA,NA,NA,NA,NA,NA,NA,NA,5
"KT07HN","LN","2023-10-31 23:59:59",1,1,5,"Irgendwas hab ich mit meiner Oma auch noch gemacht, unterhalten oder sowas; wir waren in ihrer Küche.",1,"1",1,NA,"214","1","2",5,4,1,1,2,214,1,2,NA,NA,NA,NA,NA,NA,NA,NA,NA,NA,NA,NA,NA,17
"KT07HN","LN","2023-10-31 23:59:59",1,1,7,"Dann hab ich mich gefreut nun auch endlich raus zu gehen, da war ne Menge los. Und ich wollte Fotos machen.",0,NA,NA,NA,NA,NA,NA,NA,NA,NA,NA,NA,NA,NA,NA,NA,NA,NA,NA,NA,NA,NA,NA,NA,NA,NA,NA,NA,21
"KT07HN","LN","2023-10-31 23:59:59",1,1,6,"Ich glaube meine Schwester war nochmal reingekommen und hatte mich gedrängt mitzukommen.",1,"212",1,2,"1","1",NA,3,4,212,1,2,1,1,2,NA,NA,NA,NA,NA,NA,NA,NA,NA,NA,NA,NA,NA,12
"KT07HN","LN","2023-10-31 23:59:59",1,2,1,"Draußen jedenfalls waren meine beiden Cousins an und in Gehegen. Meine Großeltern haben eine relativ große Wiese im Garten, allerdings waren die Dimensionen im Traum um einiges größer. Da waren also Tiergehege mit verschiedenen Tieren. Ich mag Tierfotografie ja total. Aber es waren keine Standard Zoogehege. Mehr wie im Wildpark, aber zum Zeil waren die Zeune nur Kniehoch. Dort waren jedenfalls Krähen und sowas wie Graureiher. Eben ein paar größere Vögel.",1,"214",2,4,"1","1",NA,1,NA,214,2,4,1,1,2,NA,NA,NA,NA,NA,NA,NA,NA,NA,NA,NA,NA,NA,71
"KT07HN","LN","2023-10-31 23:59:59",1,2,2,"Und ich wollte mir gerade eine gute Fotoperspektive suchen, da ist mit der eine Reiher/Pelikan aufgefallen, der komplette weiß und blind war. Eventuell von den Orks aus Herr der Ringe inspiriert. Ich fand das total interessant, …",0,NA,NA,NA,NA,NA,NA,NA,NA,NA,NA,NA,NA,NA,NA,NA,NA,NA,NA,NA,NA,NA,NA,NA,NA,NA,NA,NA,37
"KT07HN","LN","2023-10-31 23:59:59",1,2,999,"… bin allerdings aufgewacht, bevor ich ein Bild machen konnte.",NA,NA,NA,NA,NA,NA,NA,NA,NA,NA,NA,NA,NA,NA,NA,NA,NA,NA,NA,NA,NA,NA,NA,NA,NA,NA,NA,NA,10
"KT07HN","LN","2023-10-31 23:59:59",1,2,3,"Achso und meine Familienmitglieder haben die Vögel zum Teil gestreichelt und angeschaut, eventuell auch gefüttert. Waren also eher unvorsichtig im Umgang, das war für mich in dem Moment aber völlig normal.",1,"214",2,4,"1","1",NA,1,NA,214,2,4,1,1,2,NA,NA,NA,NA,NA,NA,NA,NA,NA,NA,NA,NA,NA,31
