"id","rater","date","episode","event","situation","content","social","init-char","init-no","init-gender","reci-char","reci-no","reci-gender","type","quality","init_char_1","init_no_1","init_gender_1","reci_char_1","reci_no_1","reci_gender_1","init_char_2","init_no_2","init_gender_2","reci_char_2","reci_no_2","reci_gender_2","init_char_3","init_no_3","init_gender_3","reci_char_3","reci_no_3","reci_gender_3","quality_2","wordcount"
"BA08AD","LN","2023-09-28 07:22:53",1,1,1,"ich habe gerträumt, dass mein Bruder, Papa und ich an einem mir bekannten Ort frühstücken waren. Wir saßen draußen am Wasser und haben drinnen unser Essen bestellt. Neben uns sass ein Gast aus dem Café in dem ich arbeite.",1,"1",1,NA,"211, 212",1,1,4,4,1,1,2,NA,1,1,NA,NA,NA,NA,NA,NA,NA,NA,NA,NA,NA,NA,NA,39
"BA08AD","LN","2023-09-28 07:22:53",1,1,2,"Mein Bruder und ich haben meinen Papa angemeckert, weil er seil Rührei noch nicht essen wollte - es sollte noch eine Person kommen - aber wir fanden es sinnlos, dass er wartet bis das Ei kalt ist.",1,"1, 212",1,1,"211",1,1,3,22,NA,1,1,211,1,1,NA,NA,NA,NA,NA,NA,NA,NA,NA,NA,NA,NA,NA,37
"BA08AD","LN","2023-09-28 07:22:53",1,1,3,"Dann hat sich der Herr vom Nachbartisch eingemischt und auch gesagt, dass mein Papa ruhig essen kann.  In meinem Traum hatte ich das Gefühl, dass er diese andere Person begeistern will indem er wartet, weiß aber nicht welche Person noch kommen sollte.",1,"232",1,1,"211",1,1,3,4,232,1,1,211,1,1,NA,NA,NA,NA,NA,NA,NA,NA,NA,NA,NA,NA,NA,42
"BA08AD","LN","2023-09-28 07:22:53",1,1,4,"Zuletzt kann ich mich erinnern, dass ich drinnen Pfeffer holen wollte weil die Eier ungewürzt waren, dann bin ich aber wach geworden oder habe aufgehört zu träumen.   Meine Gefühle waren eher positiv, auch wenn ich genervt von meinem Papa war",0,NA,NA,NA,NA,NA,NA,NA,NA,NA,NA,NA,NA,NA,NA,NA,NA,NA,NA,NA,NA,NA,NA,NA,NA,NA,NA,NA,40
"BA08AD","LN","2023-09-29 18:39:41",1,1,1,"Heute Nacht habe ich verschiedene Träume geträumt, kann mich aber nur an den letzten Traum erinnern. Der war unspektakulär und hat in der Küche auf meiner Arbeit stattgefunden. Ich war alleine und habe Zimtschnecken gebacken und mit Glasur bestrichen. Arbeiten musste ich jedoch heute nicht.",0,NA,NA,NA,NA,NA,NA,NA,NA,NA,NA,NA,NA,NA,NA,NA,NA,NA,NA,NA,NA,NA,NA,NA,NA,NA,NA,NA,45
"BA08AD","LN","2023-10-01 07:07:21",1,1,0,"Ich habe geträumt, dass ich in Hamburg in einem Container festhänge bzw. das Haus in dem ich mich befand aus mehreren Containern bestand. Wegen eines starken Unwetters/Regen hing ich in diesem Container fest.",NA,NA,NA,NA,NA,NA,NA,NA,NA,NA,NA,NA,NA,NA,NA,NA,NA,NA,NA,NA,NA,NA,NA,NA,NA,NA,NA,NA,33
"BA08AD","LN","2023-10-01 07:07:21",1,1,1,"Wenn ich die Tür aufgemacht habe, konnte ich auf den Hafen gucken, war aber noch über die Landungsbrücken mit dem ""Festland"" verbunden.",0,NA,NA,NA,NA,NA,NA,NA,NA,NA,NA,NA,NA,NA,NA,NA,NA,NA,NA,NA,NA,NA,NA,NA,NA,NA,NA,NA,22
"BA08AD","LN","2023-10-01 07:07:21",1,2,1,"Dann gab es aus meinem Container eine Tür zu einem Massagestudio …",0,NA,NA,NA,NA,NA,NA,NA,NA,NA,NA,NA,NA,NA,NA,NA,NA,NA,NA,NA,NA,NA,NA,NA,NA,NA,NA,NA,12
"BA08AD","LN","2023-10-01 07:07:21",1,2,2,"… und um trocken zu werden habe ich mir einen Termin bei einem Mädchen (ca. 19 Jahre, kenne ich nicht) gemacht.",1,"1",1,NA,"3",1,2,5,4,1,1,2,3,1,2,NA,NA,NA,NA,NA,NA,NA,NA,NA,NA,NA,NA,NA,21
"BA08AD","LN","2023-10-01 07:07:21",1,2,3,"In dem Raum, indem ich massiert werden sollte habe ich dann gemerkt, dass sie nicht freiwillig da ist und habe sie dann drauf angesprochen â€¦ sie wurde von ihrem Bruder gezwungen dort zu arbeiten.",1,"1",1,NA,"3",1,2,5,4,1,1,2,3,1,2,NA,NA,NA,NA,NA,NA,NA,NA,NA,NA,NA,NA,NA,34
"BA08AD","LN","2023-10-01 07:07:21",1,2,4,"Ich wollte sie daraufhin befreien, was auch ohne Probleme gekappt hat.",1,"1",1,NA,"3",1,2,3,14,1,1,2,3,1,2,NA,NA,NA,NA,NA,NA,NA,NA,NA,NA,NA,NA,NA,11
"BA08AD","LN","2023-10-01 07:07:21",1,3,1,"Nur dass als wir den Container mit Fahrrädern verlassen haben, in einem Wald wie Efteling (der Freizeitpark) gelandet sind.",1,"1",1,NA,"3",1,2,4,4,1,1,2,3,1,2,NA,NA,NA,NA,NA,NA,NA,NA,NA,NA,NA,NA,NA,19
"BA08AD","LN","2023-10-01 07:07:21",1,3,2,"Dort habe ich mich von dem Mädchen und ihrer Freundin verabschiedet und bin weggefahren.",1,"1",1,NA,"3, 4",1,2,5,4,1,1,2,NA,1,2,NA,NA,NA,NA,NA,NA,NA,NA,NA,NA,NA,NA,NA,14
"BA08AD","LN","2023-10-01 07:07:21",2,1,1,"Gefühlt direkt danach habe ich geträumt, dass ich mit der kleinen Cousine von meinem Freund Latein lerne (ihr Nachhilfe gebe) während mein Freund auf ihre kleine Schwester aufpasst. Die war in meinem Traum  aber ein Baby und somit ca 10 Jahre jünger als in ""Realität"".   Die Nachhilfe habe ich ihr bei ihren Eltern gegeben. Wir saßen am Esstisch und mein Freund im Wohnzimmer. Meine Gefühle waren eher neutral als negativ und ich hatte zu keiner Zeit, soweit ich mich erinnere, ein ungutes Gefühl.",1,"1",1,NA,"232",1,2,5,14,1,1,2,232,1,2,NA,NA,NA,NA,NA,NA,NA,NA,NA,NA,NA,NA,NA,83
"BA08AD","LN","2023-10-02 07:26:12",1,1,1,"Ich habe von einer Reise nach Thailand geträumt. Es ging los mit einem angenehmen Flug, zu dem ich aber keine Details erinnern kann.",0,NA,NA,NA,NA,NA,NA,NA,NA,NA,NA,NA,NA,NA,NA,NA,NA,NA,NA,NA,NA,NA,NA,NA,NA,NA,NA,NA,23
"BA08AD","LN","2023-10-02 07:26:12",1,2,1,"Danach bin ich mit meiner Schwester rumgereist und wir haben verschiedene Inseln erkundigt. Irgendwie ging die Zeit wie im Flug um und ich kann mich nur an den Prozess und nicht Details, wie zB Gespräche oder ähnliches erinnern.   Meine Gefühle waren sogar eher neutral. Also ich hatte jetzt kein euphorisches Gefühl oder so",1,"1",1,NA,"212",1,2,4,4,1,1,2,212,1,2,NA,NA,NA,NA,NA,NA,NA,NA,NA,NA,NA,NA,NA,53
"BA08AD","LN","2023-10-03 12:41:10",1,1,1,"Ich bin mit dem Auto über eine lange Landstraße gefahren. Ich saß alleine im Auto. Es war dunkel und ich war auf dem Heimweg aber kann mich nicht erinnern wo ich hergekommen bin. Ich weiß nur, dass ich gut drauf war und zu lauter Musik gejammt habe.",0,NA,NA,NA,NA,NA,NA,NA,NA,NA,NA,NA,NA,NA,NA,NA,NA,NA,NA,NA,NA,NA,NA,NA,NA,NA,NA,NA,47
"BA08AD","LN","2023-10-03 12:41:10",1,1,2,"Aus dem Nichts wurde ich dann zum ersten Mal geblitzt. Zum Glück war ich in meinem Traum nur ein paar km/h zu schnell und wusste, dass ich keine schlimmeren Konsequenzen rechnen muss.",0,NA,NA,NA,NA,NA,NA,NA,NA,NA,NA,NA,NA,NA,NA,NA,NA,NA,NA,NA,NA,NA,NA,NA,NA,NA,NA,NA,32
"BA08AD","LN","2023-10-03 12:41:10",1,1,999,"Als ich wach geworden bin, musste ich erstmal nachdenken  ob das Traum oder Realität war, jedoch bin ich am Vorabend gar kein Auto gefahren.",NA,NA,NA,NA,NA,NA,NA,NA,NA,NA,NA,NA,NA,NA,NA,NA,NA,NA,NA,NA,NA,NA,NA,NA,NA,NA,NA,NA,24
"BA08AD","LN","2023-10-04 20:56:57",1,1,0,"In meinem Traum heute Nacht bin ich mit einem Aufzug durch verschiedene Momente gefallen bzw. immer wenn ich auf einer Etage war, habe ich mich in einer neuen Situation befunden. Ich habe den Traum aber nicht am Stück geträumt, sondern ein paar Momente immer wieder durchlebt. Vielleicht kann ich mich aber auch nicht erinnern. In den meisten Momenten war ich alleine aber ein paar mal war auch meine beste Freundin dabei. Wenn ich eine neue Etage erkunden wollte, bin ich quasi zurück gesprungen. Ich hatte das Gefühl den Traum steuern zu wollen, jedoch hat das nicht funktioniert. Ich bin dabei kurz vor meiner Aufwach-Phase gewesen. Genauere Details weiß ich leider nicht mehr eher kann ich dieses Gefühl erinnern, nicht zu wissen, wie es weiter geht, was mich sauer gemacht hat.",NA,NA,NA,NA,NA,NA,NA,NA,NA,NA,NA,NA,NA,NA,NA,NA,NA,NA,NA,NA,NA,NA,NA,NA,NA,NA,NA,NA,130
"BA08AD","LN","2023-10-07 07:51:30",1,1,0,"Ich habe geträumt, dass ich mit meiner Mama in den Urlaub geflogen bin.",NA,NA,NA,NA,NA,NA,NA,NA,NA,NA,NA,NA,NA,NA,NA,NA,NA,NA,NA,NA,NA,NA,NA,NA,NA,NA,NA,NA,13
"BA08AD","LN","2023-10-07 07:51:30",1,1,1,"Wir sind zusammen zum Flughafen gebracht worden …",1,"1",1,NA,"211",1,2,4,4,1,1,2,211,1,2,NA,NA,NA,NA,NA,NA,NA,NA,NA,NA,NA,NA,NA,8
"BA08AD","LN","2023-10-07 07:51:30",1,1,2,"… und dort dann durch die Kontrolle. In der Kontrolle wurde ich von einer älteren Dame gefragt, worin es in dem Buch geht, welches ich in meiner Tasche hatte. Ich habe es ihr erzählt, kann mich aber nicht erinnern welches Buch es im Traum war.",1,"4",1,2,"1",1,NA,5,4,4,1,2,1,1,2,NA,NA,NA,NA,NA,NA,NA,NA,NA,NA,NA,NA,NA,45
"BA08AD","LN","2023-10-07 07:51:30",1,1,3,"Dann haben wir irgendwann unseren Flug genommen. Ich war eigentlich gelassen und meine Mama hatte Angst, dass wir unseren Flug verpassen - wozu es keinen Grund zur Annahme gab.",1,"1",1,NA,"211",1,2,4,4,1,1,2,211,1,2,NA,NA,NA,NA,NA,NA,NA,NA,NA,NA,NA,NA,NA,29
"BA08AD","LN","2023-10-07 07:51:30",1,2,1,"Als wir gelandet sind …",1,"1",1,NA,"211",1,2,4,4,1,1,2,211,1,2,NA,NA,NA,NA,NA,NA,NA,NA,NA,NA,NA,NA,NA,5
"BA08AD","LN","2023-10-07 07:51:30",1,2,2,"… wurden wir abgeholt und zu einem kleinen Hotel gebracht.",1,"1",1,NA,"211",1,2,4,4,1,1,2,211,1,2,NA,NA,NA,NA,NA,NA,NA,NA,NA,NA,NA,NA,NA,10
"BA08AD","LN","2023-10-07 07:51:30",1,2,999,"Ich glaube wir waren auf einer Insel aber genau weiß ich es nicht mehr. Danach kann ich mi h nicht mehr erinnern.",NA,NA,NA,NA,NA,NA,NA,NA,NA,NA,NA,NA,NA,NA,NA,NA,NA,NA,NA,NA,NA,NA,NA,NA,NA,NA,NA,NA,22
"BA08AD","LN","2023-10-08 20:55:54",1,1,1,"Ich war in meinem Traum auf meiner Arbeit und habe den Laden geputzt. Dabei war ich mit meiner Lieblingskollegin zusammen. Wir haben währenddessen die ganze Zeit gequatscht.",1,"1",1,NA,"232",1,2,5,4,1,1,2,232,1,2,NA,NA,NA,NA,NA,NA,NA,NA,NA,NA,NA,NA,NA,27
"BA08AD","LN","2023-10-08 20:55:54",1,2,1,"Dann irgendwann ist Loki von Marvel vorbeigekommen und hat uns mitgenommen. Ich weiß nicht ob wir in der Zeit gereist sind oder nur an einem anderen Ort gegangen sind. Ich kann mich auch nicht genau daran erinnern was wir gemacht haben.",1,"3",1,1,"1, 232",1,2,4,4,3,1,1,NA,1,2,NA,NA,NA,NA,NA,NA,NA,NA,NA,NA,NA,NA,NA,41
"BA08AD","LN","2023-10-08 20:55:54",1,3,0,"Soweit ich weiß, war ich mal Loki selber und mal war ich selber mit ihm unterwegs. Der Traum hat sich sehr lange angefühlt - also das wir sehr lange unterwegs waren - jedoch weiß ich nicht ganz genau was immer wieder geschah, dass es sich so lange angefühlt hat. Ich bin in der Nacht auch sehr sehr oft aufgewacht, jedoch war meine Stimmung nicht negativ oder ängstlich. Ich weiß nur, dass wenn ich wach war ich genervt war, dass ich so viel geträumt habe und mein Kopf quasi keine Ruhe gibt. Was weiterhin mit meiner Kollegin passiert ist, erinnere ich nicht.",NA,NA,NA,NA,NA,NA,NA,NA,NA,NA,NA,NA,NA,NA,NA,NA,NA,NA,NA,NA,NA,NA,NA,NA,NA,NA,NA,NA,101
"BA08AD","LN","2023-10-09 12:32:35",1,1,1,"Ich habe geträumt, dass meine beste Freundin als Profilbild ein Foto mit ihrem Exfreund bei WhatsApp hatte. Ich war dann total sauer auf sie, weil er ihr in der Vergangenheit nicht gut getan hat. Als ich das gesehen habe, habe ich ihr direkt geschrieben, jedoch weiß ich nicht ob sie mir geantwortet hat. Ich lag in dem Moment bei mir zu Hause auf dem Bett. Leider kann ich nicht mehr erinnern und mein Traum war somit sehr kurz.",1,"1",1,NA,"231",1,2,3,32,1,1,2,231,1,2,NA,NA,NA,NA,NA,NA,NA,NA,NA,NA,NA,NA,NA,78
"BA08AD","LN","2023-10-10 20:38:29",1,1,1,"Ich habe geträumt, dass ich auf einem Markt war und dort von zwei Männern verfolgt wurde. Der Markt war in einem anderen Land und dort gab es die Tradition, dass Hühner die Füße abgehackt wurden.",1,"4",2,1,"1, 22",1,1,3,21,4,2,1,NA,1,1,NA,NA,NA,NA,NA,NA,NA,NA,NA,NA,NA,NA,NA,35
"BA08AD","LN","2023-10-10 20:38:29",1,1,2,"Dann wollten diese Männer mich mit den Füßen abwerfen und ich habe mich unter der Decke versteckt.",1,"4",2,1,"1, 22",1,1,3,21,4,2,1,NA,1,1,NA,NA,NA,NA,NA,NA,NA,NA,NA,NA,NA,NA,NA,17
"BA08AD","LN","2023-10-10 20:38:29",1,1,999,"Ich war mit meinen Freund unterwegs aber wir haben uns nicht unterhakten. Die Männer haben mich zwar verfolgt, jedoch habe ich mich nicht bedroht gefühlt. Nachdem ich mich versteckt habe, wurde ich wach, weil mein Freund meinte dass ich ganz oft hintereinander Beine Beine Beine geschrien habe.",NA,NA,NA,NA,NA,NA,NA,NA,NA,NA,NA,NA,NA,NA,NA,NA,NA,NA,NA,NA,NA,NA,NA,NA,NA,NA,NA,NA,47
"BA08AD","LN","2023-10-11 21:20:54",1,1,1,"Ich habe geträumt, dass ich mein Traumstudium abgeschlossen habe bzw gerade mein Physikum bestanden habe. Mein Freund hatte mit mir studiert und wir kamen gerade aus einem alten Gebäude raus und haben Bilder vor der Tür bei strahlendem Sonnenschein gemacht. Ich kann mich an keine Gespräche erinnern sondern vielmehr an den Moment, indem ich unendlich glücklich war. Ich habe zwei mich als eigene Person wahrgenommen, jedoch eher von außen auf den Moment geschaut.",1,"1",1,NA,"22",1,1,4,31,1,1,2,22,1,1,NA,NA,NA,NA,NA,NA,NA,NA,NA,NA,NA,NA,NA,73
"BA08AD","LN","2023-10-12 07:41:20",1,1,1,"In meinen Traum heute Nacht war ich Physiotherapeutin und habe die Nationalmannschaft bei einem Fußballspiel begleitet. Ich glaube das Spiel war in Deutschland, weil sehr viele Deutschland Fans anwesend waren. Das komische war, dass ich nicht nur als Physio anwesend war, sondern auch die Jungs gecoacht habe. Irgendwie war die Stimmung nicht besonders gut ...",1,"1",1,NA,"3",2,4,3,4,1,1,2,3,2,4,NA,NA,NA,NA,NA,NA,NA,NA,NA,NA,NA,NA,NA,55
"BA08AD","LN","2023-10-12 07:41:20",1,2,1,"… und dann stand ich auf einmal am Spielfeldrand und habe irgendwelche Sachen geschrien. Ich war zwar gar nicht euphorisch sondern eher gelassen, obwohl ich da in einem riesen Stadion stand.",1,"1",1,NA,"3",2,4,3,4,1,1,2,3,2,4,NA,NA,NA,NA,NA,NA,NA,NA,NA,NA,NA,NA,NA,31
"BA08AD","LN","2023-10-12 07:41:20",1,3,1,"Nach dem Spiel kam meine Tochter zu mir gerannt aber ich weiß nicht wie sie hieß oder wer der Vater war.",1,"4",1,2,"1",1,NA,3,15,4,1,2,1,1,2,NA,NA,NA,NA,NA,NA,NA,NA,NA,NA,NA,NA,NA,21
