"id","rater","date","episode","event","situation","content","social","init-char","init-no","init-gender","reci-char","reci-no","reci-gender","type","quality","init_char_1","init_no_1","init_gender_1","reci_char_1","reci_no_1","reci_gender_1","init_char_2","init_no_2","init_gender_2","reci_char_2","reci_no_2","reci_gender_2","init_char_3","init_no_3","init_gender_3","reci_char_3","reci_no_3","reci_gender_3","quality_2","wordcount"
"HL03PT","IN",2023-08-19 07:34:15,1,1,1,"Ein Verflossener (Situationship im Jahr 2021) schrieb mir eine Nachricht per WhatsApp, während ich vor der Tür meines Elternhaus stand mit den Worten „ich bin in deiner Gegend sollen wir uns sehen, aber falls wir uns sehen werden, sag mir früh genug Bescheid, da ich ein Defibrillator vorher besorgen muss.“",1,"232",1,1,"1",1,NA,3,15,232,1,1,1,1,2,NA,NA,NA,NA,NA,NA,NA,NA,NA,NA,NA,NA,NA,50
"HL03PT","IN",2023-08-19 07:34:15,1,1,2,"Auf meine Frage, was er mit meinem Defibrillator machen möchte, schrieb er zurück „ich konsumiere derzeit sehr viel, um sportlich meine höchste Leistung zu erreichen und für andere Aktivitäten setzt mein Herz aus.“",1,"1",1,NA,"232",1,"1",5,4,1,1,2,232,1,1,NA,NA,NA,NA,NA,NA,NA,NA,NA,NA,NA,NA,NA,33
"HL03PT","IN",2023-08-19 07:34:15,2,1,0,"Als ich die Nachricht las, brach dieser Traum ab und ich war auf einmal auf einer Party, an einem Ort, der mich nicht bekannt war, aber mit dem Wissen von der o.g. Nachricht.",NA,NA,NA,NA,NA,NA,NA,NA,NA,NA,NA,NA,NA,NA,NA,NA,NA,NA,NA,NA,NA,NA,NA,NA,NA,NA,NA,NA,33
"HL03PT","IN",2023-08-19 07:34:15,2,1,1,"Es waren permanent eine Reihe an Männer um mich herum, die alle nach meiner Aufmerksamkeit jagten. Ich, immer auf der Suche nach der Flucht,",1,"4",1,1,"1",1,NA,3,24,4,1,1,1,1,2,NA,NA,NA,NA,NA,NA,NA,NA,NA,NA,NA,NA,NA,24
"HL03PT","IN",2023-08-19 07:34:15,2,1,2,"versteckte mich bei meiner Mutter.",1,"1",1,NA,"211",1,"2",3,16,1,1,2,211,1,2,NA,NA,NA,NA,NA,NA,NA,NA,NA,NA,NA,NA,NA,5
"HL03PT","IN",2023-08-19 07:34:15,2,2,1,"Auf einmal traf ich erneut einen Mann (Phi), den ich 2022 gedatet habe. Er war sehr erfreut darüber, mich wiederzusehen. Ich hatte da noch eher gemischte Gefühle, da ich damals das Ganze beendet habe.",1,"1",1,NA,"232",1,"1",5,4,1,1,2,232,1,1,NA,NA,NA,NA,NA,NA,NA,NA,NA,NA,NA,NA,NA,34
"HL03PT","IN",2023-08-19 07:34:15,2,2,2,"Er ging auf die Toilette",0,NA,NA,NA,NA,NA,NA,NA,NA,NA,NA,NA,NA,NA,NA,NA,NA,NA,NA,NA,NA,NA,NA,NA,NA,NA,NA,NA,5
"HL03PT","IN",2023-08-19 07:34:15,2,2,3,"und ich holte mir in der Zwischenzeit ein Eis mit allem möglichen drauf (Karamellsoße, Karamellwaffel, Vanilleeis (was ich nicht mag) und Sahne). Als ich das Eis mit meiner Mutter holte,",1,"1",1,NA,"211",1,"2",4,4,1,1,2,211,1,2,NA,NA,NA,NA,NA,NA,NA,NA,NA,NA,NA,NA,NA,30
"HL03PT","IN",2023-08-19 07:34:15,2,2,4,"kam der besagte Mann (Phi) wieder und versuchte ein Gespräch mit meiner Mutter anzufangen,",1,"232",1,1,"211",1,"2",5,4,232,1,1,211,1,2,NA,NA,NA,NA,NA,NA,NA,NA,NA,NA,NA,NA,NA,14
"HL03PT","IN",2023-08-19 07:34:15,2,2,5,"ich fragte ihn wieso er so sehr danach strebt das Gespräch aufrechtzuerhalten, geschweige wieso er mit meiner Mutter sprach, daraufhin er „ich habe nie aufgehört nicht an dich zu denken und wenn das jetzt wieder mein Moment ist, um dich zu kämpfen, dann mache ich es.“ Ich fühlte mich in der Situation überhaupt nicht wohl",1,"1",1,NA,"232",1,"1",5,32,1,1,2,232,1,1,NA,NA,NA,NA,NA,NA,NA,NA,NA,NA,NA,NA,NA,55
"HL03PT","IN",2023-08-19 07:34:15,2,2,6,"aber wollte auch nicht gehen, da er mir die andere Männer vom Leib hielt, womit ich mich definitiv wohler fühlte.",0,NA,NA,NA,NA,NA,NA,NA,NA,NA,NA,NA,NA,NA,NA,NA,NA,NA,NA,NA,NA,NA,NA,NA,NA,NA,NA,NA,20
"HL03PT","IN",2023-08-20 07:37:42,1,1,1,"Ich liege im Krankenhaus und habe mein Baby auf dem Arm. Es ist ein Mädchen. Meine Mama saß neben mir. Das Krankenhaus sah aber nicht aus wie eins, alles war offen und man ging aus dem Zimmer und war direkt in einem Park.",1,"211, 213",1,2,"1",1,NA,1,NA,NA,1,2,1,1,2,NA,NA,NA,NA,NA,NA,NA,NA,NA,NA,NA,NA,NA,43
"HL03PT","IN",2023-08-20 07:37:42,1,1,2,"Draußen stand eine gute Freundin mit ihrem Sohn (1 Jahr alt) und ihrem Hund und haben auf mich gewartet,",1,"231",1,2,"1",1,NA,1,NA,231,1,2,1,1,2,NA,NA,NA,NA,NA,NA,NA,NA,NA,NA,NA,NA,NA,19
"HL03PT","IN",2023-08-20 07:37:42,1,1,3,"bis ich mit meiner Tochter rauskam.  Ich ging raus, wir wurden herzlich begrüßt",1,"231",1,2,"1",1,NA,3,15,231,1,2,1,1,2,NA,NA,NA,NA,NA,NA,NA,NA,NA,NA,NA,NA,NA,13
"HL03PT","IN",2023-08-20 07:37:42,1,1,4,"und dann musste ich auch schon wieder aufs Zimmer um sie zu Stillen.",0,NA,NA,NA,NA,NA,NA,NA,NA,NA,NA,NA,NA,NA,NA,NA,NA,NA,NA,NA,NA,NA,NA,NA,NA,NA,NA,NA,13
"HL03PT","IN",2023-08-20 07:37:42,1,1,5,"Das mit dem Stillen funktionierte nicht wie gehofft. Ich war frustriert und wütend auf mich.",0,NA,NA,NA,NA,NA,NA,NA,NA,NA,NA,NA,NA,NA,NA,NA,NA,NA,NA,NA,NA,NA,NA,NA,NA,NA,NA,NA,15
"HL03PT","IN",2023-08-20 07:37:42,1,1,6,"Meine Mutter legte ein Stillhütchen an und half mir dabei, dass meine Tochter gestillt werden kann. Es hat funktioniert.",1,"211",1,2,"1",1,NA,3,14,211,1,2,1,1,2,NA,NA,NA,NA,NA,NA,NA,NA,NA,NA,NA,NA,NA,19
"HL03PT","IN",2023-08-20 07:37:42,1,1,7,"Dadurch das ich noch sehr geschwächt von der Geburt war, schlief ich etwas",0,NA,NA,NA,NA,NA,NA,NA,NA,NA,NA,NA,NA,NA,NA,NA,NA,NA,NA,NA,NA,NA,NA,NA,NA,NA,NA,NA,13
"HL03PT","IN",2023-08-20 07:37:42,1,1,8,"und meine Mutter ging mit meiner Tochter spazieren.",0,NA,NA,NA,NA,NA,NA,NA,NA,NA,NA,NA,NA,NA,NA,NA,NA,NA,NA,NA,NA,NA,NA,NA,NA,NA,NA,NA,8
"HL03PT","IN",2023-08-20 07:37:42,1,1,9,"Als sie wieder kam habe sie wieder gestillt.",1,"1",1,NA,"213",1,"2",3,14,1,1,2,213,1,2,NA,NA,NA,NA,NA,NA,NA,NA,NA,NA,NA,NA,NA,8
"HL03PT","IN",2023-08-20 07:37:42,1,1,999,"Traum zu ende.     Als Info ich bin noch keine Mutter.",NA,NA,NA,NA,NA,NA,NA,NA,NA,NA,NA,NA,NA,NA,NA,NA,NA,NA,NA,NA,NA,NA,NA,NA,NA,NA,NA,NA,10
"HL03PT","IN",2023-08-21 07:24:48,1,1,1,"Ich lag im Bett. Das Fenster war offen und von dort aus kam ein Jinn (Islam) rein",0,NA,NA,NA,NA,NA,NA,NA,NA,NA,NA,NA,NA,NA,NA,NA,NA,NA,NA,NA,NA,NA,NA,NA,NA,NA,NA,NA,17
"HL03PT","IN",2023-08-21 07:24:48,1,1,2,"und wollte Besitz von mir ergreifen (ich sah ihn mit einen Augen er war über mir). Ich fühlte mich so hilflos.",0,NA,NA,NA,NA,NA,NA,NA,NA,NA,NA,NA,NA,NA,NA,NA,NA,NA,NA,NA,NA,NA,NA,NA,NA,NA,NA,NA,21
"HL03PT","IN",2023-08-21 07:24:48,1,1,3,"Konnte mich nicht bewegen wollte  Allahuakbar  rufen doch ich konnte nicht mals mehr sprechen.",0,NA,NA,NA,NA,NA,NA,NA,NA,NA,NA,NA,NA,NA,NA,NA,NA,NA,NA,NA,NA,NA,NA,NA,NA,NA,NA,NA,14
"HL03PT","IN",2023-08-21 07:24:48,1,1,4,"Wollte mein Handy nehmen um eine Sure anzumachen auch das ging nicht.",0,NA,NA,NA,NA,NA,NA,NA,NA,NA,NA,NA,NA,NA,NA,NA,NA,NA,NA,NA,NA,NA,NA,NA,NA,NA,NA,NA,12
"HL03PT","IN",2023-08-21 07:24:48,1,1,999,"Ich bin mit schrecken und Herzrasen wach geworden.",NA,NA,NA,NA,NA,NA,NA,NA,NA,NA,NA,NA,NA,NA,NA,NA,NA,NA,NA,NA,NA,NA,NA,NA,NA,NA,NA,NA,8
"HL03PT","IN",2023-08-23 08:14:18,1,1,0,"Der Traum war ein bisschen unstrukturiert. Ich hatte viele Sprünge (von Ort zu Ort ohne einen Sinn).   Ich war im Traum in meinem Elternhaus, aber es sah nicht aus wie sonst. Deutlich größer und eher wie Gebäude mit vielen Etagen und Verschachtelungen.",NA,NA,NA,NA,NA,NA,NA,NA,NA,NA,NA,NA,NA,NA,NA,NA,NA,NA,NA,NA,NA,NA,NA,NA,NA,NA,NA,NA,42
"HL03PT","IN",2023-08-23 08:14:18,1,2,1,"An einem Ort war ein Schönheitswettbewerb, wo ich eigentlich eingetragen bin aber vor Beginn keine Lust mehr hatte, denen eine Show zu bieten.",0,NA,NA,NA,NA,NA,NA,NA,NA,NA,NA,NA,NA,NA,NA,NA,NA,NA,NA,NA,NA,NA,NA,NA,NA,NA,NA,NA,23
"HL03PT","IN",2023-08-23 08:14:18,1,3,1,"Ich lief weiter durch das Gebäude",0,NA,NA,NA,NA,NA,NA,NA,NA,NA,NA,NA,NA,NA,NA,NA,NA,NA,NA,NA,NA,NA,NA,NA,NA,NA,NA,NA,6
"HL03PT","IN",2023-08-23 08:14:18,1,3,2,"und entdeckte meinen Ex-Partner (getrennt seit 2018).",1,"232",1,1,"1",1,NA,1,NA,232,1,1,1,1,2,NA,NA,NA,NA,NA,NA,NA,NA,NA,NA,NA,NA,NA,7
"HL03PT","IN",2023-08-23 08:14:18,1,3,3,"Er hat eine Freundin, schrieb mir aber im Traum ein Tag vorher das Er mich sehen möchte.",1,"232",1,1,"1",1,NA,3,15,232,1,1,1,1,2,NA,NA,NA,NA,NA,NA,NA,NA,NA,NA,NA,NA,NA,17
"HL03PT","IN",2023-08-23 08:14:18,1,3,4,"Ich habe ihn mit einer guten Freundin beobachtet.",1,"232",1,1,"1, 231",1,"2",1,NA,232,1,1,NA,1,2,NA,NA,NA,NA,NA,NA,NA,NA,NA,NA,NA,NA,NA,8
"HL03PT","IN",2023-08-23 08:14:18,1,4,1,"Dann passierte eine Reihe an Ereignissen die sehr komisch waren. Aus dem Nichts hatte ich einen riesen Streit mit ihm, wurde beleidigt",1,"1",1,NA,"232",1,"1",5,32,1,1,2,232,1,1,NA,NA,NA,NA,NA,NA,NA,NA,NA,NA,NA,NA,NA,22
"HL03PT","IN",2023-08-23 08:14:18,1,4,2,"und die Freundin kam hinzu und wollte sich prügeln.",1,"231",1,1,"5",3,"4",3,21,231,1,1,5,3,4,NA,NA,NA,NA,NA,NA,NA,NA,NA,NA,NA,NA,NA,9
"HL03PT","IN",2023-08-23 08:14:18,1,4,3,"Bin lediglich aus der Situation gegangen.",0,NA,NA,NA,NA,NA,NA,NA,NA,NA,NA,NA,NA,NA,NA,NA,NA,NA,NA,NA,NA,NA,NA,NA,NA,NA,NA,NA,6
"HL03PT","IN",2023-08-23 08:14:18,1,5,1,"Dann kam ein Mann (mit ihm bin ich gerade in der Kennenlernphase) und wollte ebenfalls Streit suchen.",1,"232",1,1,"1",1,NA,3,32,232,1,1,1,1,2,NA,NA,NA,NA,NA,NA,NA,NA,NA,NA,NA,NA,NA,17
"HL03PT","IN",2023-08-23 08:14:18,1,6,1,"Ich bin aus dem Gebäude gegangen,",0,NA,NA,NA,NA,NA,NA,NA,NA,NA,NA,NA,NA,NA,NA,NA,NA,NA,NA,NA,NA,NA,NA,NA,NA,NA,NA,NA,6
"HL03PT","IN",2023-08-23 08:14:18,1,6,2,"zum Parkplatz gelaufen",0,NA,NA,NA,NA,NA,NA,NA,NA,NA,NA,NA,NA,NA,NA,NA,NA,NA,NA,NA,NA,NA,NA,NA,NA,NA,NA,NA,3
"HL03PT","IN",2023-08-23 08:14:18,1,6,3,"und habe mich ins Auto gesetzt.",0,NA,NA,NA,NA,NA,NA,NA,NA,NA,NA,NA,NA,NA,NA,NA,NA,NA,NA,NA,NA,NA,NA,NA,NA,NA,NA,NA,6
"HL03PT","IN",2023-08-24 08:55:17,1,1,1,"Ich war mit einer Freundin (E) und ihrem Ex-Freund bei meiner Mutter, da wir uns fertig machen wollten für die Hochzeit einer gemeinsamen Freundin.",1,"1",1,NA,"231, 232",1,"2, 1",4,4,1,1,2,NA,1,NA,NA,NA,NA,NA,NA,NA,NA,NA,NA,NA,NA,NA,NA,24
"HL03PT","IN",2023-08-24 08:55:17,1,1,2,"Der Ex-Freund von Freundin E kann im echten Leben kein Wort deutsch, im Traum sprach er jedoch mit meiner Mama auf deutsch. Sie sagte ihn, dass er sich alle Anziehsachen meines Bruders nehmen kann besonders die T-Shirts, da meine Brüder sie nicht mehr anziehen werden.",1,"211",1,2,"231",1,"1",5,14,211,1,2,231,1,1,NA,NA,NA,NA,NA,NA,NA,NA,NA,NA,NA,NA,NA,45
"HL03PT","IN",2023-08-24 08:55:17,1,1,3,"Währenddessen E und ich uns fertigmachten, fiel mir auf, dass die Freundin (A) gestern Geburtstag hatte und wir nicht an sie dachten.",1,"1",1,NA,"231",1,"2",4,4,1,1,2,231,1,2,NA,NA,NA,NA,NA,NA,NA,NA,NA,NA,NA,NA,NA,22
"HL03PT","IN",2023-08-24 08:55:17,1,1,4,"Somit war ich keine Brautjungfer mehr.",0,NA,NA,NA,NA,NA,NA,NA,NA,NA,NA,NA,NA,NA,NA,NA,NA,NA,NA,NA,NA,NA,NA,NA,NA,NA,NA,NA,6
"HL03PT","IN",2023-08-24 08:55:17,1,2,1,"Auf dem Weg zur Hochzeit. Wir gingen auf einem Schiff, wo sie getraut wurde.",0,NA,NA,NA,NA,NA,NA,NA,NA,NA,NA,NA,NA,NA,NA,NA,NA,NA,NA,NA,NA,NA,NA,NA,NA,NA,NA,NA,14
"HL03PT","IN",2023-08-24 08:55:17,1,2,2,"Ich habe sehr lange meinen Platz gesucht,",0,NA,NA,NA,NA,NA,NA,NA,NA,NA,NA,NA,NA,NA,NA,NA,NA,NA,NA,NA,NA,NA,NA,NA,NA,NA,NA,NA,7
"HL03PT","IN",2023-08-24 08:55:17,1,2,3,"als ich dann merkte, mein Platz sei mit den Rücken zum  Altar  war ich sehr entrüstet.",0,NA,NA,NA,NA,NA,NA,NA,NA,NA,NA,NA,NA,NA,NA,NA,NA,NA,NA,NA,NA,NA,NA,NA,NA,NA,NA,NA,16
"HL03PT","IN",2023-08-24 08:55:17,1,2,4,"Am Platz angekommen, schaute ich nach draußen und sah zwei Damen mit einem Hijab während sie jeweils einen ganzen Kuchen aßen. Ich war sehr verwundert darüber.",1,"4",2,2,"1",1,NA,1,NA,4,2,2,1,1,2,NA,NA,NA,NA,NA,NA,NA,NA,NA,NA,NA,NA,NA,26
"HL03PT","IN",2023-08-24 08:55:17,1,2,5,"Im gleichen Moment fielen mir Gläser auf dem Kopf, da direkt über mir weitere Gäste saßen.",0,NA,NA,NA,NA,NA,NA,NA,NA,NA,NA,NA,NA,NA,NA,NA,NA,NA,NA,NA,NA,NA,NA,NA,NA,NA,NA,NA,16
"HL03PT","IN",2023-08-24 08:55:17,1,2,6,"Die Trauung war vorbei.",0,NA,NA,NA,NA,NA,NA,NA,NA,NA,NA,NA,NA,NA,NA,NA,NA,NA,NA,NA,NA,NA,NA,NA,NA,NA,NA,NA,4
"HL03PT","IN",2023-08-24 08:55:17,2,1,1,"Ich war aus dem Nichts auf ein Feld und ich hatte das Gefühl, ich werde verfolgt,",0,NA,NA,NA,NA,NA,NA,NA,NA,NA,NA,NA,NA,NA,NA,NA,NA,NA,NA,NA,NA,NA,NA,NA,NA,NA,NA,NA,16
"HL03PT","IN",2023-08-24 08:55:17,2,1,2,"aber es passierte nichts.",0,NA,NA,NA,NA,NA,NA,NA,NA,NA,NA,NA,NA,NA,NA,NA,NA,NA,NA,NA,NA,NA,NA,NA,NA,NA,NA,NA,4
"HL03PT","IN",2023-08-24 08:55:17,2,2,1,"Eine Freundin von vor 15 Jahren kam auf einmal und sagte, den Baum hätte sie als Hochzeitsgeschenk, ob ich ihn nicht eben einpflanzen könnte.",1,"232",1,2,"1",1,NA,3,16,232,1,2,1,1,2,NA,NA,NA,NA,NA,NA,NA,NA,NA,NA,NA,NA,NA,24
"HL03PT","IN",2023-08-24 08:55:17,2,2,2,"Somit buddelte ich mit meinen Händen ein Loch",0,NA,NA,NA,NA,NA,NA,NA,NA,NA,NA,NA,NA,NA,NA,NA,NA,NA,NA,NA,NA,NA,NA,NA,NA,NA,NA,NA,8
"HL03PT","IN",2023-08-24 08:55:17,2,2,3,"und anstelle des Baumes legte sie nur Nagellacke in das Loch. Danach war der Traum vorbei.",1,"232",1,2,"1",1,NA,1,NA,232,1,2,1,1,2,NA,NA,NA,NA,NA,NA,NA,NA,NA,NA,NA,NA,NA,16
"HL03PT","IN",2023-08-26 10:11:00,1,1,1,"Traum in der Nacht geträumt.   Im Traum war ich ständig auf der Flucht vor irgendwelchen Männern (ich kenne leider den Grund nicht mehr).",1,"4",1,2,"1",1,NA,3,21,4,1,2,1,1,2,NA,NA,NA,NA,NA,NA,NA,NA,NA,NA,NA,NA,NA,23
"HL03PT","IN",2023-08-26 10:11:00,1,1,2,"Primär habe ich mich ständig in einem Riesen großen Aquarium versteckt",0,NA,NA,NA,NA,NA,NA,NA,NA,NA,NA,NA,NA,NA,NA,NA,NA,NA,NA,NA,NA,NA,NA,NA,NA,NA,NA,NA,11
"HL03PT","IN",2023-08-26 10:11:00,1,1,3,"zeitgleich habe ich auch Sachen unter Wasser erledigt",0,NA,NA,NA,NA,NA,NA,NA,NA,NA,NA,NA,NA,NA,NA,NA,NA,NA,NA,NA,NA,NA,NA,NA,NA,NA,NA,NA,8
"HL03PT","IN",2023-08-26 10:11:00,1,1,4,"und mich mit anderen Unterhalten.",1,"1",1,NA,"5",2,"4",5,4,1,1,2,5,2,4,NA,NA,NA,NA,NA,NA,NA,NA,NA,NA,NA,NA,NA,5
"HL03PT","IN",2023-08-26 10:11:00,1,2,1,"Irgendwann hatte ich keine Kraft mehr unter Wasser zu leben und wurde von den Männern gefasst.",1,"4",1,2,"1",1,NA,3,21,4,1,2,1,1,2,NA,NA,NA,NA,NA,NA,NA,NA,NA,NA,NA,NA,NA,16
"HL03PT","IN",2023-08-26 10:11:00,1,2,2,"Da ich aber in der Zwischenzeit, wo ich auf der Flucht war, auf ihre Frauen aufgepasst habe sowie deren Kinder,",1,"1",1,NA,"5",2,"4",3,14,1,1,2,5,2,4,NA,NA,NA,NA,NA,NA,NA,NA,NA,NA,NA,NA,NA,20
"HL03PT","IN",2023-08-26 10:11:00,1,2,3,"ließen sie mich laufen. (Keiner der Personen kannte ich und im Traum hatte ich eine Glatze).",1,"4",1,2,"1",1,NA,3,31,4,1,2,1,1,2,NA,NA,NA,NA,NA,NA,NA,NA,NA,NA,NA,NA,NA,16
"HL03PT","IN",2023-08-28 14:43:49,1,1,1,"Aus dem Nichts kam meine Frisörin zu mir an einem Ort den ich nicht kannte.",1,"3",1,2,"1",1,NA,5,4,3,1,2,1,1,2,NA,NA,NA,NA,NA,NA,NA,NA,NA,NA,NA,NA,NA,15
"HL03PT","IN",2023-08-28 14:43:49,1,1,2,"Sie beschwerte sich über meine Haare, warum ich nicht wie besprochen nach sechs Wochen gekommen bin.  Ich erwiderte, dass ich mich nicht von meinen blonden Haaren trennen möchte.",1,"3",1,2,"1",1,NA,5,4,3,1,2,1,1,2,NA,NA,NA,NA,NA,NA,NA,NA,NA,NA,NA,NA,NA,28
"HL03PT","IN",2023-08-28 14:43:49,1,1,3,"Wir haben uns dann dazu entschlossen, dass ich wieder zurück zum Braun gehe.",1,"3",1,2,"1",1,NA,5,4,3,1,2,1,1,2,NA,NA,NA,NA,NA,NA,NA,NA,NA,NA,NA,NA,NA,13
"HL03PT","IN",2023-08-28 14:43:49,2,1,1,"Dann brach der Traum ab und ich war in einem Spieleparadies.",0,NA,NA,NA,NA,NA,NA,NA,NA,NA,NA,NA,NA,NA,NA,NA,NA,NA,NA,NA,NA,NA,NA,NA,NA,NA,NA,NA,11
"HL03PT","IN",2023-08-29 12:33:05,1,1,1,"Traum in der Nacht:  Meine Mutter und ich standen in einer Fleischerei um Wurst und Fleisch für die Woche einzukaufen.",1,"1",1,NA,"211",1,"2",4,4,1,1,2,211,1,2,NA,NA,NA,NA,NA,NA,NA,NA,NA,NA,NA,NA,NA,20
"HL03PT","IN",2023-08-29 12:33:05,1,1,2,"Ich bestellte verschiedene Arten von Wurst,",0,NA,NA,NA,NA,NA,NA,NA,NA,NA,NA,NA,NA,NA,NA,NA,NA,NA,NA,NA,NA,NA,NA,NA,NA,NA,NA,NA,6
"HL03PT","IN",2023-08-29 12:33:05,1,1,3,"die Bedienerin ließ mich jedes Wurststück probieren.",1,"3",1,2,"1",1,NA,3,14,3,1,2,1,1,2,NA,NA,NA,NA,NA,NA,NA,NA,NA,NA,NA,NA,NA,7
"HL03PT","IN",2023-08-29 12:33:05,1,2,1,"Auf einmal fing meine Mutter an, mit ihren Fingern in das abgedeckt Hackfleisch zu piksen.",1,"211",1,2,"1",1,NA,1,NA,211,1,2,1,1,2,NA,NA,NA,NA,NA,NA,NA,NA,NA,NA,NA,NA,NA,15
"HL03PT","IN",2023-08-29 12:33:05,1,2,2,"Die Bedienerin bat meine Mama es zu unterlassen, doch sie führte es fort.",1,"3",1,2,"211",1,"2",4,4,3,1,2,211,1,2,NA,NA,NA,NA,NA,NA,NA,NA,NA,NA,NA,NA,NA,13
"HL03PT","IN",2023-08-29 12:33:05,1,2,3,"Mir wurde es allmählich unangenehm und beendete den Einkauf.",0,NA,NA,NA,NA,NA,NA,NA,NA,NA,NA,NA,NA,NA,NA,NA,NA,NA,NA,NA,NA,NA,NA,NA,NA,NA,NA,NA,9
"HL03PT","IN",2023-08-29 12:33:05,1,3,1,"Als wir den Laden verließen, entstand draußen ein Aufruf an Menschen, die Panikartig flüchteten.",1,"4",2,4,"1",1,NA,1,NA,4,2,4,1,1,2,NA,NA,NA,NA,NA,NA,NA,NA,NA,NA,NA,NA,NA,14
"HL03PT","IN",2023-08-29 12:33:05,1,3,2,"Ich schaute zum Himmel, er war stark erleuchtet und die Meteoriten prallten auf die Erde zu.",0,NA,NA,NA,NA,NA,NA,NA,NA,NA,NA,NA,NA,NA,NA,NA,NA,NA,NA,NA,NA,NA,NA,NA,NA,NA,NA,NA,16
"HL03PT","IN",2023-08-29 12:33:05,1,3,3,"Ich packe meine Mama, sie packte mich",1,"1",1,NA,"211",1,"2",5,4,1,1,2,211,1,2,NA,NA,NA,NA,NA,NA,NA,NA,NA,NA,NA,NA,NA,7
"HL03PT","IN",2023-08-29 12:33:05,1,3,4,"und wir fingen an zu rennen.",1,"1",1,NA,"211",1,"2",4,4,1,1,2,211,1,2,NA,NA,NA,NA,NA,NA,NA,NA,NA,NA,NA,NA,NA,6
"HL03PT","IN",2023-08-29 12:33:05,1,3,5,"Die Umgebung war keine vertraute Umgebung und somit wusste ich nicht, wo ich lang laufen sollte um zu unseren Zuhause zu kommen.",0,NA,NA,NA,NA,NA,NA,NA,NA,NA,NA,NA,NA,NA,NA,NA,NA,NA,NA,NA,NA,NA,NA,NA,NA,NA,NA,NA,22
"HL03PT","IN",2023-08-29 12:33:05,1,4,1,"Nach langer Zeit des Rennens, sind wir angekommen.",1,"1",1,NA,"211",1,"2",4,4,1,1,2,211,1,2,NA,NA,NA,NA,NA,NA,NA,NA,NA,NA,NA,NA,NA,8
"HL03PT","IN",2023-08-29 12:33:05,1,4,2,"Auf einmal veränderte sich die Gegebenheit und es fing an einer Stelle an zu regnen, an der anderen Stelle brannte es lichterloh",0,NA,NA,NA,NA,NA,NA,NA,NA,NA,NA,NA,NA,NA,NA,NA,NA,NA,NA,NA,NA,NA,NA,NA,NA,NA,NA,NA,22
"HL03PT","IN",2023-08-29 12:33:05,1,4,3,"und dann schaute ich nach hinten wo die Sonne schien.",0,NA,NA,NA,NA,NA,NA,NA,NA,NA,NA,NA,NA,NA,NA,NA,NA,NA,NA,NA,NA,NA,NA,NA,NA,NA,NA,NA,10
"HL03PT","IN",2023-08-29 12:33:05,1,4,4,"Ich war so durcheinander das ich ins Haus ging und einfach nur schlafen wollte.",0,NA,NA,NA,NA,NA,NA,NA,NA,NA,NA,NA,NA,NA,NA,NA,NA,NA,NA,NA,NA,NA,NA,NA,NA,NA,NA,NA,14
"HL03PT","IN",2023-08-30 05:58:46,1,1,1,"Ich war mit meiner besten Freundin auf dem Weg nach Hause. Wir mussten einen unüblichen Weg gehe, da der eigentliche gesperrt war.",1,"1",1,NA,"231",1,"2",4,4,1,1,2,231,1,2,NA,NA,NA,NA,NA,NA,NA,NA,NA,NA,NA,NA,NA,22
"HL03PT","IN",2023-08-30 05:58:46,1,1,2,"Wir liefen an einem großen Hof vorbei wo draußen Prostituierte standen mit einem Freiher und zwei Kampfhunden.",1,"3",2,3,"1, 231",1,"2",1,NA,3,2,3,NA,1,2,NA,NA,NA,NA,NA,NA,NA,NA,NA,NA,NA,NA,NA,17
"HL03PT","IN",2023-08-30 05:58:46,1,1,3,"Ich wusste das wir schneller weiter laufen müssen, da wir sonst auch Prostituierte werden müssen.",0,NA,NA,NA,NA,NA,NA,NA,NA,NA,NA,NA,NA,NA,NA,NA,NA,NA,NA,NA,NA,NA,NA,NA,NA,NA,NA,NA,15
"HL03PT","IN",2023-08-30 05:58:46,1,1,4,"Meine beste Freundin schaute aus Neugier zurück.",1,"231",1,2,"1",1,NA,1,NA,231,1,2,1,1,2,NA,NA,NA,NA,NA,NA,NA,NA,NA,NA,NA,NA,NA,7
"HL03PT","IN",2023-08-30 05:58:46,1,1,5,"Ich zog sie mit.",1,"1",1,NA,"231",1,"2",3,4,1,1,2,231,1,2,NA,NA,NA,NA,NA,NA,NA,NA,NA,NA,NA,NA,NA,4
"HL03PT","IN",2023-08-30 05:58:46,1,2,1,"Nach kurze Zeit merkte ich, dass wir verfolgt werden. Beide Prostituierte und der Mann mit den Kampfhunden liefen hinter uns.",1,"3",2,3,"1, 231",1,"2",3,21,3,2,3,NA,1,2,NA,NA,NA,NA,NA,NA,NA,NA,NA,NA,NA,NA,NA,20
"HL03PT","IN",2023-08-30 05:58:46,1,2,2,"Keine Menschenseele zu sehen. Felder links und rechts.",0,NA,NA,NA,NA,NA,NA,NA,NA,NA,NA,NA,NA,NA,NA,NA,NA,NA,NA,NA,NA,NA,NA,NA,NA,NA,NA,NA,8
"HL03PT","IN",2023-08-30 05:58:46,1,2,3,"Auf einmal sprang einer der Hunde mich von hinten an.",0,NA,NA,NA,NA,NA,NA,NA,NA,NA,NA,NA,NA,NA,NA,NA,NA,NA,NA,NA,NA,NA,NA,NA,NA,NA,NA,NA,10
"HL03PT","IN",2023-08-30 05:58:46,1,2,4,"Ich blieb stehen und fragte was deren Problem sei.",0,NA,NA,NA,NA,NA,NA,NA,NA,NA,NA,NA,NA,NA,NA,NA,NA,NA,NA,NA,NA,NA,NA,NA,NA,NA,NA,NA,9
"HL03PT","IN",2023-08-30 05:58:46,1,2,5,"Er lies den anderen Hund auf meine Freundin los,",0,NA,NA,NA,NA,NA,NA,NA,NA,NA,NA,NA,NA,NA,NA,NA,NA,NA,NA,NA,NA,NA,NA,NA,NA,NA,NA,NA,9
"HL03PT","IN",2023-08-30 05:58:46,1,2,6,"sie konnte ihn aber bändigen und streichelte ihn.",1,"231",1,2,"1",1,NA,1,NA,231,1,2,1,1,2,NA,NA,NA,NA,NA,NA,NA,NA,NA,NA,NA,NA,NA,8
"HL03PT","IN",2023-08-30 05:58:46,1,2,7,"Der Mann sagte „ihr gehört hier nicht hin. Was sucht ihr in solche Gegenden. Ihr wisst, wenn ihr einmal hier lang läuft, gehört ihr dazu.“",1,"3",1,1,"1",1,NA,3,22,3,1,1,1,1,2,NA,NA,NA,NA,NA,NA,NA,NA,NA,NA,NA,NA,NA,25
"HL03PT","IN",2023-08-30 05:58:46,1,2,8,"ich diskutiere mit ihm hin und her und er merkte das wir keine Frauen sind die sich bändigen lassen.",1,"1",1,NA,"3",1,"1",5,4,1,1,2,3,1,1,NA,NA,NA,NA,NA,NA,NA,NA,NA,NA,NA,NA,NA,19
"HL03PT","IN",2023-08-30 05:58:46,1,2,9,"Er ließ uns gehen.",0,NA,NA,NA,NA,NA,NA,NA,NA,NA,NA,NA,NA,NA,NA,NA,NA,NA,NA,NA,NA,NA,NA,NA,NA,NA,NA,NA,4
