"id","date","dream","nightmare","mood","content","datetime","dayCounter","n_epi","n_eve","n_sit","dreamSocSit","dreamSocInt","multi","realMulti","inter","nAva2sin","nAva3sin","nAva4sin","nAva5sin","nAva2gro","nAva3gro","nAva4gro","nAva5gro","nAvaUns","famAva","unfAva","unsAva","wordcount","wordPerSit","sitPerEve","evePerEpi","n_socEve"
"VL08ZK",2023-10-26,1,2,3,"Ich habe geträumt, dass ich in meinem Zimmer bin, aber dieses Zimmer ähnelt nicht meinem echten. Im Traum hat es sich allerdings so angefühlt. Die Wände waren weiß, links neben der Tür war mein Schreibtisch, rechts neben der Tür mein Bett, gegenüber der Tür auf der anderen Wandseite war eine Miniküche. Das Zimmer war so ähnlich wie ein kleines Studentenwohnheim aufgebaut. Es war nachts und ich habe versucht zu schlafen. ",1698299400,1,1,1,1,0,0,0,0,0,0,0,0,0,0,0,0,0,0,0,0,0,70,70,1,1,NA
"VL08ZK",2023-10-27,NA,NA,NA,NA,NA,2,NA,NA,NA,NA,NA,NA,NA,NA,NA,NA,NA,NA,NA,NA,NA,NA,NA,NA,NA,NA,NA,NA,NA,NA,NA
"VL08ZK",2023-10-28,1,2,3,"Ich war im Zug auf dem Weg zur Uni. Es hat sehr stark geschneit. Zudem war ich im Zug mit einer mir bekannten Person. Diese hatte mir Fragen gestellt zu den Routen. Als ich ihre Frage beantworten wollte, verschwand sie und ich stand auf um auszusteigen. Danach bin ich aufgewacht.",1698474660,3,1,1,4,1,1,0,0,1,1,0,0,0,0,0,0,0,0,1,0,0,54,13.5,4,1,1
"VL08ZK",2023-10-29,1,2,3,"Ich bin sehr viel gerannt in einem Haus mit mehreren Stockwerken, weil eine Freundin mich immer in andere Stockwerke gerufen hat. ",1698587220,4,1,1,1,1,1,0,0,1,1,0,0,0,0,0,0,0,0,1,0,0,21,21,1,1,1
"VL08ZK",2023-10-30,1,2,2,"Ich hab geträumt, dass eine Fledermaus in unserem Haus war in der Nacht. Daraufhin musste ich sie aus der Tür geschmissen und schnell die Tür zugezogen. ",1698651060,5,1,1,2,0,0,0,0,0,0,0,0,0,0,0,0,0,0,0,0,0,26,13,2,1,NA
"VL08ZK",2023-10-31,1,2,2,"Ich hab an meiner ehemaligen Schule (sie sah im Traum aber moderner und größer aus) eine Freundin gesucht, die Hilfe gebraucht hat und auf der Suche nach ihr habe ich auch andere Leute gefragt. Die haben allerdings immer gesagt, dass sie nicht wüssten wo sie wäre und es ihnen auch egal sei. Das hat mich im Traum etwas verärgert und verwirrt. Irgendwann bin ich aufgewacht.",1698738960,6,1,1,1,1,1,1,1,1,0,0,0,1,0,0,0,0,1,0,0,1,65,65,1,1,1
"VL08ZK",2023-11-01,1,2,4,"Ich war auf einem Fest unserer Schule und da hatten wir verschiedene Stände aufgestellt. An diesen Ständen konnte man Sachen gewinnen. Das hat die Leute sehr gefreut.",1698823980,7,1,1,1,1,1,1,0,0,0,0,0,1,0,0,0,0,1,0,0,1,27,27,1,1,1
"VL08ZK",2023-11-02,2,-77,-77,"-66",1698910200,8,NA,NA,NA,NA,NA,NA,NA,NA,NA,NA,NA,NA,NA,NA,NA,NA,NA,NA,NA,NA,NA,NA,NA,NA,NA
"VL08ZK",2023-11-03,1,2,3,"Ich hab geträumt, dass ich etwas in der Küche gekocht/gebackt habe und das hab ich mit einer Freundin von mir gemacht, die ich länger nicht gesehen habe, aber immer schreibe/mit ihr telefoniere. Ich weiß auch noch, dass uns immer irgendwelche Zutaten gefehlt haben, aber ich weiß nicht mehr was gefehlt hat/was wir gebacken haben oder in welcher Küche wir waren.",1699015860,9,1,1,1,1,1,1,0,0,1,0,0,0,0,0,0,0,0,1,0,0,60,60,1,1,1
"VL08ZK",2023-11-04,2,-77,-77,"-66",1699084620,10,NA,NA,NA,NA,NA,NA,NA,NA,NA,NA,NA,NA,NA,NA,NA,NA,NA,NA,NA,NA,NA,NA,NA,NA,NA
"VL08ZK",2023-11-05,1,2,4,"Ich hab geträumt, dass ich mit einer Freundin bei einem Formel 1 Rennen war und wir dort an einem der Stände etwas verkauft haben. Allerdings weiß ich nur, dass ich eine Cap verkauft habe und nicht mehr mit wem ich geredet habe.",1699194960,11,1,1,1,1,1,1,0,0,1,0,0,0,0,0,0,0,0,1,0,0,42,42,1,1,1
"VL08ZK",2023-11-06,1,2,2,"Ich war in meinem Traum beim Sport (ich betreibe Kampfsport). Ich habe meinen Trainer gesehen und er hat meine Gruppe ermahnt und meinte wir sollen uns alle verbessern. Ich weiß, dass ich ihm Traum nach Hause gelaufen bin und das stressig für mich war. Ich wollte mich im Sport verbessern. Als ich zuhause angekommen bin, habe ich versucht die Übungen nachzumachen von dem Tag, bin danach aber wieder aufgewacht.",1699267380,12,1,3,4,1,1,0,0,1,1,0,0,0,0,0,0,0,0,1,0,0,69,17.25,1.33333333333333,3,1
"VL08ZK",2023-11-07,1,2,3,"Ich hab heute wieder etwas bezüglich des Trainings geträumt. Diesmal waren wir aber nicht in der Halle, in der wir Sport machen, sondern in einem kleinen Raum, wo man unterrichtet wird. Es war aber etwas chaotisch in dem Raum. Der Trainer ist manchmal rausgegangen, dann waren einige Schüler weg. In dem Raum waren an der Wand Stühle, keine Tische und gegenüber von den Stühlen eine Tafel. Wir haben also nichts besprochen oder gesagt, es sind nur immer wieder Personen aus dem Raum gegangen und zurückgekommen. Ich weiß, aber das alle wieder zurückgekommen sind irgendwann und man nicht komplett weggehen durfte. Man musste schon in der Nähe bleiben. Auch ich durfte nicht nach Hause gehen, sondern durfte nur den Raum verlassen. Außerhalb des Raumes gab es noch einen Raum mit einer Toilette. Ich selbst blieb im Raum und hab mich nur umgeschaut.",1699345800,13,1,1,4,2,0,0,0,0,0,1,1,0,0,0,1,0,0,0,3,0,143,35.75,4,1,1
"VL08ZK",2023-11-08,1,2,2,"Ich hab geträumt, dass ich auf einer Hochzeit war und dort unter anderem meine Freunde gesehen habe. Da habe ich auch mit ihnen an einem Tisch geredet. Dann kam allerdings eine Person, die ich kenne, aber keinen Kontakt habe. Sie ist eine eher aufgerissene Person, die sich mit anderen verbal als auch körperlich auseinandersetzt. Genau das hat sie auch in meinem Traum mit mir versucht. Allerdings ist die Situation schnell eskaliert und bevor es Verletzte gab, bin ich von der Hochzeit geflüchtet und bin nach Hause gegangen.   ",1699446780,14,1,1,5,4,3,2,2,3,4,0,0,0,1,0,0,0,0,5,0,0,89,17.8,5,1,1
"VL08ZK",2023-11-09,2,-77,-77,"-66",1699562160,15,NA,NA,NA,NA,NA,NA,NA,NA,NA,NA,NA,NA,NA,NA,NA,NA,NA,NA,NA,NA,NA,NA,NA,NA,NA
"VL08ZK",2023-11-10,NA,NA,NA,NA,NA,16,NA,NA,NA,NA,NA,NA,NA,NA,NA,NA,NA,NA,NA,NA,NA,NA,NA,NA,NA,NA,NA,NA,NA,NA,NA
"VL08ZK",2023-11-11,1,2,3,"Ich hab geträumt, dass ich in der Türkei krank war. Wir wollten in ein Restaurant und davor habe ich in einem anderen Raum, wo nur ein weißer Schrank und ein roter Teppich war, mit einer Freundin aus Deutschland telefoniert. Wir haben gesprochen wie es uns geht und was andere unserer Freunde gerade wahrscheinlich machen. Als wir aufgelegt haben, wollte ich zu meinen Eltern ins Wohnzimmer laufen. Aber mir ist aufgefallen, dass ich mit meiner Freundin ganz normal telefoniert habe. Das würde normalerweise Geld kosten und der Anruf sollte eigentlich gar nicht erst durchgehen. Daher habe ich hinterfragt, ob ich gerade in der Türkei bin oder in Deutschland. Danach bin ich aufgewacht ohne eine Antwort, ich bin mir aber ziemlich sicher, dass ich in der Türkei war.",1699690080,17,1,1,4,1,1,1,1,1,1,0,0,0,0,0,0,0,0,1,0,0,126,31.5,4,1,1
